stim_num,stim_type,n_srcs,src,is_target,pattern,alt_rate,init_angle
493,SIM,2,11M,False,BOB HELD NINE RED SOCKS,4.0,-90.0
494,SIM,2,8M,True,SUE LOST NINE GREEN CARDS,4.0,-90.0
494,SIM,2,7M,False,JILL TOOK THREE RED PENS,4.0,90.0
495,SIM,2,2M,True,SUE SAW EIGHT CHEAP SOCKS,4.0,-90.0
495,SIM,2,4M,False,JILL TOOK THREE SMALL TOYS,4.0,90.0
496,SIM,2,1M,True,SUE TOOK TWO SMALL SOCKS,4.0,90.0
496,SIM,2,9M,False,LYNN GAVE NINE CHEAP CARDS,4.0,-90.0
497,SIM,2,1M,True,SUE FOUND NINE CHEAP PENS,4.0,-90.0
497,SIM,2,9M,False,BOB TOOK FOUR OLD TOYS,4.0,90.0
498,SIM,2,8M,True,SUE BOUGHT THREE OLD PENS,4.0,-90.0
498,SIM,2,10M,False,LYNN SOLD FOUR RED GLOVES,4.0,90.0
499,SIM,2,4M,True,SUE SOLD THREE BIG TOYS,4.0,90.0
499,SIM,2,8M,False,SAM TOOK TWO GREEN SHOES,4.0,-90.0
500,SIM,2,2M,True,SUE SAW EIGHT OLD SHOES,8.0,-90.0
500,SIM,2,1M,False,LYNN TOOK TWO SMALL BAGS,8.0,90.0
501,SIM,2,7M,True,SUE SOLD TWO BIG SOCKS,8.0,-90.0
501,SIM,2,3M,False,MIKE LOST FIVE NEW GLOVES,8.0,90.0
502,SIM,2,2M,True,SUE LOST THREE CHEAP SHOES,8.0,90.0
502,SIM,2,8M,False,JANE SOLD EIGHT SMALL HATS,8.0,-90.0
503,SIM,2,2M,True,SUE GAVE SIX SMALL SOCKS,8.0,90.0
503,SIM,2,10M,False,LYNN LOST TWO OLD SHOES,8.0,-90.0
504,SIM,2,4M,True,SUE LOST SIX GREEN PENS,8.0,90.0
504,SIM,2,9M,False,JANE FOUND FIVE CHEAP BAGS,8.0,-90.0
505,SIM,2,5M,True,SUE SAW FIVE OLD HATS,8.0,90.0
505,SIM,2,3M,False,LYNN BOUGHT TWO RED GLOVES,8.0,-90.0
506,SIM,2,8M,True,SUE HELD FIVE GREEN HATS,8.0,90.0
506,SIM,2,9M,False,PAT FOUND THREE CHEAP GLOVES,8.0,-90.0
507,SIM,2,2M,True,SUE HELD THREE BIG SOCKS,8.0,-90.0
507,SIM,2,4M,False,BOB TOOK SIX HOT SHOES,8.0,90.0
508,SIM,2,9M,True,SUE FOUND TWO CHEAP SHOES,8.0,90.0
508,SIM,2,5M,False,LYNN GAVE FOUR GREEN SOCKS,8.0,-90.0
509,SIM,2,5M,True,SUE LOST FOUR GREEN SOCKS,8.0,-90.0
509,SIM,2,4M,False,JANE SAW NINE NEW CARDS,8.0,90.0
510,SIM,2,11M,True,SUE TOOK TWO NEW GLOVES,8.0,90.0
510,SIM,2,9M,False,MIKE FOUND FOUR GREEN CARDS,8.0,-90.0
511,SIM,2,8M,True,SUE HELD SIX OLD SOCKS,8.0,90.0
511,SIM,2,11M,False,PAT TOOK THREE NEW SHOES,8.0,-90.0
512,SIM,2,8M,True,SUE GAVE FIVE RED TOYS,8.0,-90.0
512,SIM,2,11M,False,LYNN FOUND TEN SMALL GLOVES,8.0,90.0
513,SIM,2,11M,True,SUE SOLD EIGHT HOT SOCKS,8.0,90.0
513,SIM,2,8M,False,BOB TOOK SIX NEW HATS,8.0,-90.0
514,SIM,2,10M,True,SUE LOST THREE GREEN SOCKS,8.0,-90.0
514,SIM,2,3M,False,MIKE SAW TEN HOT HATS,8.0,90.0
515,SIM,2,4M,True,SUE SOLD NINE SMALL SOCKS,8.0,90.0
515,SIM,2,2M,False,SAM BOUGHT TEN NEW CARDS,8.0,-90.0
516,SIM,2,9M,True,SUE FOUND EIGHT NEW PENS,8.0,-90.0
516,SIM,2,11M,False,MIKE SAW FIVE BIG BAGS,8.0,90.0
517,SIM,2,3M,True,SUE TOOK THREE CHEAP SHOES,8.0,-90.0
517,SIM,2,1M,False,BOB GAVE TEN NEW HATS,8.0,90.0
518,SIM,2,10M,True,SUE SAW NINE OLD BAGS,8.0,-90.0
518,SIM,2,4M,False,JILL HELD FOUR SMALL CARDS,8.0,90.0
519,SIM,2,11M,True,SUE GAVE TEN BIG GLOVES,8.0,90.0
519,SIM,2,8M,False,JANE TOOK FIVE SMALL BAGS,8.0,-90.0
520,SIM,2,8M,True,SUE BOUGHT FIVE SMALL BAGS,8.0,-90.0
520,SIM,2,11M,False,BOB SOLD SIX NEW GLOVES,8.0,90.0
521,SIM,2,9M,True,SUE BOUGHT SIX OLD HATS,8.0,-90.0
521,SIM,2,2M,False,LYNN SOLD EIGHT NEW PENS,8.0,90.0
522,SIM,2,1M,True,SUE SAW FIVE BIG SOCKS,8.0,90.0
522,SIM,2,3M,False,BOB BOUGHT TEN CHEAP HATS,8.0,-90.0
523,SIM,2,5M,True,SUE LOST EIGHT OLD GLOVES,8.0,-90.0
523,SIM,2,11M,False,MIKE FOUND TWO BIG BAGS,8.0,90.0
524,SIM,2,3M,True,SUE BOUGHT TEN HOT TOYS,8.0,-90.0
524,SIM,2,4M,False,JILL LOST SIX CHEAP PENS,8.0,90.0
525,SIM,2,9M,True,SUE SOLD NINE SMALL CARDS,8.0,-90.0
525,SIM,2,11M,False,BOB TOOK EIGHT OLD TOYS,8.0,90.0
526,SIM,2,3M,True,SUE FOUND FIVE NEW CARDS,8.0,-90.0
526,SIM,2,10M,False,SAM SAW EIGHT CHEAP BAGS,8.0,90.0
527,SIM,2,1M,True,SUE BOUGHT TEN CHEAP SHOES,8.0,-90.0
527,SIM,2,2M,False,LYNN SAW NINE SMALL PENS,8.0,90.0
528,SIM,2,1M,True,SUE SOLD NINE CHEAP BAGS,8.0,-90.0
528,SIM,2,4M,False,LYNN SAW TEN SMALL PENS,8.0,90.0
529,SIM,2,11M,True,SUE LOST TWO GREEN TOYS,8.0,90.0
529,SIM,2,8M,False,LYNN FOUND FOUR NEW BAGS,8.0,-90.0
530,SIM,2,10M,True,SUE FOUND SIX GREEN TOYS,8.0,90.0
530,SIM,2,11M,False,JILL GAVE NINE OLD BAGS,8.0,-90.0
531,SIM,2,1M,True,SUE BOUGHT FIVE NEW TOYS,8.0,90.0
531,SIM,2,9M,False,LYNN HELD TEN CHEAP PENS,8.0,-90.0
532,SIM,2,1M,True,SUE SOLD TWO GREEN HATS,8.0,-90.0
532,SIM,2,9M,False,MIKE GAVE TEN CHEAP BAGS,8.0,90.0
533,SIM,2,10M,True,SUE TOOK THREE CHEAP CARDS,8.0,90.0
533,SIM,2,2M,False,LYNN GAVE SIX OLD BAGS,8.0,-90.0
534,SIM,2,9M,True,SUE LOST TEN RED PENS,8.0,-90.0
534,SIM,2,5M,False,SAM GAVE SIX BIG HATS,8.0,90.0
535,SIM,2,1M,True,SUE FOUND TEN NEW SHOES,8.0,90.0
535,SIM,2,2M,False,BOB LOST NINE OLD BAGS,8.0,-90.0
536,SIM,2,9M,True,SUE SAW THREE GREEN SHOES,8.0,-90.0
536,SIM,2,8M,False,BOB TOOK EIGHT SMALL CARDS,8.0,90.0
537,SIM,2,9M,True,SUE GAVE TWO GREEN BAGS,8.0,-90.0
537,SIM,2,2M,False,LYNN SOLD THREE RED HATS,8.0,90.0
538,SIM,2,4M,True,SUE LOST TWO BIG PENS,8.0,90.0
538,SIM,2,7M,False,LYNN HELD FOUR RED SHOES,8.0,-90.0
539,SIM,2,9M,True,SUE BOUGHT THREE RED GLOVES,8.0,90.0
539,SIM,2,11M,False,BOB TOOK TWO GREEN SHOES,8.0,-90.0
540,SIM,2,7M,True,SUE HELD TWO BIG HATS,8.0,-90.0
540,SIM,2,11M,False,MIKE BOUGHT FOUR RED BAGS,8.0,90.0
541,SIM,2,7M,True,SUE FOUND NINE CHEAP BAGS,8.0,90.0
541,SIM,2,11M,False,JANE GAVE TWO OLD HATS,8.0,-90.0
542,SIM,2,4M,True,SUE SOLD FOUR NEW SOCKS,8.0,90.0
542,SIM,2,5M,False,PAT TOOK TWO CHEAP TOYS,8.0,-90.0
543,SIM,2,1M,True,SUE HELD FOUR HOT SOCKS,8.0,-90.0
543,SIM,2,9M,False,JANE SOLD NINE SMALL CARDS,8.0,90.0
544,SIM,2,10M,True,SUE SAW NINE GREEN SHOES,8.0,90.0
544,SIM,2,11M,False,JILL FOUND THREE HOT BAGS,8.0,-90.0
545,SIM,2,4M,True,SUE LOST EIGHT OLD SHOES,8.0,90.0
545,SIM,2,10M,False,SAM SAW NINE RED PENS,8.0,-90.0
546,SIM,2,11M,True,SUE GAVE NINE OLD HATS,8.0,90.0
546,SIM,2,9M,False,JANE HELD SIX SMALL CARDS,8.0,-90.0
547,SIM,2,9M,True,SUE GAVE FIVE NEW SHOES,8.0,90.0
547,SIM,2,4M,False,SAM SAW TWO CHEAP PENS,8.0,-90.0
548,SIM,2,4M,True,SUE SAW FOUR RED BAGS,8.0,90.0
548,SIM,2,2M,False,SAM BOUGHT NINE SMALL TOYS,8.0,-90.0
549,SIM,2,7M,True,SUE SAW NINE GREEN GLOVES,8.0,-90.0
549,SIM,2,5M,False,SAM GAVE THREE HOT HATS,8.0,90.0
550,SIM,2,7M,True,SUE TOOK FOUR NEW SHOES,8.0,-90.0
550,SIM,2,11M,False,MIKE GAVE THREE HOT HATS,8.0,90.0
551,SIM,2,8M,True,SUE GAVE NINE GREEN CARDS,8.0,90.0
551,SIM,2,11M,False,JANE TOOK THREE OLD BAGS,8.0,-90.0
552,SIM,2,10M,True,SUE SOLD NINE BIG PENS,8.0,90.0
552,SIM,2,5M,False,PAT LOST SIX HOT GLOVES,8.0,-90.0
553,SIM,2,10M,True,SUE HELD SIX GREEN TOYS,8.0,-90.0
553,SIM,2,7M,False,LYNN TOOK TWO RED GLOVES,8.0,90.0
554,SIM,2,2M,True,SUE TOOK TEN NEW CARDS,8.0,-90.0
554,SIM,2,5M,False,PAT LOST FOUR OLD PENS,8.0,90.0
555,SIM,2,11M,True,SUE GAVE NINE CHEAP BAGS,8.0,-90.0
555,SIM,2,5M,False,BOB TOOK THREE OLD PENS,8.0,90.0
556,SIM,2,4M,True,SUE SAW TEN OLD HATS,8.0,90.0
556,SIM,2,10M,False,PAT TOOK SIX SMALL TOYS,8.0,-90.0
557,SIM,2,9M,True,SUE BOUGHT FIVE GREEN SOCKS,8.0,90.0
557,SIM,2,4M,False,SAM HELD THREE OLD TOYS,8.0,-90.0
558,SIM,2,5M,True,SUE BOUGHT SIX HOT HATS,8.0,90.0
558,SIM,2,11M,False,BOB FOUND TEN BIG CARDS,8.0,-90.0
559,SIM,2,10M,True,SUE GAVE FOUR CHEAP TOYS,8.0,90.0
559,SIM,2,4M,False,BOB SOLD THREE BIG CARDS,8.0,-90.0
560,SIM,2,10M,True,SUE LOST FOUR BIG CARDS,8.0,90.0
560,SIM,2,11M,False,PAT HELD SIX OLD TOYS,8.0,-90.0
561,SIM,2,5M,True,SUE BOUGHT FIVE RED BAGS,8.0,90.0
561,SIM,2,1M,False,LYNN HELD NINE BIG GLOVES,8.0,-90.0
562,SIM,2,8M,True,SUE SAW THREE SMALL CARDS,8.0,90.0
562,SIM,2,1M,False,LYNN FOUND SIX OLD HATS,8.0,-90.0
563,SIM,2,3M,True,SUE LOST FIVE BIG SHOES,8.0,-90.0
563,SIM,2,2M,False,MIKE SOLD EIGHT CHEAP PENS,8.0,90.0
564,SIM,2,4M,True,SUE HELD THREE GREEN SHOES,8.0,-90.0
564,SIM,2,2M,False,PAT LOST FIVE OLD PENS,8.0,90.0
565,SIM,2,2M,True,SUE SAW SIX BIG GLOVES,8.0,-90.0
565,SIM,2,3M,False,MIKE BOUGHT NINE GREEN CARDS,8.0,90.0
566,SIM,2,3M,True,SUE GAVE EIGHT HOT BAGS,8.0,90.0
566,SIM,2,10M,False,PAT BOUGHT TEN RED HATS,8.0,-90.0
567,SIM,2,8M,True,SUE SAW TWO GREEN HATS,8.0,-90.0
567,SIM,2,9M,False,LYNN LOST FOUR SMALL PENS,8.0,90.0
568,SIM,2,9M,True,SUE FOUND TEN CHEAP BAGS,8.0,90.0
568,SIM,2,8M,False,LYNN BOUGHT THREE NEW SOCKS,8.0,-90.0
569,SIM,2,10M,True,SUE TOOK TWO NEW GLOVES,8.0,90.0
569,SIM,2,8M,False,LYNN LOST THREE SMALL HATS,8.0,-90.0
570,SIM,2,3M,True,SUE SAW FIVE SMALL BAGS,8.0,90.0
570,SIM,2,5M,False,JILL LOST TWO OLD PENS,8.0,-90.0
571,SIM,2,1M,True,SUE LOST THREE CHEAP SOCKS,8.0,90.0
571,SIM,2,2M,False,MIKE SAW FIVE HOT BAGS,8.0,-90.0
572,SIM,2,3M,True,SUE FOUND SIX GREEN SOCKS,8.0,-90.0
572,SIM,2,11M,False,PAT BOUGHT THREE SMALL GLOVES,8.0,90.0
573,SIM,2,5M,True,SUE SAW SIX BIG HATS,8.0,-90.0
573,SIM,2,2M,False,JANE TOOK TWO NEW CARDS,8.0,90.0
574,SIM,2,5M,True,SUE FOUND NINE BIG BAGS,8.0,90.0
574,SIM,2,10M,False,BOB TOOK FIVE RED PENS,8.0,-90.0
575,SIM,2,5M,True,SUE FOUND EIGHT NEW CARDS,8.0,-90.0
575,SIM,2,10M,False,JILL SAW FOUR BIG HATS,8.0,90.0
576,SIM,2,9M,True,SUE HELD EIGHT BIG PENS,8.0,90.0
576,SIM,2,11M,False,LYNN BOUGHT TEN HOT TOYS,8.0,-90.0
577,SIM,2,1M,True,SUE BOUGHT EIGHT BIG CARDS,8.0,90.0
577,SIM,2,4M,False,JILL TOOK SIX OLD PENS,8.0,-90.0
578,SIM,2,3M,True,SUE FOUND NINE HOT BAGS,8.0,90.0
578,SIM,2,8M,False,JANE TOOK FIVE OLD PENS,8.0,-90.0
579,SIM,2,5M,True,SUE SOLD SIX RED BAGS,8.0,90.0
579,SIM,2,9M,False,PAT HELD NINE SMALL CARDS,8.0,-90.0
580,SIM,2,11M,True,SUE SOLD SIX BIG PENS,8.0,90.0
580,SIM,2,4M,False,SAM FOUND NINE CHEAP BAGS,8.0,-90.0
581,SIM,2,8M,True,SUE HELD TWO BIG SHOES,8.0,90.0
581,SIM,2,4M,False,LYNN GAVE SIX RED PENS,8.0,-90.0
582,SIM,2,9M,True,SUE BOUGHT TEN OLD GLOVES,8.0,90.0
582,SIM,2,4M,False,LYNN TOOK NINE BIG BAGS,8.0,-90.0
583,SIM,2,1M,True,SUE HELD FOUR NEW CARDS,8.0,90.0
583,SIM,2,10M,False,SAM BOUGHT SIX OLD SOCKS,8.0,-90.0
584,SIM,2,7M,True,SUE SAW FIVE BIG CARDS,8.0,90.0
584,SIM,2,8M,False,PAT FOUND FOUR HOT TOYS,8.0,-90.0
585,SIM,2,5M,True,SUE GAVE FOUR HOT SOCKS,8.0,90.0
585,SIM,2,3M,False,SAM LOST EIGHT NEW GLOVES,8.0,-90.0
586,SIM,2,9M,True,SUE TOOK TWO BIG HATS,8.0,-90.0
586,SIM,2,10M,False,JANE FOUND THREE HOT TOYS,8.0,90.0
587,SIM,2,8M,True,SUE TOOK TWO RED SOCKS,8.0,90.0
587,SIM,2,1M,False,MIKE FOUND FOUR HOT GLOVES,8.0,-90.0
588,SIM,2,9M,True,SUE LOST EIGHT NEW GLOVES,8.0,90.0
588,SIM,2,1M,False,SAM SAW TWO SMALL CARDS,8.0,-90.0
589,SIM,2,8M,True,SUE SOLD TWO RED SOCKS,8.0,-90.0
589,SIM,2,2M,False,JILL BOUGHT SIX OLD PENS,8.0,90.0
590,SIM,2,9M,True,SUE FOUND THREE GREEN SHOES,8.0,-90.0
590,SIM,2,1M,False,SAM SAW FIVE OLD GLOVES,8.0,90.0
591,SIM,2,4M,True,SUE LOST FIVE NEW TOYS,8.0,90.0
591,SIM,2,5M,False,PAT HELD FOUR CHEAP HATS,8.0,-90.0
592,SIM,2,8M,True,SUE LOST SIX HOT PENS,8.0,-90.0
592,SIM,2,2M,False,PAT TOOK EIGHT NEW TOYS,8.0,90.0
593,SIM,2,4M,True,SUE TOOK TEN NEW TOYS,8.0,90.0
593,SIM,2,9M,False,PAT FOUND THREE HOT CARDS,8.0,-90.0
594,SIM,2,11M,True,SUE SOLD FOUR NEW PENS,8.0,-90.0
594,SIM,2,1M,False,JANE GAVE NINE GREEN SHOES,8.0,90.0
595,SIM,2,7M,True,SUE FOUND NINE HOT BAGS,8.0,-90.0
595,SIM,2,10M,False,LYNN LOST THREE RED GLOVES,8.0,90.0
596,SIM,2,8M,True,SUE FOUND FIVE NEW GLOVES,8.0,90.0
596,SIM,2,7M,False,PAT LOST EIGHT CHEAP BAGS,8.0,-90.0
597,SIM,2,4M,True,SUE BOUGHT THREE NEW CARDS,8.0,-90.0
597,SIM,2,8M,False,PAT SOLD FIVE GREEN TOYS,8.0,90.0
598,SIM,2,11M,True,SUE SOLD THREE NEW CARDS,8.0,-90.0
598,SIM,2,10M,False,JANE HELD FOUR OLD HATS,8.0,90.0
599,SIM,2,2M,True,SUE FOUND EIGHT BIG CARDS,8.0,90.0
599,SIM,2,11M,False,JANE BOUGHT TEN CHEAP TOYS,8.0,-90.0
600,SIM,3,7M,True,SUE SAW THREE CHEAP PENS,0.0,0.0
600,SIM,3,9M,False,JANE FOUND NINE GREEN GLOVES,0.0,0.0
600,SIM,3,2M,False,PAT GAVE SIX HOT CARDS,0.0,0.0
601,SIM,3,9M,True,SUE HELD SIX NEW PENS,0.0,0.0
601,SIM,3,10M,False,PAT BOUGHT THREE RED SHOES,0.0,0.0
601,SIM,3,7M,False,LYNN LOST EIGHT OLD GLOVES,0.0,0.0
602,SIM,3,1M,True,SUE SOLD THREE GREEN CARDS,0.0,0.0
602,SIM,3,10M,False,JANE FOUND EIGHT CHEAP HATS,0.0,0.0
602,SIM,3,5M,False,BOB SAW TWO SMALL SOCKS,0.0,0.0
603,SIM,3,3M,True,SUE HELD EIGHT NEW SHOES,0.0,0.0
603,SIM,3,4M,False,JANE SAW THREE HOT SOCKS,0.0,0.0
603,SIM,3,7M,False,MIKE SOLD TEN OLD BAGS,0.0,0.0
604,SIM,3,7M,True,SUE LOST NINE GREEN PENS,0.0,0.0
604,SIM,3,4M,False,JILL GAVE FOUR SMALL TOYS,0.0,0.0
604,SIM,3,11M,False,MIKE HELD TWO OLD HATS,0.0,0.0
605,SIM,3,10M,True,SUE TOOK NINE OLD SHOES,0.0,0.0
605,SIM,3,8M,False,MIKE LOST FIVE GREEN BAGS,0.0,0.0
605,SIM,3,1M,False,BOB BOUGHT EIGHT BIG TOYS,0.0,0.0
606,SIM,3,5M,True,SUE SAW FOUR OLD TOYS,0.0,0.0
606,SIM,3,4M,False,JILL BOUGHT EIGHT HOT BAGS,0.0,0.0
606,SIM,3,8M,False,BOB GAVE NINE NEW CARDS,0.0,0.0
607,SIM,3,10M,True,SUE SAW FIVE NEW PENS,0.0,0.0
607,SIM,3,8M,False,MIKE HELD SIX SMALL BAGS,0.0,0.0
607,SIM,3,1M,False,JILL SOLD THREE RED TOYS,0.0,0.0
608,SIM,3,1M,True,SUE GAVE THREE RED SOCKS,0.0,0.0
608,SIM,3,2M,False,PAT SOLD FIVE CHEAP PENS,0.0,0.0
608,SIM,3,11M,False,LYNN TOOK NINE OLD SHOES,0.0,0.0
609,SIM,3,11M,True,SUE BOUGHT THREE HOT SHOES,0.0,0.0
609,SIM,3,5M,False,JANE FOUND EIGHT CHEAP BAGS,0.0,0.0
609,SIM,3,9M,False,MIKE LOST SIX RED CARDS,0.0,0.0
610,SIM,3,11M,True,SUE FOUND FIVE RED HATS,0.0,0.0
610,SIM,3,3M,False,JANE SAW EIGHT CHEAP PENS,0.0,0.0
610,SIM,3,5M,False,MIKE HELD TWO BIG BAGS,0.0,0.0
611,SIM,3,1M,True,SUE SAW EIGHT RED GLOVES,0.0,0.0
611,SIM,3,5M,False,SAM HELD THREE OLD CARDS,0.0,0.0
611,SIM,3,2M,False,JILL TOOK NINE BIG BAGS,0.0,0.0
612,SIM,3,1M,True,SUE SAW FOUR GREEN SHOES,0.0,0.0
612,SIM,3,3M,False,MIKE SOLD FIVE HOT CARDS,0.0,0.0
612,SIM,3,7M,False,JILL BOUGHT EIGHT CHEAP BAGS,0.0,0.0
613,SIM,3,5M,True,SUE LOST NINE SMALL TOYS,0.0,0.0
613,SIM,3,10M,False,JILL SOLD FOUR BIG SHOES,0.0,0.0
613,SIM,3,7M,False,JANE TOOK TEN HOT HATS,0.0,0.0
614,SIM,3,10M,True,SUE GAVE EIGHT OLD TOYS,0.0,0.0
614,SIM,3,8M,False,SAM HELD FOUR NEW BAGS,0.0,0.0
614,SIM,3,3M,False,MIKE BOUGHT NINE HOT GLOVES,0.0,0.0
615,SIM,3,9M,True,SUE GAVE TEN BIG BAGS,0.0,0.0
615,SIM,3,3M,False,BOB BOUGHT SIX OLD SHOES,0.0,0.0
615,SIM,3,2M,False,JANE LOST EIGHT HOT CARDS,0.0,0.0
616,SIM,3,11M,True,SUE LOST FOUR BIG HATS,0.0,0.0
616,SIM,3,10M,False,SAM HELD EIGHT CHEAP SHOES,0.0,0.0
616,SIM,3,5M,False,PAT TOOK THREE SMALL BAGS,0.0,0.0
617,SIM,3,3M,True,SUE HELD TEN HOT GLOVES,0.0,0.0
617,SIM,3,4M,False,SAM FOUND EIGHT NEW HATS,0.0,0.0
617,SIM,3,10M,False,JANE GAVE THREE OLD SOCKS,0.0,0.0
618,SIM,3,8M,True,SUE FOUND TEN BIG CARDS,0.0,0.0
618,SIM,3,10M,False,BOB SAW NINE OLD SHOES,0.0,0.0
618,SIM,3,4M,False,LYNN LOST FIVE SMALL BAGS,0.0,0.0
619,SIM,3,10M,True,SUE GAVE EIGHT HOT CARDS,0.0,0.0
619,SIM,3,5M,False,JILL BOUGHT FIVE OLD PENS,0.0,0.0
619,SIM,3,7M,False,LYNN FOUND TEN RED SHOES,0.0,0.0
620,SIM,3,3M,True,SUE HELD FOUR HOT CARDS,0.0,0.0
620,SIM,3,5M,False,LYNN SOLD TWO CHEAP SHOES,0.0,0.0
620,SIM,3,8M,False,JILL SAW TEN SMALL TOYS,0.0,0.0
621,SIM,3,4M,True,SUE SAW TWO OLD CARDS,0.0,0.0
621,SIM,3,3M,False,JANE FOUND EIGHT CHEAP SHOES,0.0,0.0
621,SIM,3,9M,False,JILL GAVE NINE NEW GLOVES,0.0,0.0
622,SIM,3,5M,True,SUE TOOK EIGHT CHEAP TOYS,0.0,0.0
622,SIM,3,10M,False,BOB SOLD THREE OLD CARDS,0.0,0.0
622,SIM,3,7M,False,SAM HELD FOUR HOT HATS,0.0,0.0
623,SIM,3,4M,True,SUE GAVE TEN OLD PENS,0.0,0.0
623,SIM,3,2M,False,SAM BOUGHT FIVE GREEN GLOVES,0.0,0.0
623,SIM,3,9M,False,PAT SAW NINE CHEAP SHOES,0.0,0.0
624,SIM,3,9M,True,SUE FOUND FOUR NEW SHOES,0.0,0.0
624,SIM,3,11M,False,PAT SOLD NINE BIG TOYS,0.0,0.0
624,SIM,3,1M,False,MIKE GAVE SIX CHEAP CARDS,0.0,0.0
625,SIM,3,10M,True,SUE GAVE TWO RED BAGS,0.0,0.0
625,SIM,3,8M,False,MIKE SOLD NINE NEW GLOVES,0.0,0.0
625,SIM,3,2M,False,JILL TOOK SIX HOT CARDS,0.0,0.0
626,SIM,3,3M,True,SUE BOUGHT THREE CHEAP BAGS,0.0,0.0
626,SIM,3,5M,False,LYNN TOOK FOUR SMALL SOCKS,0.0,0.0
626,SIM,3,11M,False,PAT SAW SIX HOT CARDS,0.0,0.0
627,SIM,3,5M,True,SUE SOLD NINE CHEAP PENS,0.0,0.0
627,SIM,3,1M,False,PAT HELD EIGHT SMALL SOCKS,0.0,0.0
627,SIM,3,4M,False,SAM FOUND THREE OLD TOYS,0.0,0.0
628,SIM,3,5M,True,SUE SOLD THREE BIG TOYS,0.0,0.0
628,SIM,3,7M,False,JANE LOST TWO GREEN GLOVES,0.0,0.0
628,SIM,3,10M,False,SAM TOOK EIGHT SMALL SOCKS,0.0,0.0
629,SIM,3,11M,True,SUE LOST EIGHT SMALL TOYS,0.0,0.0
629,SIM,3,8M,False,JANE SOLD TEN GREEN SOCKS,0.0,0.0
629,SIM,3,3M,False,JILL SAW FOUR NEW PENS,0.0,0.0
630,SIM,3,2M,True,SUE LOST NINE HOT CARDS,0.0,0.0
630,SIM,3,8M,False,PAT SAW TEN RED BAGS,0.0,0.0
630,SIM,3,7M,False,LYNN GAVE EIGHT CHEAP SOCKS,0.0,0.0
631,SIM,3,2M,True,SUE SAW FOUR CHEAP SHOES,0.0,0.0
631,SIM,3,3M,False,SAM GAVE SIX GREEN GLOVES,0.0,0.0
631,SIM,3,4M,False,PAT FOUND THREE RED HATS,0.0,0.0
632,SIM,3,8M,True,SUE LOST TWO GREEN CARDS,0.0,0.0
632,SIM,3,11M,False,JILL SOLD SIX HOT SHOES,0.0,0.0
632,SIM,3,7M,False,JANE FOUND TEN CHEAP TOYS,0.0,0.0
633,SIM,3,7M,True,SUE HELD FOUR GREEN TOYS,0.0,0.0
633,SIM,3,10M,False,PAT SAW TEN BIG PENS,0.0,0.0
633,SIM,3,5M,False,BOB FOUND SIX OLD HATS,0.0,0.0
634,SIM,3,10M,True,SUE FOUND TWO RED SOCKS,0.0,0.0
634,SIM,3,3M,False,JILL HELD THREE GREEN GLOVES,0.0,0.0
634,SIM,3,1M,False,BOB LOST FOUR NEW TOYS,0.0,0.0
635,SIM,3,7M,True,SUE TOOK EIGHT OLD SOCKS,0.0,0.0
635,SIM,3,5M,False,BOB BOUGHT TWO RED CARDS,0.0,0.0
635,SIM,3,10M,False,PAT SAW FIVE SMALL GLOVES,0.0,0.0
636,SIM,3,4M,True,SUE GAVE THREE OLD BAGS,0.0,0.0
636,SIM,3,9M,False,JILL HELD TWO HOT SHOES,0.0,0.0
636,SIM,3,3M,False,BOB TOOK FOUR SMALL CARDS,0.0,0.0
637,SIM,3,10M,True,SUE HELD SIX HOT GLOVES,0.0,0.0
637,SIM,3,4M,False,BOB GAVE TWO BIG BAGS,0.0,0.0
637,SIM,3,11M,False,JILL BOUGHT THREE GREEN TOYS,0.0,0.0
638,SIM,3,2M,True,SUE SAW NINE GREEN CARDS,0.0,0.0
638,SIM,3,10M,False,LYNN BOUGHT TEN OLD SOCKS,0.0,0.0
638,SIM,3,3M,False,SAM FOUND SIX RED PENS,0.0,0.0
639,SIM,3,11M,True,SUE LOST FOUR OLD GLOVES,0.0,0.0
639,SIM,3,8M,False,BOB FOUND EIGHT SMALL CARDS,0.0,0.0
639,SIM,3,7M,False,JILL BOUGHT NINE BIG SHOES,0.0,0.0
640,SIM,3,9M,True,SUE LOST FIVE OLD CARDS,0.0,0.0
640,SIM,3,2M,False,LYNN BOUGHT EIGHT RED TOYS,0.0,0.0
640,SIM,3,11M,False,MIKE TOOK SIX GREEN BAGS,0.0,0.0
641,SIM,3,5M,True,SUE SAW NINE HOT PENS,0.0,0.0
641,SIM,3,8M,False,LYNN GAVE TEN SMALL SOCKS,0.0,0.0
641,SIM,3,9M,False,SAM TOOK SIX RED CARDS,0.0,0.0
642,SIM,3,8M,True,SUE GAVE FOUR SMALL SHOES,0.0,0.0
642,SIM,3,10M,False,JANE LOST TWO CHEAP HATS,0.0,0.0
642,SIM,3,3M,False,MIKE HELD THREE GREEN TOYS,0.0,0.0
643,SIM,3,3M,True,SUE SAW FIVE BIG TOYS,0.0,0.0
643,SIM,3,4M,False,MIKE SOLD EIGHT OLD CARDS,0.0,0.0
643,SIM,3,5M,False,JANE TOOK THREE CHEAP SHOES,0.0,0.0
644,SIM,3,7M,True,SUE HELD TEN RED GLOVES,0.0,0.0
644,SIM,3,9M,False,LYNN LOST NINE NEW SHOES,0.0,0.0
644,SIM,3,10M,False,BOB FOUND TWO HOT BAGS,0.0,0.0
645,SIM,3,7M,True,SUE HELD TWO HOT HATS,0.0,0.0
645,SIM,3,10M,False,JANE GAVE THREE CHEAP TOYS,0.0,0.0
645,SIM,3,9M,False,JILL LOST EIGHT SMALL SHOES,0.0,0.0
646,SIM,3,10M,True,SUE SAW FIVE CHEAP SHOES,0.0,0.0
646,SIM,3,2M,False,BOB LOST TEN RED TOYS,0.0,0.0
646,SIM,3,1M,False,MIKE GAVE NINE GREEN GLOVES,0.0,0.0
647,SIM,3,10M,True,SUE LOST FOUR RED HATS,0.0,0.0
647,SIM,3,8M,False,PAT GAVE FIVE SMALL TOYS,0.0,0.0
647,SIM,3,2M,False,MIKE TOOK TWO BIG SHOES,0.0,0.0
648,SIM,3,11M,True,SUE TOOK EIGHT OLD BAGS,0.0,0.0
648,SIM,3,5M,False,JANE BOUGHT TEN HOT TOYS,0.0,0.0
648,SIM,3,3M,False,BOB SOLD SIX NEW SOCKS,0.0,0.0
649,SIM,3,1M,True,SUE SAW TWO NEW HATS,0.0,0.0
649,SIM,3,3M,False,SAM HELD FIVE OLD SOCKS,0.0,0.0
649,SIM,3,4M,False,PAT FOUND FOUR GREEN GLOVES,0.0,0.0
650,SIM,3,2M,True,SUE TOOK FIVE SMALL CARDS,0.0,0.0
650,SIM,3,11M,False,BOB LOST SIX CHEAP SOCKS,0.0,0.0
650,SIM,3,9M,False,JANE HELD TEN GREEN TOYS,0.0,0.0
651,SIM,3,7M,True,SUE TOOK FOUR HOT TOYS,0.0,0.0
651,SIM,3,5M,False,SAM SOLD TEN RED SHOES,0.0,0.0
651,SIM,3,3M,False,BOB HELD SIX BIG CARDS,0.0,0.0
652,SIM,3,2M,True,SUE GAVE THREE GREEN PENS,0.0,0.0
652,SIM,3,8M,False,JANE SAW TEN HOT SOCKS,0.0,0.0
652,SIM,3,9M,False,JILL SOLD SIX RED HATS,0.0,0.0
653,SIM,3,8M,True,SUE BOUGHT NINE GREEN CARDS,0.0,0.0
653,SIM,3,10M,False,LYNN GAVE EIGHT NEW HATS,0.0,0.0
653,SIM,3,5M,False,JANE FOUND TEN CHEAP PENS,0.0,0.0
654,SIM,3,8M,True,SUE SAW TEN HOT PENS,0.0,0.0
654,SIM,3,11M,False,JILL GAVE THREE RED SHOES,0.0,0.0
654,SIM,3,5M,False,BOB FOUND SIX OLD SOCKS,0.0,0.0
655,SIM,3,11M,True,SUE HELD TEN BIG BAGS,0.0,0.0
655,SIM,3,7M,False,BOB SAW EIGHT OLD TOYS,0.0,0.0
655,SIM,3,3M,False,MIKE FOUND SIX CHEAP GLOVES,0.0,0.0
656,SIM,3,10M,True,SUE SAW FIVE HOT CARDS,0.0,0.0
656,SIM,3,5M,False,JILL LOST FOUR BIG HATS,0.0,0.0
656,SIM,3,9M,False,LYNN FOUND NINE SMALL TOYS,0.0,0.0
657,SIM,3,10M,True,SUE TOOK NINE HOT TOYS,0.0,0.0
657,SIM,3,9M,False,JILL LOST FOUR CHEAP GLOVES,0.0,0.0
657,SIM,3,2M,False,SAM HELD EIGHT NEW SOCKS,0.0,0.0
658,SIM,3,5M,True,SUE SAW TWO CHEAP SHOES,0.0,0.0
658,SIM,3,1M,False,JANE TOOK EIGHT SMALL BAGS,0.0,0.0
658,SIM,3,3M,False,SAM LOST FOUR BIG PENS,0.0,0.0
659,SIM,3,1M,True,SUE SOLD SIX CHEAP BAGS,0.0,0.0
659,SIM,3,7M,False,PAT SAW FOUR SMALL PENS,0.0,0.0
659,SIM,3,10M,False,JILL BOUGHT EIGHT GREEN SHOES,0.0,0.0
660,SIM,3,10M,True,SUE SOLD FOUR GREEN SOCKS,0.0,0.0
660,SIM,3,7M,False,BOB FOUND TWO HOT CARDS,0.0,0.0
660,SIM,3,3M,False,MIKE LOST EIGHT CHEAP PENS,0.0,0.0
661,SIM,3,4M,True,SUE GAVE NINE RED GLOVES,0.0,0.0
661,SIM,3,7M,False,BOB BOUGHT THREE OLD SHOES,0.0,0.0
661,SIM,3,1M,False,JANE SAW FIVE NEW PENS,0.0,0.0
662,SIM,3,7M,True,SUE HELD FIVE RED GLOVES,0.0,0.0
662,SIM,3,4M,False,BOB BOUGHT TWO CHEAP PENS,0.0,0.0
662,SIM,3,5M,False,JILL FOUND TEN NEW SOCKS,0.0,0.0
663,SIM,3,1M,True,SUE BOUGHT SIX SMALL SOCKS,0.0,0.0
663,SIM,3,8M,False,JANE SOLD EIGHT HOT BAGS,0.0,0.0
663,SIM,3,4M,False,MIKE GAVE FIVE BIG HATS,0.0,0.0
664,SIM,3,8M,True,SUE LOST EIGHT NEW TOYS,0.0,0.0
664,SIM,3,9M,False,PAT SOLD TWO OLD SHOES,0.0,0.0
664,SIM,3,4M,False,SAM SAW FOUR RED HATS,0.0,0.0
665,SIM,3,11M,True,SUE SOLD TEN SMALL BAGS,0.0,0.0
665,SIM,3,5M,False,BOB BOUGHT FOUR OLD SHOES,0.0,0.0
665,SIM,3,9M,False,JANE TOOK EIGHT CHEAP TOYS,0.0,0.0
666,SIM,3,1M,True,SUE TOOK NINE CHEAP CARDS,0.0,0.0
666,SIM,3,4M,False,BOB BOUGHT FIVE RED BAGS,0.0,0.0
666,SIM,3,8M,False,JANE LOST SIX NEW SHOES,0.0,0.0
667,SIM,3,5M,True,SUE SOLD TWO BIG BAGS,0.0,0.0
667,SIM,3,4M,False,LYNN FOUND FIVE OLD SHOES,0.0,0.0
667,SIM,3,7M,False,JANE SAW TEN GREEN PENS,0.0,0.0
668,SIM,3,8M,True,SUE GAVE TEN GREEN PENS,0.0,0.0
668,SIM,3,5M,False,JANE HELD THREE RED SOCKS,0.0,0.0
668,SIM,3,1M,False,JILL BOUGHT NINE NEW TOYS,0.0,0.0
669,SIM,3,1M,True,SUE GAVE TEN SMALL GLOVES,0.0,0.0
669,SIM,3,2M,False,SAM SOLD EIGHT OLD PENS,0.0,0.0
669,SIM,3,7M,False,JILL TOOK SIX CHEAP SHOES,0.0,0.0
670,SIM,3,3M,True,SUE BOUGHT THREE RED SHOES,0.0,0.0
670,SIM,3,1M,False,MIKE SOLD FOUR HOT CARDS,0.0,0.0
670,SIM,3,7M,False,SAM GAVE FIVE NEW TOYS,0.0,0.0
671,SIM,3,7M,True,SUE SOLD TEN NEW GLOVES,0.0,0.0
671,SIM,3,5M,False,BOB BOUGHT THREE HOT CARDS,0.0,0.0
671,SIM,3,10M,False,SAM LOST FIVE BIG SOCKS,0.0,0.0
672,SIM,3,10M,True,SUE GAVE FIVE RED HATS,0.0,0.0
672,SIM,3,11M,False,SAM LOST TEN SMALL CARDS,0.0,0.0
672,SIM,3,8M,False,JILL SOLD TWO GREEN TOYS,0.0,0.0
673,SIM,3,1M,True,SUE SAW FOUR BIG BAGS,0.0,0.0
673,SIM,3,3M,False,JANE LOST TWO RED HATS,0.0,0.0
673,SIM,3,9M,False,BOB GAVE EIGHT HOT SOCKS,0.0,0.0
674,SIM,3,4M,True,SUE LOST TEN BIG CARDS,0.0,0.0
674,SIM,3,3M,False,PAT TOOK FIVE SMALL SHOES,0.0,0.0
674,SIM,3,9M,False,JILL SAW NINE NEW TOYS,0.0,0.0
675,SIM,3,8M,True,SUE SAW THREE RED HATS,0.0,0.0
675,SIM,3,3M,False,MIKE FOUND FIVE BIG BAGS,0.0,0.0
675,SIM,3,11M,False,JANE LOST SIX HOT SOCKS,0.0,0.0
676,SIM,3,4M,True,SUE TOOK SIX SMALL SHOES,0.0,0.0
676,SIM,3,3M,False,SAM SAW THREE BIG SOCKS,0.0,0.0
676,SIM,3,11M,False,JANE GAVE TWO HOT GLOVES,0.0,0.0
677,SIM,3,5M,True,SUE LOST FOUR BIG CARDS,0.0,0.0
677,SIM,3,10M,False,PAT SAW TWO OLD GLOVES,0.0,0.0
677,SIM,3,9M,False,LYNN GAVE THREE HOT PENS,0.0,0.0
678,SIM,3,2M,True,SUE HELD NINE OLD TOYS,0.0,0.0
678,SIM,3,1M,False,MIKE SAW TEN SMALL SOCKS,0.0,0.0
678,SIM,3,10M,False,LYNN GAVE FOUR CHEAP PENS,0.0,0.0
679,SIM,3,1M,True,SUE LOST FOUR NEW TOYS,0.0,0.0
679,SIM,3,10M,False,MIKE FOUND FIVE SMALL SHOES,0.0,0.0
679,SIM,3,2M,False,LYNN BOUGHT THREE CHEAP CARDS,0.0,0.0
680,SIM,3,8M,True,SUE BOUGHT THREE NEW GLOVES,0.0,0.0
680,SIM,3,4M,False,MIKE GAVE TEN RED TOYS,0.0,0.0
680,SIM,3,10M,False,LYNN LOST NINE SMALL HATS,0.0,0.0
681,SIM,3,2M,True,SUE TOOK THREE OLD PENS,0.0,0.0
681,SIM,3,4M,False,JILL FOUND TEN SMALL CARDS,0.0,0.0
681,SIM,3,9M,False,JANE GAVE SIX RED SHOES,0.0,0.0
682,SIM,3,4M,True,SUE SOLD FOUR NEW CARDS,0.0,0.0
682,SIM,3,8M,False,MIKE TOOK FIVE SMALL GLOVES,0.0,0.0
682,SIM,3,10M,False,SAM GAVE NINE BIG SOCKS,0.0,0.0
683,SIM,3,10M,True,SUE GAVE SIX NEW SOCKS,0.0,0.0
683,SIM,3,2M,False,BOB LOST NINE RED SHOES,0.0,0.0
683,SIM,3,5M,False,JILL SAW EIGHT HOT TOYS,0.0,0.0
684,SIM,3,7M,True,SUE BOUGHT SIX HOT CARDS,0.0,0.0
684,SIM,3,8M,False,JANE TOOK TWO GREEN PENS,0.0,0.0
684,SIM,3,1M,False,JILL GAVE EIGHT SMALL GLOVES,0.0,0.0
685,SIM,3,9M,True,SUE LOST FIVE OLD PENS,0.0,0.0
685,SIM,3,8M,False,BOB HELD NINE SMALL GLOVES,0.0,0.0
685,SIM,3,11M,False,JILL SAW TEN HOT SHOES,0.0,0.0
686,SIM,3,2M,True,SUE SOLD THREE OLD TOYS,0.0,0.0
686,SIM,3,11M,False,JANE GAVE SIX GREEN BAGS,0.0,0.0
686,SIM,3,9M,False,JILL BOUGHT TEN CHEAP GLOVES,0.0,0.0
687,SIM,3,9M,True,SUE SAW NINE NEW SHOES,0.0,0.0
687,SIM,3,4M,False,JANE HELD FOUR OLD TOYS,0.0,0.0
687,SIM,3,2M,False,LYNN GAVE TWO HOT BAGS,0.0,0.0
688,SIM,3,4M,True,SUE LOST EIGHT BIG SOCKS,0.0,0.0
688,SIM,3,1M,False,PAT FOUND THREE HOT GLOVES,0.0,0.0
688,SIM,3,3M,False,JILL SAW FIVE CHEAP SHOES,0.0,0.0
689,SIM,3,3M,True,SUE GAVE SIX BIG GLOVES,0.0,0.0
689,SIM,3,7M,False,SAM TOOK TWO GREEN TOYS,0.0,0.0
689,SIM,3,8M,False,MIKE HELD THREE OLD CARDS,0.0,0.0
690,SIM,3,9M,True,SUE BOUGHT SIX CHEAP CARDS,0.0,0.0
690,SIM,3,5M,False,PAT TOOK THREE NEW PENS,0.0,0.0
690,SIM,3,3M,False,JANE FOUND EIGHT RED SOCKS,0.0,0.0
691,SIM,3,7M,True,SUE SOLD FOUR BIG GLOVES,0.0,0.0
691,SIM,3,5M,False,SAM GAVE TEN OLD TOYS,0.0,0.0
691,SIM,3,4M,False,PAT LOST TWO CHEAP HATS,0.0,0.0
692,SIM,3,7M,True,SUE FOUND FIVE RED CARDS,0.0,0.0
692,SIM,3,11M,False,BOB TOOK NINE CHEAP HATS,0.0,0.0
692,SIM,3,2M,False,MIKE SOLD SIX SMALL GLOVES,0.0,0.0
693,SIM,3,11M,True,SUE LOST FIVE RED HATS,0.0,0.0
693,SIM,3,7M,False,BOB HELD TEN HOT PENS,0.0,0.0
693,SIM,3,5M,False,SAM SOLD NINE SMALL BAGS,0.0,0.0
