stim_type,alternation_rate,target_talker,target_sentence,init_target_position,masker_talker,masker_sentence,init_masker_position
SOS,7.0,4M,Sue took six old shoes and Bob took three old toys,90,11M,Mike held two red gloves then Mike bought four small bags,-90
SOS,7.0,4M,Sue found two red cards then Sam sold three old hats,-90,5M,Jane held five green socks when Jane bought four new toys,90
SOS,7.0,3M,Sue gave two hot gloves then Bob saw five small gloves,-90,4M,Jill took five small socks if Mike gave two green hats,90
SOS,7.0,8M,Sue lost six small socks where Lynn found nine small bags,-90,1M,Lynn saw ten new hats if Mike bought five hot socks,90
SOS,7.0,11M,Sue held four small toys when Sam saw five old bags,90,7M,Lynn saw eight cheap socks but Jane sold two big cards,-90
SOS,7.0,7M,Sue saw eight old shoes and Sam saw five new cards,90,1M,Bob gave six small toys then Jane bought ten old pens,-90
SOS,7.0,1M,Sue took nine new pens if Sam gave nine old bags,90,4M,Jane saw four hot cards and Lynn held four cheap cards,-90
SOS,7.0,2M,Sue saw two cheap hats and Bob held eight cheap socks,-90,5M,Mike gave five old shoes then Pat found ten red bags,90
SOS,7.0,9M,Sue lost six green pens but Sam lost eight big hats,-90,5M,Pat gave five old gloves while Jane found five red gloves,90
SOS,7.0,1M,Sue sold eight old bags or Jill saw three new cards,-90,5M,Mike found four small gloves where Pat lost eight old socks,90
SOS,7.0,7M,Sue bought three cheap hats then Sam took five new shoes,-90,4M,Sam saw eight hot toys where Mike sold nine green pens,90
SOS,7.0,1M,Sue sold four green socks while Mike gave ten green shoes,-90,3M,Lynn found six small hats but Jill bought eight new bags,90
SOS,7.0,10M,Sue sold nine small shoes then Jane saw three small pens,-90,3M,Mike found eight green toys and Pat took nine big gloves,90
SOS,7.0,2M,Sue found three big gloves if Bob gave four cheap pens,90,5M,Bob bought five old pens but Jane lost eight red shoes,-90
SOS,7.0,8M,Sue sold nine green pens but Bob lost six new toys,-90,11M,Bob took eight small shoes then Jill found eight red socks,90
SOS,7.0,10M,Sue gave ten green hats but Pat held three new socks,-90,1M,Lynn sold two old pens or Lynn saw ten big cards,90
SOS,7.0,9M,Sue took five green pens or Jane held five small shoes,90,2M,Sam saw ten cheap cards where Mike saw eight big socks,-90
SOS,7.0,5M,Sue took five green cards or Jane gave two red bags,90,10M,Mike found two new pens where Mike found eight cheap hats,-90
SOS,7.0,10M,Sue took eight cheap gloves but Jane lost nine red bags,-90,5M,Bob saw three new pens when Bob held two big hats,90
SOS,7.0,10M,Sue found three big socks but Pat sold five green toys,-90,5M,Sam held two hot gloves if Jane saw four new cards,90
SOS,7.0,8M,Sue held nine green gloves then Bob held six red hats,90,7M,Pat took four big bags where Jill gave two small socks,-90
SOS,7.0,7M,Sue found ten red cards then Sam bought four big toys,-90,2M,Lynn took five big hats if Pat took ten red gloves,90
SOS,7.0,1M,Sue took five red toys while Bob lost nine green shoes,-90,5M,Mike bought three new shoes if Jane saw five old pens,90
SOS,7.0,11M,Sue lost eight cheap bags where Bob found five red cards,-90,10M,Pat sold five hot shoes but Sam took two cheap shoes,90
SOS,7.0,4M,Sue took four small cards but Mike gave three hot toys,-90,1M,Mike bought ten hot shoes or Lynn bought ten green gloves,90
SOS,7.0,4M,Sue took three hot hats then Bob bought three big gloves,-90,9M,Mike gave nine cheap pens if Jane lost eight hot pens,90
SOS,7.0,2M,Sue found two cheap cards or Jill found three green cards,-90,11M,Sam lost three red pens when Jane bought nine red toys,90
SOS,7.0,3M,Sue saw five big socks but Jane lost five cheap toys,90,5M,Jane lost two hot gloves and Pat sold three big pens,-90
SOS,7.0,5M,Sue held eight cheap cards or Lynn lost four big socks,-90,8M,Sam lost five big pens but Sam saw eight green bags,90
SOS,7.0,11M,Sue sold two small hats if Bob held five small toys,90,1M,Jill bought six hot cards where Sam found six red gloves,-90
SOS,8.0,5M,Sue gave two cheap toys where Sam lost eight green socks,90,10M,Sam held six new gloves or Bob gave three red pens,-90
SOS,8.0,2M,Sue saw four cheap bags or Bob sold eight cheap hats,-90,1M,Pat took eight small gloves and Mike bought six big socks,90
SOS,8.0,4M,Sue found nine big bags or Jane sold nine red socks,-90,7M,Bob held eight new pens where Lynn took eight big shoes,90
SOS,8.0,2M,Sue saw two cheap pens when Jane saw nine hot cards,-90,9M,Jill bought five old bags if Mike sold five big gloves,90
SOS,8.0,10M,Sue held ten green socks where Pat found four new bags,-90,7M,Lynn sold two cheap gloves when Sam lost five hot shoes,90
SOS,8.0,5M,Sue found two hot socks then Bob sold ten old toys,90,11M,Jane bought six old hats and Jane took nine small pens,-90
SOS,8.0,3M,Sue held nine green cards when Mike gave ten old gloves,90,1M,Jane lost six small shoes and Pat found eight cheap toys,-90
SOS,8.0,3M,Sue sold two hot hats but Jane bought four old toys,-90,2M,Jill lost three cheap shoes where Lynn held eight new shoes,90
SOS,8.0,9M,Sue found four big gloves while Sam bought nine big socks,-90,4M,Pat lost eight red toys when Jane sold five green gloves,90
SOS,8.0,11M,Sue saw four hot socks then Jane saw four old pens,90,10M,Lynn sold five green hats when Pat gave ten red gloves,-90
SOS,8.0,8M,Sue held ten red toys if Sam saw three cheap pens,-90,1M,Jane took six hot pens but Jane found four big shoes,90
SOS,8.0,2M,Sue found six cheap hats where Jill lost ten old toys,-90,11M,Bob took ten green pens but Mike saw four small bags,90
SOS,8.0,4M,Sue sold six new hats but Pat saw five big bags,-90,10M,Lynn held five green bags if Mike lost four cheap shoes,90
SOS,8.0,11M,Sue lost three new socks when Jill sold four cheap pens,-90,7M,Mike found nine red bags then Jane lost three old hats,90
SOS,8.0,9M,Sue found two new bags where Jane bought four hot pens,90,3M,Lynn held eight cheap gloves then Jill sold five new socks,-90
SOS,8.0,10M,Sue saw ten small toys while Jane bought four small gloves,90,5M,Bob held six hot socks then Sam gave three big shoes,-90
SOS,8.0,4M,Sue saw three new gloves and Sam saw four red cards,90,7M,Jane bought six cheap shoes where Bob found nine big socks,-90
SOS,8.0,1M,Sue found ten hot socks when Pat bought ten big gloves,-90,9M,Jill gave two old pens but Mike lost four green hats,90
SOS,8.0,8M,Sue found five small bags then Sam held three red hats,-90,10M,Bob sold nine green socks if Lynn lost five cheap bags,90
SOS,8.0,9M,Sue found two cheap hats or Pat held nine hot toys,90,10M,Pat sold three hot socks when Lynn bought five new shoes,-90
SOS,8.0,1M,Sue found five new cards and Bob sold nine small hats,90,10M,Bob held four small toys while Pat bought eight red toys,-90
SOS,8.0,5M,Sue sold two big pens while Mike lost eight hot toys,-90,8M,Bob held ten small gloves but Bob held two red bags,90
SOS,8.0,4M,Sue lost four hot socks while Sam lost nine new bags,-90,3M,Jill sold three old bags when Lynn found ten hot hats,90
SOS,8.0,3M,Sue lost ten green hats but Jill sold eight new socks,90,8M,Jane found six old toys then Lynn took five cheap toys,-90
SOS,8.0,9M,Sue found three hot gloves or Sam lost nine new socks,-90,3M,Lynn saw nine red shoes and Lynn bought four cheap cards,90
SOS,8.0,8M,Sue took ten hot shoes and Sam saw four old socks,90,3M,Lynn lost five big toys but Bob found nine big bags,-90
SOS,8.0,9M,Sue gave five red gloves where Jane found nine new bags,-90,5M,Jill lost nine old hats when Bob held four old gloves,90
SOS,8.0,11M,Sue took three cheap cards if Jane bought eight red shoes,90,1M,Jill lost ten new shoes when Lynn gave three new hats,-90
SOS,8.0,3M,Sue took nine green cards but Jill lost eight small hats,90,1M,Jane lost ten big bags then Bob found ten cheap socks,-90
SOS,8.0,5M,Sue held ten new cards then Bob took eight new hats,90,2M,Bob found nine cheap shoes where Sam lost nine big toys,-90
SOS,8.0,7M,Sue saw nine new gloves and Pat gave nine big pens,90,4M,Jane held three hot toys but Jane held five hot hats,-90
SOS,8.0,9M,Sue took two hot gloves or Jane saw six new pens,90,8M,Mike lost five big cards and Pat took nine old toys,-90
SOS,8.0,8M,Sue found four big toys but Bob saw nine cheap toys,90,4M,Lynn sold two cheap hats while Jill lost eight big gloves,-90
SOS,8.0,7M,Sue took six red shoes or Sam gave three small gloves,90,5M,Mike lost two new cards while Jill held ten new toys,-90
SOS,8.0,10M,Sue sold two green cards or Lynn found nine hot shoes,90,11M,Jill found eight small toys then Bob bought eight green bags,-90
SOS,8.0,9M,Sue bought six cheap toys but Sam lost eight red hats,90,2M,Jill gave nine big shoes then Lynn saw six hot toys,-90
SOS,8.0,2M,Sue found two small pens or Sam lost four big toys,90,3M,Lynn lost six hot bags where Jill held ten red shoes,-90
SOS,8.0,11M,Sue held ten green gloves if Bob bought eight hot cards,90,2M,Lynn gave three old shoes when Mike held six green pens,-90
SOS,8.0,3M,Sue took four new toys but Lynn sold five big toys,-90,5M,Lynn held eight cheap socks if Jill bought two hot shoes,90
SOS,8.0,4M,Sue sold two old toys or Jill gave two hot bags,90,8M,Pat held five hot pens while Mike lost six red gloves,-90
SOS,8.0,3M,Sue bought nine green cards but Sam gave six new socks,-90,5M,Jane sold eight hot gloves and Bob held three red toys,90
SOS,8.0,11M,Sue held six cheap hats where Jill gave ten old toys,-90,9M,Bob found five old gloves and Pat saw nine hot hats,90
SOS,8.0,8M,Sue took four green bags and Sam took nine new toys,-90,3M,Lynn found two hot pens while Mike bought ten green hats,90
SOS,8.0,5M,Sue bought five old bags but Lynn lost two small toys,-90,9M,Jane lost four cheap pens where Sam saw six hot cards,90
SOS,8.0,8M,Sue took ten red cards when Jill held eight green socks,90,11M,Sam found five old pens and Bob took two new cards,-90
SOS,8.0,5M,Sue found nine small pens but Lynn held eight red bags,90,4M,Sam lost six hot socks where Jill sold two hot toys,-90
SOS,8.0,11M,Sue found three old hats where Lynn held two new shoes,-90,7M,Pat held nine green gloves and Pat bought six cheap hats,90
SOS,8.0,3M,Sue gave three green pens but Mike bought eight cheap pens,-90,9M,Lynn held six cheap socks while Lynn lost nine new hats,90
SOS,8.0,7M,Sue gave six big pens when Jane lost four old pens,-90,11M,Sam saw ten red shoes or Bob held six new bags,90
SOS,8.0,10M,Sue saw five small socks when Jill bought four red bags,90,11M,Pat lost nine hot toys but Pat saw ten new socks,-90
SOS,8.0,7M,Sue sold five hot toys or Lynn took two green cards,-90,9M,Sam took nine new shoes but Jill saw six old bags,90
SOS,8.0,8M,Sue gave eight green bags or Sam saw four big socks,90,5M,Lynn held five red toys when Jill lost nine red bags,-90
SOS,8.0,2M,Sue sold three big hats and Pat took five new socks,90,4M,Jane found five small gloves or Mike lost four small pens,-90
SOS,8.0,10M,Sue held two small pens then Sam gave four green toys,90,1M,Mike found six hot hats when Bob saw five hot gloves,-90
SOS,8.0,5M,Sue saw six small hats when Bob found five new pens,90,11M,Mike bought five hot cards then Pat gave nine red toys,-90
SOS,8.0,3M,Sue sold two new cards but Mike gave nine small toys,90,7M,Sam held ten cheap socks where Pat found five old shoes,-90
SOS,8.0,7M,Sue found four green toys but Lynn held ten big gloves,90,8M,Bob sold eight big pens or Jill gave six red toys,-90
SOS,8.0,11M,Sue lost ten cheap pens and Mike held eight small shoes,-90,5M,Bob bought five green gloves while Lynn sold three new bags,90
SOS,8.0,1M,Sue held five big hats or Jane sold two hot toys,-90,10M,Bob saw nine cheap cards then Sam found three small pens,90
SOS,8.0,1M,Sue sold nine small shoes if Jill bought ten green hats,-90,3M,Bob took two hot toys and Jane took four new bags,90
SOS,9.0,8M,Sue gave six green hats while Bob held five big shoes,-90,1M,Bob took two hot cards or Jill saw six small gloves,90
SOS,9.0,2M,Sue sold two cheap toys if Jill bought two small socks,90,5M,Bob found six big hats and Sam sold eight old toys,-90
SOS,9.0,10M,Sue sold five cheap pens or Bob bought three old bags,90,7M,Mike took two green socks then Pat held two red toys,-90
SOS,9.0,3M,Sue gave nine old shoes while Bob saw eight old bags,-90,1M,Bob took three hot pens where Lynn held six small toys,90
SOS,9.0,10M,Sue lost four big toys while Pat saw four big cards,90,1M,Mike saw three new pens when Mike found three red hats,-90
SOS,9.0,10M,Sue took nine red gloves where Sam bought three small socks,90,2M,Lynn bought three green bags if Pat took eight green pens,-90
SOS,9.0,8M,Sue held two new bags then Lynn gave nine big cards,90,3M,Sam took four old pens if Sam bought ten hot bags,-90
SOS,9.0,4M,Sue bought ten hot bags but Jane bought eight cheap toys,90,1M,Bob gave four red gloves and Mike held ten old gloves,-90
SOS,9.0,3M,Sue gave eight small hats then Mike saw two old toys,90,10M,Pat took ten big cards or Pat held four small socks,-90
SOS,9.0,8M,Sue gave three hot pens then Bob saw five green bags,-90,7M,Jill saw six small toys if Pat found three big toys,90
SOS,9.0,2M,Sue took three green shoes if Bob lost five cheap pens,-90,9M,Pat held nine cheap pens and Lynn bought four small toys,90
SOS,9.0,3M,Sue lost nine new bags where Pat saw nine green socks,90,11M,Pat sold five cheap gloves while Mike lost eight hot cards,-90
SOS,9.0,11M,Sue held three cheap socks while Jane bought five hot pens,90,1M,Jane sold four new bags or Jill saw ten small hats,-90
SOS,9.0,8M,Sue gave three hot socks then Jill sold three hot gloves,-90,7M,Jill saw four cheap gloves but Bob lost eight small shoes,90
SOS,9.0,11M,Sue held three green cards while Lynn sold nine new hats,-90,10M,Sam took five small bags or Mike found six hot gloves,90
SOS,9.0,4M,Sue found eight cheap pens then Jane saw three green toys,-90,8M,Pat lost three new bags while Lynn sold ten small pens,90
SOS,9.0,11M,Sue found five old toys but Jane lost six cheap shoes,-90,3M,Mike sold nine hot pens if Sam bought nine green socks,90
SOS,9.0,10M,Sue found six red pens but Bob gave two green toys,90,8M,Lynn took two green hats or Jill held eight old bags,-90
SOS,9.0,3M,Sue lost five green bags when Mike saw five big bags,-90,5M,Pat bought eight big hats if Jane gave nine green socks,90
SOS,9.0,3M,Sue held two cheap shoes then Lynn bought ten small socks,90,5M,Lynn took ten old hats where Jill took four big gloves,-90
SOS,9.0,9M,Sue sold three new shoes and Jill took four small shoes,-90,2M,Lynn lost nine hot pens but Lynn gave nine red socks,90
SOS,9.0,8M,Sue saw nine new bags where Sam held four big toys,90,2M,Lynn held six hot cards but Jane bought two small shoes,-90
SOS,9.0,1M,Sue held four small bags when Jane lost nine red pens,90,9M,Bob lost six hot shoes and Jill found five green cards,-90
SOS,9.0,9M,Sue held nine small cards while Jane gave two small toys,-90,7M,Sam found five hot pens and Mike saw four new bags,90
SOS,9.0,10M,Sue sold two big toys or Jane took two cheap socks,-90,8M,Lynn held three green socks but Bob held three hot toys,90
SOS,9.0,7M,Sue saw two old pens but Bob held three big cards,90,4M,Mike held three green shoes while Sam found two cheap socks,-90
SOS,9.0,9M,Sue took two cheap pens then Sam lost eight old shoes,90,7M,Pat found ten green gloves or Jane bought two small hats,-90
SOS,9.0,10M,Sue lost four green hats if Pat saw nine hot pens,90,4M,Pat found nine new bags then Bob lost three old cards,-90
SOS,9.0,1M,Sue bought ten small gloves while Lynn lost eight old hats,90,3M,Lynn sold nine red bags where Jill found two small bags,-90
SOS,9.0,4M,Sue lost eight cheap socks or Lynn saw nine big pens,90,3M,Pat saw four red toys and Pat lost six cheap hats,-90
SOS,9.0,7M,Sue bought four small bags but Pat took four big toys,-90,11M,Pat found three hot hats when Mike sold five small hats,90
SOS,9.0,11M,Sue bought two red toys if Bob held six old toys,-90,2M,Bob saw four cheap cards when Jill lost nine red hats,90
SOS,9.0,7M,Sue bought six cheap pens then Sam took four hot pens,-90,8M,Bob saw three big cards while Jill lost nine green shoes,90
SOS,9.0,3M,Sue lost four red hats but Lynn found nine red cards,90,9M,Jane bought two cheap cards and Jill took two green bags,-90
SOS,9.0,8M,Sue bought four new shoes then Lynn held six red gloves,-90,2M,Bob found two cheap cards where Sam took five big bags,90
SOS,9.0,5M,Sue took nine small gloves and Mike held nine new toys,-90,10M,Lynn sold two big shoes while Lynn gave ten big bags,90
SOS,9.0,4M,Sue took two cheap shoes and Pat found two small socks,-90,8M,Jane bought three new cards while Jill saw eight new shoes,90
SOS,9.0,8M,Sue bought three cheap shoes while Jane sold ten green gloves,-90,2M,Jane gave two old socks then Pat gave eight new cards,90
SOS,9.0,3M,Sue took three hot pens but Sam found four new shoes,-90,1M,Jane bought eight red bags while Jane sold nine green pens,90
SOS,9.0,5M,Sue found four small hats but Jane held eight green pens,-90,4M,Bob sold six green cards when Bob lost four red toys,90
SOS,9.0,10M,Sue found ten big shoes while Jane sold six old hats,-90,3M,Jill held eight old socks or Pat found ten hot socks,90
SOS,9.0,11M,Sue found five red socks or Jill saw three big hats,-90,10M,Lynn bought six new cards while Sam sold eight new toys,90
SOS,9.0,11M,Sue took two red shoes while Bob gave nine red shoes,-90,9M,Jane gave three hot bags if Jane bought eight big cards,90
SOS,9.0,5M,Sue took five old socks and Jill saw nine green toys,-90,10M,Pat found nine big pens if Pat held four new hats,90
SOS,9.0,8M,Sue gave three old pens when Pat saw five big cards,90,4M,Lynn found four cheap toys or Lynn gave eight cheap toys,-90
SOS,9.0,10M,Sue gave five new toys and Jane lost two big hats,90,11M,Sam sold ten green hats when Jill found four hot gloves,-90
SOS,9.0,5M,Sue saw ten green shoes but Sam took three old gloves,90,7M,Pat took eight red gloves if Pat found ten green pens,-90
SOS,9.0,9M,Sue found three hot gloves when Lynn lost two cheap cards,90,11M,Jane saw ten red shoes and Jane held three red bags,-90
SOS,9.0,9M,Sue saw five hot cards if Pat saw five red bags,90,10M,Pat lost six cheap socks or Bob bought four green toys,-90
SOS,9.0,7M,Sue gave two red shoes where Lynn saw three cheap cards,-90,5M,Pat bought ten small gloves or Pat gave four hot shoes,90
SOS,9.0,2M,Sue bought eight hot bags if Jane sold four new bags,-90,10M,Mike saw five old cards while Mike lost two cheap socks,90
SOS,9.0,8M,Sue bought six red socks or Mike bought three cheap cards,-90,2M,Jane gave eight cheap toys and Bob saw ten hot socks,90
SOS,9.0,5M,Sue held five red shoes while Sam took three big hats,-90,3M,Jane gave four new bags when Jill found four small shoes,90
SOS,9.0,1M,Sue took nine big hats then Bob sold eight cheap cards,90,7M,Pat lost five hot toys but Sam gave two old bags,-90
SOS,9.0,7M,Sue bought ten small cards and Jill bought six small toys,-90,1M,Lynn saw nine big socks or Pat lost three new cards,90
SOS,9.0,2M,Sue found four big socks where Jane lost four old socks,90,1M,Jane held nine small toys while Bob took two small shoes,-90
SOS,9.0,2M,Sue took four big pens while Jill lost three green toys,-90,8M,Lynn gave six hot hats if Sam found ten old cards,90
SOS,9.0,11M,Sue sold nine green cards where Lynn lost three cheap hats,90,8M,Pat gave two cheap pens when Jill found eight old socks,-90
SOS,9.0,1M,Sue gave four cheap shoes where Sam bought four red shoes,90,2M,Lynn bought ten red gloves but Pat gave three new socks,-90
SOS,9.0,1M,Sue held eight new pens and Jane held four hot hats,90,9M,Mike sold six hot socks or Lynn took three cheap socks,-90
SOS,10.0,2M,Sue found three small pens if Lynn sold nine small shoes,-90,3M,Bob held five new socks or Mike took four new cards,90
SOS,10.0,5M,Sue took three green toys or Bob lost three red bags,90,4M,Mike bought ten new gloves where Jane sold five green socks,-90
SOS,10.0,7M,Sue held five green socks while Mike saw nine cheap pens,90,4M,Jane sold ten old gloves or Bob held eight big shoes,-90
SOS,10.0,8M,Sue found five cheap bags but Bob gave five big socks,90,7M,Mike bought three old pens if Jane lost nine red shoes,-90
SOS,10.0,3M,Sue found ten hot toys but Jill lost three red shoes,-90,5M,Sam saw four red bags or Bob gave five new toys,90
SOS,10.0,3M,Sue took two new gloves when Jill saw nine cheap socks,-90,5M,Lynn bought eight hot bags where Sam sold two old shoes,90
SOS,10.0,11M,Sue bought six green shoes when Jill found three new bags,90,2M,Jane saw ten new pens or Jane saw five old toys,-90
SOS,10.0,3M,Sue saw ten hot toys or Pat lost eight green bags,-90,5M,Sam bought six red cards then Jane held six red shoes,90
SOS,10.0,2M,Sue sold four red cards when Bob lost ten hot shoes,90,9M,Lynn took two old pens where Mike gave five cheap bags,-90
SOS,10.0,8M,Sue found five red cards and Jill found six hot bags,-90,4M,Bob bought nine small hats if Sam saw five red shoes,90
SOS,10.0,4M,Sue gave ten big toys if Jane lost two old bags,-90,2M,Pat sold two new bags but Sam bought five new shoes,90
SOS,10.0,2M,Sue gave three small toys if Mike held ten big bags,90,7M,Jill took eight old bags then Bob saw two small pens,-90
SOS,10.0,5M,Sue sold nine cheap shoes but Pat saw eight old gloves,90,3M,Bob bought ten small bags if Bob bought ten red hats,-90
SOS,10.0,1M,Sue held five cheap gloves then Jill bought six old bags,-90,11M,Mike saw ten new toys when Pat saw eight cheap gloves,90
SOS,10.0,7M,Sue saw five big toys while Bob gave nine big cards,-90,9M,Mike sold two new pens where Sam found five old pens,90
SOS,10.0,4M,Sue sold five red cards if Jane gave six small gloves,90,5M,Mike found six big hats then Pat found five green shoes,-90
SOS,10.0,2M,Sue bought eight old gloves and Pat held six small shoes,90,10M,Sam found four hot toys if Mike bought four big socks,-90
SOS,10.0,3M,Sue sold three big hats or Pat bought three big toys,90,5M,Jane took nine small socks and Jill found six new cards,-90
SOS,10.0,4M,Sue took two new socks or Pat found eight cheap hats,-90,8M,Lynn saw three green hats if Jill lost six red gloves,90
SOS,10.0,7M,Sue bought two red toys where Jill took eight green cards,-90,3M,Lynn lost nine big bags if Lynn sold six new gloves,90
SOS,10.0,4M,Sue found two red shoes if Lynn sold four cheap gloves,-90,3M,Lynn held four big pens or Mike found ten hot toys,90
SOS,10.0,10M,Sue sold two small bags where Bob took four new socks,-90,3M,Jane found eight old shoes but Jane held ten old shoes,90
SOS,10.0,5M,Sue held nine small hats if Sam found nine cheap hats,90,1M,Mike bought five green bags but Jane sold six small cards,-90
SOS,10.0,10M,Sue sold two green hats if Pat bought eight hot gloves,90,9M,Pat found five small pens and Bob sold two green cards,-90
SOS,10.0,5M,Sue saw eight old gloves and Mike lost eight cheap bags,90,4M,Mike gave three new toys then Pat saw five new shoes,-90
SOS,10.0,11M,Sue took ten small bags when Jill bought six small hats,-90,5M,Mike gave nine green socks where Mike held four old toys,90
SOS,10.0,4M,Sue lost three new shoes then Mike saw four hot toys,-90,9M,Bob found five small pens when Bob gave ten green gloves,90
SOS,10.0,3M,Sue took ten green shoes when Sam took ten big gloves,90,1M,Sam saw four new cards while Jane gave five red toys,-90
SOS,10.0,4M,Sue saw five small pens and Sam gave two new cards,-90,8M,Lynn bought six hot socks when Bob lost nine green pens,90
SOS,10.0,4M,Sue took three red socks if Lynn found ten cheap hats,-90,10M,Bob sold four cheap pens where Pat sold nine new toys,90
SOS,10.0,11M,Sue lost eight cheap bags while Bob bought six old bags,-90,3M,Lynn saw two big cards if Sam took two green cards,90
SOS,10.0,1M,Sue sold nine small gloves but Jane lost four green shoes,90,3M,Pat took six hot toys if Mike bought ten big socks,-90
SOS,10.0,3M,Sue held eight small shoes if Jane saw five red gloves,90,11M,Sam lost two new hats but Lynn found six cheap shoes,-90
SOS,10.0,9M,Sue gave six red toys if Jill lost five old socks,-90,2M,Bob bought five small shoes then Lynn found nine green toys,90
SOS,10.0,7M,Sue held four red hats while Bob gave ten big socks,90,5M,Jane lost nine green bags if Sam lost six new bags,-90
SOS,10.0,1M,Sue took five small cards or Bob bought three new gloves,90,9M,Bob bought eight cheap hats and Mike found four red shoes,-90
SOS,10.0,11M,Sue gave five hot pens but Jane saw six cheap shoes,-90,4M,Pat held nine cheap hats when Mike gave eight red toys,90
SOS,10.0,9M,Sue bought eight small bags where Bob found ten big toys,90,2M,Sam found two hot cards if Jane bought eight old socks,-90
SOS,10.0,4M,Sue sold six cheap hats while Mike gave ten big socks,90,7M,Pat held four new bags where Pat saw five cheap toys,-90
SOS,10.0,7M,Sue lost five small hats or Sam bought six new cards,-90,5M,Lynn gave two new socks where Bob held ten hot hats,90
SOS,10.0,5M,Sue bought four old hats or Lynn sold four hot hats,90,11M,Jane took eight cheap pens if Jane bought five red cards,-90
SOS,10.0,3M,Sue saw three red cards then Jill bought ten hot toys,-90,2M,Jill sold five cheap shoes while Jane found four new cards,90
SOS,10.0,11M,Sue found six hot toys but Sam took two new bags,-90,5M,Pat sold two big socks while Jane bought nine small hats,90
SOS,10.0,5M,Sue lost nine hot socks while Lynn held nine red toys,-90,2M,Bob sold four cheap shoes but Sam gave ten small shoes,90
SOS,10.0,11M,Sue bought two green socks but Mike held ten green bags,90,9M,Bob held six big gloves while Jill found four new toys,-90
SOS,10.0,4M,Sue saw eight red socks if Pat saw eight cheap hats,-90,10M,Pat held two hot shoes then Jill gave ten new toys,90
SOS,10.0,3M,Sue sold four green gloves where Lynn held five small gloves,90,10M,Pat took two new shoes when Bob gave four red socks,-90
SOS,10.0,4M,Sue bought nine small shoes and Jill lost four red hats,90,1M,Sam saw three old pens while Lynn sold two small toys,-90
