stim_num,stim_type,n_srcs,src,is_target,pattern,alt_rate,init_angle
1018,SIM,3,10M,False,PAT LOST SIX OLD SHOES,4.0,90.0
1018,SIM,3,5M,False,MIKE GAVE FOUR RED CARDS,4.0,-90.0
1019,SIM,3,7M,True,SUE GAVE THREE GREEN HATS,4.0,-90.0
1019,SIM,3,9M,False,SAM BOUGHT FOUR CHEAP CARDS,4.0,90.0
1019,SIM,3,10M,False,MIKE TOOK FIVE NEW SOCKS,4.0,-90.0
1020,SIM,3,3M,True,SUE BOUGHT SIX BIG TOYS,4.0,90.0
1020,SIM,3,10M,False,MIKE FOUND NINE SMALL PENS,4.0,-90.0
1020,SIM,3,1M,False,BOB HELD TEN OLD HATS,4.0,90.0
1021,SIM,3,9M,True,SUE SOLD EIGHT SMALL TOYS,4.0,-90.0
1021,SIM,3,1M,False,JILL LOST NINE NEW CARDS,4.0,90.0
1021,SIM,3,11M,False,SAM HELD FOUR BIG BAGS,4.0,-90.0
1022,SIM,3,2M,True,SUE HELD EIGHT HOT SOCKS,4.0,-90.0
1022,SIM,3,11M,False,JANE LOST NINE NEW SHOES,4.0,90.0
1022,SIM,3,1M,False,JILL SAW TEN GREEN HATS,4.0,-90.0
1023,SIM,3,7M,True,SUE FOUND SIX CHEAP CARDS,4.0,-90.0
1023,SIM,3,9M,False,LYNN GAVE FIVE NEW HATS,4.0,90.0
1023,SIM,3,11M,False,JILL BOUGHT TEN BIG TOYS,4.0,-90.0
1024,SIM,3,2M,True,SUE TOOK FOUR OLD BAGS,4.0,90.0
1024,SIM,3,7M,False,BOB SAW SIX RED CARDS,4.0,-90.0
1024,SIM,3,3M,False,MIKE FOUND FIVE CHEAP GLOVES,4.0,90.0
1025,SIM,3,5M,True,SUE BOUGHT TWO HOT BAGS,4.0,90.0
1025,SIM,3,7M,False,PAT TOOK THREE CHEAP GLOVES,4.0,-90.0
1025,SIM,3,10M,False,MIKE GAVE FOUR OLD PENS,4.0,90.0
1026,SIM,3,1M,True,SUE LOST EIGHT SMALL CARDS,4.0,-90.0
1026,SIM,3,7M,False,MIKE SAW TEN OLD HATS,4.0,90.0
1026,SIM,3,5M,False,JILL HELD TWO HOT SOCKS,4.0,-90.0
1027,SIM,3,10M,True,SUE BOUGHT SIX HOT SHOES,4.0,-90.0
1027,SIM,3,7M,False,LYNN TOOK TWO GREEN TOYS,4.0,90.0
1027,SIM,3,2M,False,BOB GAVE THREE BIG CARDS,4.0,-90.0
1028,SIM,3,9M,True,SUE GAVE FOUR HOT SHOES,4.0,-90.0
1028,SIM,3,11M,False,JILL TOOK TWO BIG TOYS,4.0,90.0
1028,SIM,3,10M,False,JANE SOLD SIX SMALL CARDS,4.0,-90.0
1029,SIM,3,1M,True,SUE LOST NINE HOT SHOES,4.0,90.0
1029,SIM,3,11M,False,PAT BOUGHT EIGHT OLD SOCKS,4.0,-90.0
1029,SIM,3,9M,False,BOB TOOK TWO RED TOYS,4.0,90.0
1030,SIM,3,10M,True,SUE LOST FOUR RED GLOVES,4.0,90.0
1030,SIM,3,7M,False,JANE GAVE SIX SMALL HATS,4.0,-90.0
1030,SIM,3,9M,False,SAM HELD NINE HOT SHOES,4.0,90.0
1031,SIM,3,4M,True,SUE HELD EIGHT HOT TOYS,4.0,90.0
1031,SIM,3,8M,False,SAM FOUND TEN CHEAP CARDS,4.0,-90.0
1031,SIM,3,2M,False,PAT GAVE TWO NEW PENS,4.0,90.0
1032,SIM,3,10M,True,SUE HELD FIVE OLD SOCKS,4.0,90.0
1032,SIM,3,9M,False,JANE FOUND SIX RED TOYS,4.0,-90.0
1032,SIM,3,3M,False,PAT BOUGHT NINE HOT CARDS,4.0,90.0
1033,SIM,3,11M,True,SUE LOST TWO SMALL SHOES,4.0,90.0
1033,SIM,3,5M,False,JANE HELD THREE OLD GLOVES,4.0,-90.0
1033,SIM,3,8M,False,PAT FOUND FOUR CHEAP HATS,4.0,90.0
1034,SIM,3,11M,True,SUE SOLD TWO RED SOCKS,4.0,90.0
1034,SIM,3,7M,False,JILL GAVE EIGHT NEW SHOES,4.0,-90.0
1034,SIM,3,3M,False,JANE HELD TEN SMALL PENS,4.0,90.0
1035,SIM,3,3M,True,SUE SAW EIGHT OLD GLOVES,4.0,-90.0
1035,SIM,3,7M,False,JANE HELD THREE NEW HATS,4.0,90.0
1035,SIM,3,5M,False,JILL LOST SIX HOT SHOES,4.0,-90.0
1036,SIM,3,9M,True,SUE SAW NINE NEW TOYS,4.0,90.0
1036,SIM,3,10M,False,MIKE GAVE FIVE HOT BAGS,4.0,-90.0
1036,SIM,3,5M,False,BOB BOUGHT SIX BIG GLOVES,4.0,90.0
1037,SIM,3,4M,True,SUE TOOK TEN SMALL SHOES,4.0,-90.0
1037,SIM,3,5M,False,MIKE GAVE NINE RED BAGS,4.0,90.0
1037,SIM,3,2M,False,PAT SOLD FOUR CHEAP GLOVES,4.0,-90.0
1038,SIM,3,1M,True,SUE HELD TWO NEW HATS,4.0,90.0
1038,SIM,3,7M,False,SAM FOUND NINE CHEAP PENS,4.0,-90.0
1038,SIM,3,11M,False,PAT GAVE EIGHT SMALL CARDS,4.0,90.0
1039,SIM,3,10M,True,SUE SAW EIGHT HOT SOCKS,4.0,-90.0
1039,SIM,3,1M,False,JANE TOOK THREE BIG HATS,4.0,90.0
1039,SIM,3,2M,False,PAT SOLD TEN GREEN SHOES,4.0,-90.0
1040,SIM,3,8M,True,SUE SAW TWO OLD CARDS,4.0,90.0
1040,SIM,3,10M,False,PAT SOLD EIGHT GREEN HATS,4.0,-90.0
1040,SIM,3,4M,False,MIKE TOOK FOUR NEW GLOVES,4.0,90.0
1041,SIM,3,9M,True,SUE TOOK FOUR BIG SOCKS,4.0,90.0
1041,SIM,3,10M,False,JANE FOUND THREE CHEAP BAGS,4.0,-90.0
1041,SIM,3,2M,False,PAT SAW TEN GREEN CARDS,4.0,90.0
1042,SIM,3,3M,True,SUE HELD NINE SMALL SHOES,4.0,90.0
1042,SIM,3,2M,False,PAT SOLD EIGHT RED CARDS,4.0,-90.0
1042,SIM,3,9M,False,MIKE LOST TWO OLD SOCKS,4.0,90.0
1043,SIM,3,5M,True,SUE LOST FOUR OLD TOYS,4.0,-90.0
1043,SIM,3,1M,False,SAM HELD TEN CHEAP GLOVES,4.0,90.0
1043,SIM,3,9M,False,JANE BOUGHT NINE HOT CARDS,4.0,-90.0
1044,SIM,3,7M,True,SUE LOST FOUR CHEAP GLOVES,4.0,-90.0
1044,SIM,3,8M,False,SAM BOUGHT FIVE OLD PENS,4.0,90.0
1044,SIM,3,1M,False,MIKE SOLD THREE RED TOYS,4.0,-90.0
1045,SIM,3,9M,True,SUE TOOK SIX SMALL GLOVES,4.0,-90.0
1045,SIM,3,11M,False,LYNN GAVE FOUR GREEN TOYS,4.0,90.0
1045,SIM,3,2M,False,BOB SAW FIVE HOT BAGS,4.0,-90.0
1046,SIM,3,9M,True,SUE SOLD TEN NEW SOCKS,4.0,-90.0
1046,SIM,3,2M,False,BOB LOST NINE RED PENS,4.0,90.0
1046,SIM,3,5M,False,PAT BOUGHT SIX SMALL GLOVES,4.0,-90.0
1047,SIM,3,9M,True,SUE BOUGHT FOUR OLD CARDS,4.0,90.0
1047,SIM,3,8M,False,PAT SOLD NINE SMALL HATS,4.0,-90.0
1047,SIM,3,7M,False,SAM FOUND THREE CHEAP PENS,4.0,90.0
1048,SIM,3,8M,True,SUE SAW FIVE GREEN HATS,4.0,-90.0
1048,SIM,3,7M,False,LYNN FOUND TEN CHEAP CARDS,4.0,90.0
1048,SIM,3,10M,False,SAM TOOK THREE OLD SHOES,4.0,-90.0
1049,SIM,3,5M,True,SUE TOOK FIVE BIG GLOVES,4.0,-90.0
1049,SIM,3,8M,False,JILL SAW THREE HOT SHOES,4.0,90.0
1049,SIM,3,10M,False,JANE LOST EIGHT SMALL CARDS,4.0,-90.0
1050,SIM,3,8M,True,SUE GAVE TEN NEW HATS,4.0,-90.0
1050,SIM,3,9M,False,JANE HELD NINE SMALL SOCKS,4.0,90.0
1050,SIM,3,7M,False,MIKE LOST EIGHT OLD PENS,4.0,-90.0
1051,SIM,3,9M,True,SUE FOUND NINE BIG BAGS,4.0,-90.0
1051,SIM,3,11M,False,JANE BOUGHT FIVE GREEN SHOES,4.0,90.0
1051,SIM,3,8M,False,PAT TOOK SIX SMALL TOYS,4.0,-90.0
1052,SIM,3,5M,True,SUE FOUND TWO GREEN PENS,4.0,90.0
1052,SIM,3,11M,False,MIKE BOUGHT THREE RED BAGS,4.0,-90.0
1052,SIM,3,1M,False,PAT TOOK FIVE SMALL HATS,4.0,90.0
1053,SIM,3,7M,True,SUE TOOK FIVE SMALL SOCKS,4.0,-90.0
1053,SIM,3,5M,False,SAM HELD EIGHT NEW GLOVES,4.0,90.0
1053,SIM,3,4M,False,BOB FOUND TWO BIG PENS,4.0,-90.0
1054,SIM,3,8M,True,SUE LOST TEN CHEAP GLOVES,4.0,-90.0
1054,SIM,3,1M,False,JILL BOUGHT FIVE GREEN SOCKS,4.0,90.0
1054,SIM,3,7M,False,JANE SOLD SIX NEW CARDS,4.0,-90.0
1055,SIM,3,11M,True,SUE BOUGHT TWO OLD BAGS,4.0,-90.0
1055,SIM,3,9M,False,JILL TOOK SIX NEW CARDS,4.0,90.0
1055,SIM,3,2M,False,SAM LOST NINE HOT GLOVES,4.0,-90.0
1056,SIM,3,5M,True,SUE FOUND SIX SMALL CARDS,4.0,90.0
1056,SIM,3,4M,False,JANE SOLD TWO GREEN HATS,4.0,-90.0
1056,SIM,3,7M,False,PAT BOUGHT EIGHT BIG PENS,4.0,90.0
1057,SIM,3,3M,True,SUE SAW FIVE GREEN BAGS,4.0,90.0
1057,SIM,3,9M,False,JILL BOUGHT NINE NEW GLOVES,4.0,-90.0
1057,SIM,3,7M,False,PAT SOLD TEN CHEAP SHOES,4.0,90.0
1058,SIM,3,11M,True,SUE FOUND NINE NEW SHOES,4.0,-90.0
1058,SIM,3,10M,False,SAM LOST FOUR HOT GLOVES,4.0,90.0
1058,SIM,3,2M,False,MIKE HELD SIX OLD PENS,4.0,-90.0
1059,SIM,3,7M,True,SUE GAVE TEN BIG CARDS,4.0,90.0
1059,SIM,3,1M,False,SAM SAW THREE CHEAP HATS,4.0,-90.0
1059,SIM,3,10M,False,MIKE HELD NINE OLD PENS,4.0,90.0
1060,SIM,3,9M,True,SUE FOUND FIVE SMALL HATS,4.0,90.0
1060,SIM,3,8M,False,BOB SOLD TEN OLD CARDS,4.0,-90.0
1060,SIM,3,7M,False,SAM BOUGHT TWO HOT SOCKS,4.0,90.0
1061,SIM,3,10M,True,SUE FOUND FIVE NEW CARDS,4.0,90.0
1061,SIM,3,8M,False,JANE TOOK TWO BIG PENS,4.0,-90.0
1061,SIM,3,1M,False,JILL BOUGHT EIGHT HOT SOCKS,4.0,90.0
1062,SIM,3,2M,True,SUE GAVE NINE RED BAGS,4.0,90.0
1062,SIM,3,11M,False,PAT TOOK TEN GREEN SHOES,4.0,-90.0
1062,SIM,3,7M,False,MIKE BOUGHT FOUR OLD HATS,4.0,90.0
1063,SIM,3,4M,True,SUE LOST THREE RED TOYS,4.0,-90.0
1063,SIM,3,1M,False,JILL BOUGHT SIX GREEN SOCKS,4.0,90.0
1063,SIM,3,11M,False,LYNN SOLD NINE CHEAP GLOVES,4.0,-90.0
1064,SIM,3,2M,True,SUE LOST TWO NEW BAGS,4.0,90.0
1064,SIM,3,8M,False,JANE SAW FIVE CHEAP GLOVES,4.0,-90.0
1064,SIM,3,11M,False,LYNN HELD FOUR SMALL SOCKS,4.0,90.0
1065,SIM,3,5M,True,SUE HELD FIVE HOT SOCKS,4.0,90.0
1065,SIM,3,7M,False,JILL TOOK FOUR SMALL PENS,4.0,-90.0
1065,SIM,3,8M,False,SAM SOLD THREE OLD HATS,4.0,90.0
1066,SIM,3,3M,True,SUE LOST FIVE SMALL SOCKS,4.0,90.0
1066,SIM,3,10M,False,JILL BOUGHT TEN RED TOYS,4.0,-90.0
1066,SIM,3,1M,False,BOB GAVE EIGHT GREEN GLOVES,4.0,90.0
1067,SIM,3,8M,True,SUE HELD THREE NEW HATS,4.0,-90.0
1067,SIM,3,9M,False,PAT LOST FOUR OLD CARDS,4.0,90.0
1067,SIM,3,2M,False,MIKE GAVE FIVE HOT BAGS,4.0,-90.0
1068,SIM,3,2M,True,SUE TOOK FOUR NEW CARDS,4.0,90.0
1068,SIM,3,11M,False,BOB GAVE THREE GREEN SOCKS,4.0,-90.0
1068,SIM,3,10M,False,MIKE HELD EIGHT SMALL HATS,4.0,90.0
1069,SIM,3,7M,True,SUE GAVE NINE GREEN PENS,4.0,90.0
1069,SIM,3,10M,False,LYNN SAW FIVE SMALL SOCKS,4.0,-90.0
1069,SIM,3,3M,False,JANE SOLD FOUR RED BAGS,4.0,90.0
1070,SIM,3,7M,True,SUE FOUND FIVE HOT SHOES,4.0,-90.0
1070,SIM,3,8M,False,MIKE SAW FOUR OLD PENS,4.0,90.0
1070,SIM,3,11M,False,JILL GAVE TWO GREEN BAGS,4.0,-90.0
1071,SIM,3,9M,True,SUE SOLD EIGHT OLD TOYS,4.0,90.0
1071,SIM,3,1M,False,JILL FOUND FIVE BIG PENS,4.0,-90.0
1071,SIM,3,2M,False,BOB SAW NINE CHEAP SHOES,4.0,90.0
1072,SIM,3,5M,True,SUE GAVE THREE NEW CARDS,4.0,-90.0
1072,SIM,3,10M,False,MIKE SOLD EIGHT BIG SOCKS,4.0,90.0
1072,SIM,3,1M,False,JANE BOUGHT NINE OLD BAGS,4.0,-90.0
1073,SIM,3,11M,True,SUE SAW THREE GREEN PENS,4.0,90.0
1073,SIM,3,2M,False,JILL GAVE FIVE BIG TOYS,4.0,-90.0
1073,SIM,3,7M,False,MIKE TOOK FOUR OLD CARDS,4.0,90.0
1074,SIM,3,5M,True,SUE SAW FOUR HOT SHOES,4.0,-90.0
1074,SIM,3,8M,False,BOB GAVE FIVE RED GLOVES,4.0,90.0
1074,SIM,3,10M,False,LYNN LOST TEN OLD SOCKS,4.0,-90.0
1075,SIM,3,3M,True,SUE GAVE FIVE HOT GLOVES,4.0,90.0
1075,SIM,3,5M,False,LYNN FOUND THREE OLD PENS,4.0,-90.0
1075,SIM,3,10M,False,MIKE BOUGHT NINE GREEN SHOES,4.0,90.0
1076,SIM,3,3M,True,SUE SOLD TWO NEW SHOES,4.0,-90.0
1076,SIM,3,11M,False,SAM LOST FOUR RED GLOVES,4.0,90.0
1076,SIM,3,7M,False,JANE HELD SIX OLD TOYS,4.0,-90.0
1077,SIM,3,8M,True,SUE HELD FIVE BIG TOYS,4.0,90.0
1077,SIM,3,4M,False,LYNN LOST EIGHT HOT BAGS,4.0,-90.0
1077,SIM,3,9M,False,SAM SOLD TEN OLD GLOVES,4.0,90.0
1078,SIM,3,4M,True,SUE LOST EIGHT SMALL BAGS,4.0,-90.0
1078,SIM,3,9M,False,BOB GAVE FOUR HOT PENS,4.0,90.0
1078,SIM,3,11M,False,LYNN BOUGHT FIVE RED SHOES,4.0,-90.0
1079,SIM,3,5M,True,SUE FOUND THREE GREEN HATS,4.0,90.0
1079,SIM,3,7M,False,JANE GAVE EIGHT OLD CARDS,4.0,-90.0
1079,SIM,3,9M,False,MIKE BOUGHT FIVE RED PENS,4.0,90.0
1080,SIM,3,11M,True,SUE TOOK THREE BIG CARDS,4.0,90.0
1080,SIM,3,4M,False,SAM GAVE FIVE GREEN HATS,4.0,-90.0
1080,SIM,3,7M,False,JANE BOUGHT TEN NEW TOYS,4.0,90.0
1081,SIM,3,5M,True,SUE SAW FIVE GREEN CARDS,4.0,90.0
1081,SIM,3,7M,False,LYNN FOUND FOUR OLD TOYS,4.0,-90.0
1081,SIM,3,3M,False,JILL TOOK SIX HOT PENS,4.0,90.0
1082,SIM,3,9M,True,SUE GAVE SIX GREEN PENS,4.0,90.0
1082,SIM,3,2M,False,JILL FOUND TWO RED SHOES,4.0,-90.0
1082,SIM,3,10M,False,BOB HELD NINE OLD SOCKS,4.0,90.0
1083,SIM,3,11M,True,SUE LOST FIVE GREEN PENS,4.0,-90.0
1083,SIM,3,2M,False,JILL GAVE THREE BIG CARDS,4.0,90.0
1083,SIM,3,3M,False,JANE HELD FOUR SMALL SHOES,4.0,-90.0
1084,SIM,3,10M,True,SUE FOUND TWO NEW PENS,4.0,90.0
1084,SIM,3,7M,False,MIKE HELD FOUR SMALL CARDS,4.0,-90.0
1084,SIM,3,8M,False,BOB GAVE THREE CHEAP GLOVES,4.0,90.0
1085,SIM,3,4M,True,SUE HELD TEN NEW PENS,4.0,-90.0
1085,SIM,3,7M,False,LYNN GAVE EIGHT GREEN GLOVES,4.0,90.0
1085,SIM,3,8M,False,BOB SOLD FIVE OLD TOYS,4.0,-90.0
1086,SIM,3,7M,True,SUE GAVE SIX HOT PENS,4.0,90.0
1086,SIM,3,11M,False,PAT TOOK FIVE BIG CARDS,4.0,-90.0
1086,SIM,3,1M,False,LYNN SAW THREE NEW SOCKS,4.0,90.0
1087,SIM,3,2M,True,SUE FOUND SIX OLD GLOVES,4.0,90.0
1087,SIM,3,11M,False,PAT SAW TWO HOT CARDS,4.0,-90.0
1087,SIM,3,7M,False,LYNN SOLD TEN GREEN SOCKS,4.0,90.0
1088,SIM,3,7M,True,SUE SOLD TEN BIG PENS,4.0,-90.0
1088,SIM,3,2M,False,JANE TOOK FIVE NEW CARDS,4.0,90.0
1088,SIM,3,8M,False,BOB BOUGHT TWO HOT SOCKS,4.0,-90.0
1089,SIM,3,3M,True,SUE GAVE NINE SMALL GLOVES,4.0,90.0
1089,SIM,3,5M,False,LYNN FOUND EIGHT NEW BAGS,4.0,-90.0
1089,SIM,3,10M,False,SAM SOLD TEN BIG CARDS,4.0,90.0
1090,SIM,3,7M,True,SUE LOST FIVE NEW SOCKS,4.0,90.0
1090,SIM,3,8M,False,JILL SAW EIGHT BIG HATS,4.0,-90.0
1090,SIM,3,2M,False,MIKE TOOK TWO OLD TOYS,4.0,90.0
1091,SIM,3,3M,True,SUE TOOK FIVE BIG TOYS,4.0,-90.0
1091,SIM,3,7M,False,LYNN BOUGHT TWO RED HATS,4.0,90.0
1091,SIM,3,4M,False,BOB SAW EIGHT SMALL SHOES,4.0,-90.0
1092,SIM,3,2M,True,SUE HELD SIX NEW PENS,4.0,-90.0
1092,SIM,3,3M,False,SAM GAVE NINE OLD CARDS,4.0,90.0
1092,SIM,3,1M,False,BOB BOUGHT FOUR GREEN SOCKS,4.0,-90.0
1093,SIM,3,4M,True,SUE SAW TWO BIG CARDS,4.0,-90.0
1093,SIM,3,1M,False,PAT GAVE THREE GREEN PENS,4.0,90.0
1093,SIM,3,9M,False,MIKE SOLD SIX HOT BAGS,4.0,-90.0
1094,SIM,3,1M,True,SUE FOUND TWO HOT SOCKS,4.0,-90.0
1094,SIM,3,5M,False,JANE LOST EIGHT GREEN BAGS,4.0,90.0
1094,SIM,3,9M,False,BOB SOLD SIX OLD SHOES,4.0,-90.0
1095,SIM,3,2M,True,SUE SOLD NINE OLD SOCKS,4.0,-90.0
1095,SIM,3,3M,False,MIKE LOST THREE HOT TOYS,4.0,90.0
1095,SIM,3,10M,False,SAM GAVE FIVE SMALL GLOVES,4.0,-90.0
1096,SIM,3,2M,True,SUE SOLD SIX RED GLOVES,4.0,90.0
1096,SIM,3,1M,False,LYNN HELD TWO SMALL CARDS,4.0,-90.0
1096,SIM,3,7M,False,MIKE FOUND TEN CHEAP SOCKS,4.0,90.0
1097,SIM,3,2M,True,SUE LOST TWO HOT BAGS,4.0,90.0
1097,SIM,3,3M,False,BOB FOUND NINE SMALL TOYS,4.0,-90.0
1097,SIM,3,10M,False,SAM HELD TEN OLD SHOES,4.0,90.0
1098,SIM,3,1M,True,SUE FOUND EIGHT SMALL GLOVES,4.0,90.0
1098,SIM,3,4M,False,MIKE GAVE FOUR OLD TOYS,4.0,-90.0
1098,SIM,3,8M,False,LYNN TOOK TEN RED BAGS,4.0,90.0
1099,SIM,3,3M,True,SUE SAW NINE HOT GLOVES,4.0,-90.0
1099,SIM,3,4M,False,JILL HELD FOUR CHEAP SHOES,4.0,90.0
1099,SIM,3,11M,False,JANE SOLD TEN RED TOYS,4.0,-90.0
1100,SIM,3,1M,True,SUE GAVE TEN BIG CARDS,8.0,90.0
1100,SIM,3,11M,False,JILL TOOK FOUR SMALL PENS,8.0,-90.0
1100,SIM,3,7M,False,LYNN SOLD NINE GREEN GLOVES,8.0,90.0
1101,SIM,3,8M,True,SUE SAW EIGHT CHEAP PENS,8.0,90.0
1101,SIM,3,1M,False,JANE HELD FOUR HOT TOYS,8.0,-90.0
1101,SIM,3,9M,False,JILL FOUND NINE SMALL CARDS,8.0,90.0
1102,SIM,3,7M,True,SUE LOST FOUR GREEN BAGS,8.0,90.0
1102,SIM,3,4M,False,JANE TOOK EIGHT HOT SOCKS,8.0,-90.0
1102,SIM,3,9M,False,JILL SAW THREE CHEAP SHOES,8.0,90.0
1103,SIM,3,11M,True,SUE GAVE TWO BIG BAGS,8.0,90.0
1103,SIM,3,1M,False,JANE TOOK FIVE RED PENS,8.0,-90.0
1103,SIM,3,2M,False,PAT HELD NINE CHEAP GLOVES,8.0,90.0
1104,SIM,3,4M,True,SUE HELD FIVE BIG HATS,8.0,-90.0
1104,SIM,3,2M,False,SAM GAVE NINE RED GLOVES,8.0,90.0
1104,SIM,3,5M,False,MIKE BOUGHT TEN SMALL SHOES,8.0,-90.0
1105,SIM,3,11M,True,SUE BOUGHT NINE OLD CARDS,8.0,-90.0
1105,SIM,3,1M,False,SAM SAW SIX HOT BAGS,8.0,90.0
1105,SIM,3,8M,False,PAT SOLD FIVE CHEAP HATS,8.0,-90.0
1106,SIM,3,9M,True,SUE GAVE SIX NEW CARDS,8.0,90.0
1106,SIM,3,7M,False,SAM FOUND THREE HOT SOCKS,8.0,-90.0
1106,SIM,3,8M,False,LYNN BOUGHT FOUR GREEN SHOES,8.0,90.0
1107,SIM,3,7M,True,SUE FOUND SIX RED GLOVES,8.0,90.0
1107,SIM,3,10M,False,SAM SAW TWO NEW CARDS,8.0,-90.0
1107,SIM,3,3M,False,BOB GAVE FOUR HOT PENS,8.0,90.0
1108,SIM,3,8M,True,SUE HELD SIX GREEN BAGS,8.0,-90.0
1108,SIM,3,1M,False,SAM BOUGHT THREE NEW CARDS,8.0,90.0
1108,SIM,3,3M,False,JANE TOOK NINE CHEAP SHOES,8.0,-90.0
1109,SIM,3,3M,True,SUE SOLD FOUR BIG GLOVES,8.0,90.0
1109,SIM,3,9M,False,PAT GAVE EIGHT NEW BAGS,8.0,-90.0
1109,SIM,3,7M,False,MIKE FOUND THREE SMALL SOCKS,8.0,90.0
1110,SIM,3,11M,True,SUE SAW NINE HOT BAGS,8.0,-90.0
1110,SIM,3,9M,False,JANE SOLD TEN SMALL CARDS,8.0,90.0
1110,SIM,3,2M,False,SAM TOOK FIVE GREEN SHOES,8.0,-90.0
1111,SIM,3,10M,True,SUE GAVE TEN SMALL SHOES,8.0,-90.0
1111,SIM,3,3M,False,JILL LOST NINE GREEN SOCKS,8.0,90.0
1111,SIM,3,1M,False,BOB TOOK TWO CHEAP HATS,8.0,-90.0
1112,SIM,3,8M,True,SUE GAVE SIX OLD SHOES,8.0,-90.0
1112,SIM,3,1M,False,JILL TOOK EIGHT RED CARDS,8.0,90.0
1112,SIM,3,2M,False,PAT SAW TWO HOT PENS,8.0,-90.0
1113,SIM,3,5M,True,SUE BOUGHT NINE HOT SOCKS,8.0,-90.0
1113,SIM,3,8M,False,BOB GAVE TEN NEW HATS,8.0,90.0
1113,SIM,3,7M,False,JANE SAW FIVE RED TOYS,8.0,-90.0
1114,SIM,3,7M,True,SUE HELD FOUR HOT PENS,8.0,90.0
1114,SIM,3,11M,False,LYNN FOUND TWO RED CARDS,8.0,-90.0
1114,SIM,3,9M,False,SAM LOST EIGHT NEW HATS,8.0,90.0
1115,SIM,3,8M,True,SUE LOST SIX OLD GLOVES,8.0,90.0
1115,SIM,3,7M,False,SAM FOUND TWO RED PENS,8.0,-90.0
1115,SIM,3,4M,False,PAT SAW FOUR SMALL HATS,8.0,90.0
1116,SIM,3,8M,True,SUE GAVE TEN HOT HATS,8.0,-90.0
1116,SIM,3,7M,False,PAT SOLD TWO BIG SHOES,8.0,90.0
1116,SIM,3,1M,False,MIKE FOUND THREE OLD TOYS,8.0,-90.0
1117,SIM,3,1M,True,SUE GAVE THREE NEW CARDS,8.0,90.0
1117,SIM,3,3M,False,BOB SOLD TEN GREEN TOYS,8.0,-90.0
1117,SIM,3,10M,False,JANE HELD EIGHT CHEAP PENS,8.0,90.0
1118,SIM,3,5M,True,SUE TOOK FOUR SMALL CARDS,8.0,90.0
1118,SIM,3,9M,False,BOB GAVE THREE NEW SOCKS,8.0,-90.0
1118,SIM,3,1M,False,SAM SAW TWO BIG GLOVES,8.0,90.0
1119,SIM,3,4M,True,SUE TOOK EIGHT NEW SOCKS,8.0,-90.0
1119,SIM,3,5M,False,PAT LOST SIX CHEAP TOYS,8.0,90.0
1119,SIM,3,8M,False,JANE SAW TEN OLD HATS,8.0,-90.0
1120,SIM,3,9M,True,SUE SOLD SIX NEW TOYS,8.0,90.0
1120,SIM,3,8M,False,PAT GAVE FOUR OLD PENS,8.0,-90.0
1120,SIM,3,4M,False,JILL LOST FIVE CHEAP BAGS,8.0,90.0
1121,SIM,3,5M,True,SUE SOLD EIGHT HOT SHOES,8.0,-90.0
1121,SIM,3,10M,False,SAM LOST NINE RED CARDS,8.0,90.0
1121,SIM,3,3M,False,BOB GAVE TEN SMALL SOCKS,8.0,-90.0
1122,SIM,3,10M,True,SUE GAVE THREE CHEAP PENS,8.0,-90.0
1122,SIM,3,1M,False,LYNN HELD FIVE SMALL BAGS,8.0,90.0
1122,SIM,3,3M,False,JILL SOLD NINE BIG HATS,8.0,-90.0
1123,SIM,3,10M,True,SUE SAW FIVE CHEAP SOCKS,8.0,-90.0
1123,SIM,3,9M,False,JILL LOST TWO HOT GLOVES,8.0,90.0
1123,SIM,3,2M,False,MIKE SOLD TEN OLD SHOES,8.0,-90.0
1124,SIM,3,3M,True,SUE SAW SIX RED SHOES,8.0,-90.0
1124,SIM,3,2M,False,PAT SOLD NINE HOT HATS,8.0,90.0
1124,SIM,3,4M,False,JANE GAVE EIGHT OLD PENS,8.0,-90.0
1125,SIM,3,5M,True,SUE BOUGHT NINE RED TOYS,8.0,90.0
1125,SIM,3,7M,False,BOB GAVE THREE GREEN HATS,8.0,-90.0
1125,SIM,3,1M,False,JILL TOOK FIVE NEW CARDS,8.0,90.0
1126,SIM,3,4M,True,SUE FOUND TWO SMALL BAGS,8.0,90.0
1126,SIM,3,5M,False,PAT GAVE THREE HOT PENS,8.0,-90.0
1126,SIM,3,11M,False,BOB LOST TEN BIG CARDS,8.0,90.0
1127,SIM,3,2M,True,SUE TOOK NINE RED PENS,8.0,90.0
1127,SIM,3,11M,False,JILL SOLD TEN NEW BAGS,8.0,-90.0
1127,SIM,3,9M,False,SAM SAW TWO GREEN SHOES,8.0,90.0
1128,SIM,3,11M,True,SUE FOUND SIX BIG CARDS,8.0,90.0
1128,SIM,3,5M,False,BOB HELD TWO GREEN SOCKS,8.0,-90.0
1128,SIM,3,1M,False,JILL LOST TEN CHEAP BAGS,8.0,90.0
1129,SIM,3,8M,True,SUE BOUGHT FIVE NEW CARDS,8.0,-90.0
1129,SIM,3,7M,False,SAM FOUND THREE BIG BAGS,8.0,90.0
1129,SIM,3,3M,False,LYNN SAW TEN GREEN PENS,8.0,-90.0
1130,SIM,3,10M,True,SUE FOUND THREE NEW BAGS,8.0,90.0
1130,SIM,3,3M,False,MIKE SOLD NINE BIG HATS,8.0,-90.0
1130,SIM,3,5M,False,PAT SAW TWO SMALL GLOVES,8.0,90.0
1131,SIM,3,11M,True,SUE TOOK TEN BIG PENS,8.0,90.0
1131,SIM,3,9M,False,JANE BOUGHT EIGHT OLD GLOVES,8.0,-90.0
1131,SIM,3,8M,False,LYNN SAW SIX CHEAP BAGS,8.0,90.0
1132,SIM,3,7M,True,SUE BOUGHT FOUR RED PENS,8.0,-90.0
1132,SIM,3,10M,False,BOB LOST NINE CHEAP TOYS,8.0,90.0
1132,SIM,3,5M,False,SAM FOUND THREE SMALL SHOES,8.0,-90.0
1133,SIM,3,9M,True,SUE SAW FOUR RED CARDS,8.0,90.0
1133,SIM,3,2M,False,BOB SOLD TEN CHEAP TOYS,8.0,-90.0
1133,SIM,3,11M,False,SAM FOUND SIX NEW HATS,8.0,90.0
1134,SIM,3,4M,True,SUE LOST FIVE BIG SHOES,8.0,90.0
1134,SIM,3,9M,False,LYNN SAW EIGHT OLD CARDS,8.0,-90.0
1134,SIM,3,8M,False,MIKE SOLD TWO GREEN SOCKS,8.0,90.0
1135,SIM,3,9M,True,SUE SOLD TWO CHEAP GLOVES,8.0,90.0
1135,SIM,3,2M,False,BOB GAVE THREE RED HATS,8.0,-90.0
1135,SIM,3,3M,False,SAM HELD EIGHT BIG TOYS,8.0,90.0
1136,SIM,3,8M,True,SUE GAVE TEN RED BAGS,8.0,-90.0
1136,SIM,3,3M,False,SAM LOST TWO OLD GLOVES,8.0,90.0
1136,SIM,3,11M,False,LYNN FOUND FOUR GREEN SOCKS,8.0,-90.0
1137,SIM,3,10M,True,SUE GAVE FOUR RED SOCKS,8.0,-90.0
1137,SIM,3,8M,False,BOB SOLD FIVE HOT TOYS,8.0,90.0
1137,SIM,3,5M,False,MIKE BOUGHT TEN SMALL PENS,8.0,-90.0
1138,SIM,3,4M,True,SUE BOUGHT FIVE RED SHOES,8.0,-90.0
1138,SIM,3,7M,False,SAM SOLD NINE SMALL TOYS,8.0,90.0
1138,SIM,3,5M,False,BOB HELD THREE CHEAP GLOVES,8.0,-90.0
1139,SIM,3,8M,True,SUE SAW TWO SMALL HATS,8.0,-90.0
1139,SIM,3,11M,False,BOB SOLD FIVE NEW GLOVES,8.0,90.0
1139,SIM,3,9M,False,PAT FOUND THREE GREEN SOCKS,8.0,-90.0
1140,SIM,3,4M,True,SUE BOUGHT FOUR NEW SOCKS,8.0,90.0
1140,SIM,3,9M,False,LYNN SOLD FIVE RED GLOVES,8.0,-90.0
1140,SIM,3,1M,False,SAM FOUND SIX CHEAP SHOES,8.0,90.0
1141,SIM,3,10M,True,SUE LOST TWO NEW GLOVES,8.0,90.0
1141,SIM,3,3M,False,PAT HELD FOUR SMALL CARDS,8.0,-90.0
1141,SIM,3,5M,False,SAM TOOK NINE CHEAP PENS,8.0,90.0
1142,SIM,3,7M,True,SUE BOUGHT NINE GREEN BAGS,8.0,90.0
1142,SIM,3,3M,False,JILL FOUND THREE CHEAP PENS,8.0,-90.0
1142,SIM,3,8M,False,LYNN SOLD TWO HOT CARDS,8.0,90.0
1143,SIM,3,2M,True,SUE LOST SIX BIG SHOES,8.0,90.0
1143,SIM,3,10M,False,BOB HELD TWO NEW CARDS,8.0,-90.0
1143,SIM,3,3M,False,SAM FOUND EIGHT HOT SOCKS,8.0,90.0
1144,SIM,3,9M,True,SUE BOUGHT SIX RED SHOES,8.0,90.0
1144,SIM,3,1M,False,JANE TOOK FIVE NEW CARDS,8.0,-90.0
1144,SIM,3,2M,False,JILL GAVE EIGHT BIG BAGS,8.0,90.0
1145,SIM,3,1M,True,SUE HELD EIGHT OLD TOYS,8.0,90.0
1145,SIM,3,5M,False,PAT FOUND FIVE HOT PENS,8.0,-90.0
1145,SIM,3,4M,False,JILL GAVE TWO SMALL HATS,8.0,90.0
1146,SIM,3,11M,True,SUE BOUGHT TEN GREEN SHOES,8.0,-90.0
1146,SIM,3,8M,False,JILL LOST NINE BIG TOYS,8.0,90.0
1146,SIM,3,10M,False,BOB TOOK TWO RED SOCKS,8.0,-90.0
1147,SIM,3,8M,True,SUE TOOK FIVE OLD HATS,8.0,-90.0
1147,SIM,3,3M,False,SAM HELD NINE GREEN TOYS,8.0,90.0
1147,SIM,3,10M,False,LYNN FOUND THREE SMALL SHOES,8.0,-90.0
1148,SIM,3,2M,True,SUE TOOK TWO CHEAP SHOES,8.0,90.0
1148,SIM,3,11M,False,JANE BOUGHT TEN RED HATS,8.0,-90.0
1148,SIM,3,10M,False,SAM GAVE SIX HOT GLOVES,8.0,90.0
1149,SIM,3,10M,True,SUE SAW TWO BIG HATS,8.0,90.0
1149,SIM,3,1M,False,JILL SOLD NINE RED CARDS,8.0,-90.0
1149,SIM,3,4M,False,JANE GAVE THREE NEW TOYS,8.0,90.0
1150,SIM,3,11M,True,SUE FOUND SIX GREEN TOYS,8.0,-90.0
1150,SIM,3,7M,False,SAM SOLD TEN SMALL SOCKS,8.0,90.0
1150,SIM,3,8M,False,JANE HELD EIGHT OLD CARDS,8.0,-90.0
1151,SIM,3,11M,True,SUE BOUGHT TWO SMALL BAGS,8.0,90.0
1151,SIM,3,10M,False,JILL GAVE THREE GREEN HATS,8.0,-90.0
1151,SIM,3,7M,False,MIKE FOUND FIVE BIG TOYS,8.0,90.0
1152,SIM,3,1M,True,SUE GAVE FIVE NEW SOCKS,8.0,90.0
1152,SIM,3,2M,False,PAT SOLD FOUR RED GLOVES,8.0,-90.0
1152,SIM,3,8M,False,MIKE FOUND EIGHT OLD PENS,8.0,90.0
1153,SIM,3,1M,True,SUE LOST NINE CHEAP SHOES,8.0,-90.0
1153,SIM,3,9M,False,JILL HELD FOUR BIG BAGS,8.0,90.0
1153,SIM,3,8M,False,SAM SOLD FIVE GREEN GLOVES,8.0,-90.0
1154,SIM,3,9M,True,SUE SOLD TWO SMALL HATS,8.0,-90.0
1154,SIM,3,5M,False,JANE GAVE FIVE RED PENS,8.0,90.0
1154,SIM,3,11M,False,MIKE BOUGHT TEN CHEAP CARDS,8.0,-90.0
1155,SIM,3,2M,True,SUE TOOK SIX HOT PENS,8.0,-90.0
1155,SIM,3,3M,False,MIKE GAVE TWO CHEAP TOYS,8.0,90.0
1155,SIM,3,7M,False,BOB LOST FIVE SMALL SHOES,8.0,-90.0
1156,SIM,3,1M,True,SUE SAW NINE SMALL HATS,8.0,90.0
1156,SIM,3,11M,False,JILL SOLD TWO BIG SOCKS,8.0,-90.0
1156,SIM,3,9M,False,PAT LOST FOUR OLD BAGS,8.0,90.0
1157,SIM,3,8M,True,SUE TOOK THREE BIG GLOVES,8.0,90.0
1157,SIM,3,10M,False,BOB BOUGHT EIGHT HOT CARDS,8.0,-90.0
1157,SIM,3,1M,False,SAM SOLD SIX RED HATS,8.0,90.0
1158,SIM,3,1M,True,SUE LOST NINE CHEAP SOCKS,8.0,-90.0
1158,SIM,3,7M,False,JANE FOUND EIGHT HOT CARDS,8.0,90.0
1158,SIM,3,8M,False,LYNN TOOK FOUR SMALL TOYS,8.0,-90.0
1159,SIM,3,8M,True,SUE SAW THREE BIG GLOVES,8.0,-90.0
1159,SIM,3,2M,False,BOB FOUND TEN RED SHOES,8.0,90.0
1159,SIM,3,3M,False,MIKE LOST FOUR SMALL HATS,8.0,-90.0
1160,SIM,3,2M,True,SUE TOOK NINE GREEN HATS,8.0,90.0
1160,SIM,3,1M,False,JANE HELD FIVE CHEAP SOCKS,8.0,-90.0
1160,SIM,3,9M,False,SAM BOUGHT TWO RED BAGS,8.0,90.0
1161,SIM,3,2M,True,SUE BOUGHT FIVE HOT GLOVES,8.0,-90.0
1161,SIM,3,8M,False,PAT SOLD TEN GREEN SHOES,8.0,90.0
1161,SIM,3,9M,False,LYNN HELD EIGHT OLD HATS,8.0,-90.0
1162,SIM,3,1M,True,SUE LOST EIGHT OLD GLOVES,8.0,-90.0
1162,SIM,3,4M,False,JANE FOUND FOUR RED CARDS,8.0,90.0
1162,SIM,3,9M,False,JILL SAW TEN CHEAP SOCKS,8.0,-90.0
1163,SIM,3,3M,True,SUE BOUGHT EIGHT HOT SHOES,8.0,-90.0
1163,SIM,3,7M,False,PAT SOLD TEN OLD PENS,8.0,90.0
1163,SIM,3,8M,False,LYNN FOUND TWO NEW TOYS,8.0,-90.0
1164,SIM,3,5M,True,SUE BOUGHT NINE GREEN BAGS,8.0,90.0
1164,SIM,3,10M,False,JILL FOUND THREE NEW GLOVES,8.0,-90.0
1164,SIM,3,4M,False,JANE TOOK FIVE SMALL PENS,8.0,90.0
1165,SIM,3,8M,True,SUE BOUGHT TEN BIG PENS,8.0,-90.0
1165,SIM,3,7M,False,JILL GAVE NINE CHEAP TOYS,8.0,90.0
1165,SIM,3,4M,False,SAM LOST FOUR SMALL HATS,8.0,-90.0
1166,SIM,3,5M,True,SUE FOUND TWO SMALL SHOES,8.0,-90.0
1166,SIM,3,4M,False,SAM BOUGHT TEN HOT CARDS,8.0,90.0
1166,SIM,3,11M,False,BOB LOST SIX BIG BAGS,8.0,-90.0
1167,SIM,3,1M,True,SUE SOLD NINE GREEN SOCKS,8.0,90.0
1167,SIM,3,5M,False,MIKE SAW SIX BIG CARDS,8.0,-90.0
1167,SIM,3,8M,False,LYNN BOUGHT TEN NEW HATS,8.0,90.0
1168,SIM,3,9M,True,SUE FOUND TEN GREEN TOYS,8.0,-90.0
1168,SIM,3,8M,False,JILL SOLD SIX RED CARDS,8.0,90.0
1168,SIM,3,7M,False,BOB TOOK FIVE NEW SHOES,8.0,-90.0
1169,SIM,3,1M,True,SUE FOUND FOUR CHEAP PENS,8.0,90.0
1169,SIM,3,11M,False,SAM BOUGHT EIGHT GREEN CARDS,8.0,-90.0
1169,SIM,3,3M,False,BOB SOLD THREE NEW TOYS,8.0,90.0
1170,SIM,3,4M,True,SUE SAW FIVE NEW TOYS,8.0,90.0
1170,SIM,3,9M,False,MIKE GAVE THREE BIG PENS,8.0,-90.0
1170,SIM,3,7M,False,JANE BOUGHT NINE OLD GLOVES,8.0,90.0
1171,SIM,3,11M,True,SUE SAW NINE BIG SHOES,8.0,90.0
1171,SIM,3,3M,False,PAT BOUGHT SIX OLD SOCKS,8.0,-90.0
1171,SIM,3,1M,False,JANE HELD THREE CHEAP PENS,8.0,90.0
1172,SIM,3,2M,True,SUE SOLD TWO HOT SOCKS,8.0,-90.0
1172,SIM,3,5M,False,SAM SAW EIGHT RED GLOVES,8.0,90.0
1172,SIM,3,3M,False,LYNN TOOK FIVE OLD PENS,8.0,-90.0
1173,SIM,3,4M,True,SUE SOLD NINE HOT SOCKS,8.0,90.0
1173,SIM,3,2M,False,MIKE FOUND SIX RED BAGS,8.0,-90.0
1173,SIM,3,8M,False,JANE BOUGHT FIVE CHEAP HATS,8.0,90.0
1174,SIM,3,1M,True,SUE LOST THREE OLD PENS,8.0,-90.0
1174,SIM,3,3M,False,SAM HELD FOUR RED SOCKS,8.0,90.0
1174,SIM,3,5M,False,PAT GAVE NINE SMALL TOYS,8.0,-90.0
1175,SIM,3,11M,True,SUE HELD TEN CHEAP GLOVES,8.0,-90.0
1175,SIM,3,9M,False,SAM LOST THREE GREEN BAGS,8.0,90.0
1175,SIM,3,1M,False,BOB FOUND TWO RED SOCKS,8.0,-90.0
1176,SIM,3,2M,True,SUE BOUGHT THREE CHEAP PENS,8.0,-90.0
1176,SIM,3,9M,False,LYNN LOST FIVE SMALL GLOVES,8.0,90.0
1176,SIM,3,7M,False,JANE FOUND FOUR NEW SOCKS,8.0,-90.0
1177,SIM,3,2M,True,SUE SAW FIVE OLD TOYS,8.0,-90.0
