stim_type,alternation_rate,target_talker,target_sentence,init_target_position,masker_talker,masker_sentence,init_masker_position
SOS,2.0,1M,Sue sold five green shoes or Jill lost nine small pens,-90,3M,Mike bought three big gloves then Bob gave eight hot cards,90
SOS,2.0,1M,Sue held nine big gloves where Pat lost nine new bags,-90,9M,Jill found five hot toys then Lynn sold eight red shoes,90
SOS,2.0,9M,Sue saw four small shoes when Lynn took eight small toys,90,1M,Sam lost six old pens and Sam saw three new shoes,-90
SOS,2.0,5M,Sue took six new pens then Bob gave four red shoes,90,2M,Mike gave five small hats and Jill found six cheap cards,-90
SOS,2.0,8M,Sue bought six big toys when Mike bought two old pens,90,5M,Mike took three cheap pens then Jill found four green toys,-90
SOS,2.0,10M,Sue took four old socks while Bob gave two new gloves,-90,8M,Bob sold three big toys but Jill sold eight hot cards,90
SOS,2.0,5M,Sue bought eight small pens while Bob gave eight green gloves,90,2M,Jane held three new gloves or Sam found three red socks,-90
SOS,2.0,4M,Sue held five big bags where Bob took two green cards,-90,7M,Pat saw nine green shoes and Sam found ten new socks,90
SOS,2.0,1M,Sue sold eight small socks where Jane gave four old socks,-90,4M,Jill saw nine hot toys and Lynn sold two green shoes,90
SOS,2.0,7M,Sue saw five small shoes when Jane held nine big shoes,90,9M,Mike sold two red cards while Sam gave six new cards,-90
SOS,2.0,7M,Sue gave six green bags or Mike held ten big cards,-90,2M,Lynn held four old shoes where Sam saw eight hot socks,90
SOS,2.0,11M,Sue sold ten big gloves but Mike sold three new cards,-90,3M,Pat gave five hot hats where Sam saw nine cheap shoes,90
SOS,2.0,4M,Sue saw nine cheap cards but Lynn found two green gloves,-90,2M,Lynn gave three small gloves if Sam took eight hot bags,90
SOS,2.0,2M,Sue saw four new socks where Jill sold four cheap pens,90,11M,Jill found three hot toys and Bob held five hot toys,-90
SOS,2.0,9M,Sue sold ten cheap bags where Pat saw nine big socks,90,2M,Sam found two new gloves and Sam lost ten hot gloves,-90
SOS,2.0,11M,Sue lost two red gloves then Pat sold ten hot gloves,90,2M,Bob took eight big pens but Mike held nine small shoes,-90
SOS,2.0,5M,Sue gave ten cheap gloves when Sam sold four small shoes,-90,4M,Bob lost five small bags if Jane found ten big gloves,90
SOS,2.0,2M,Sue sold nine cheap shoes where Jane sold two hot shoes,90,11M,Bob held five red gloves while Bob lost four big toys,-90
SOS,2.0,1M,Sue saw nine small shoes and Jill held ten new pens,90,8M,Bob took five new socks then Jane bought three green gloves,-90
SOS,2.0,9M,Sue saw nine hot bags if Sam held five green bags,-90,3M,Jane took five cheap pens where Mike lost three red hats,90
SOS,2.0,10M,Sue found two hot pens or Lynn gave four hot hats,-90,2M,Lynn lost ten new shoes where Bob saw five old cards,90
SOS,2.0,9M,Sue sold six green shoes if Lynn sold four small bags,90,8M,Bob gave ten hot cards but Sam held ten new hats,-90
SOS,2.0,4M,Sue saw nine green gloves and Mike lost ten red shoes,90,5M,Mike found three cheap hats where Pat took three cheap bags,-90
SOS,2.0,10M,Sue took two small gloves but Pat held six green gloves,90,11M,Bob found eight big bags when Sam gave two new shoes,-90
SOS,2.0,3M,Sue found five hot shoes while Lynn found two cheap hats,-90,11M,Jane lost two new gloves then Sam sold four small pens,90
SOS,2.0,10M,Sue found eight big shoes and Bob gave five big bags,90,1M,Lynn saw ten old cards while Lynn found three green hats,-90
SOS,2.0,1M,Sue gave four old cards where Bob found five new gloves,-90,9M,Bob bought nine green socks if Jill gave nine red shoes,90
SOS,3.0,10M,Sue took eight new bags or Lynn found eight cheap cards,-90,7M,Lynn lost five old socks but Bob held ten big shoes,90
SOS,3.0,2M,Sue bought eight big socks and Pat sold four red cards,-90,1M,Sam held five hot shoes but Sam bought two small hats,90
SOS,3.0,9M,Sue bought eight new cards while Sam took three small toys,-90,5M,Sam saw four cheap shoes then Pat held five green hats,90
SOS,3.0,10M,Sue bought nine big gloves and Bob saw five hot cards,-90,11M,Mike gave ten old shoes while Jane held three big bags,90
SOS,3.0,1M,Sue gave five cheap socks and Lynn took six red cards,90,10M,Sam found four hot toys or Bob saw five hot gloves,-90
SOS,3.0,4M,Sue held four hot toys where Jane saw nine old socks,90,2M,Mike gave nine new socks but Sam sold eight big pens,-90
SOS,3.0,2M,Sue took six cheap pens or Pat saw six big shoes,90,5M,Mike held three small hats but Jane took ten cheap gloves,-90
SOS,3.0,9M,Sue gave six hot socks where Jane sold two old hats,90,4M,Jane saw four cheap bags and Jill took five green toys,-90
SOS,3.0,11M,Sue sold six big hats while Mike held nine small shoes,-90,8M,Bob held four green bags and Lynn took ten hot gloves,90
SOS,3.0,8M,Sue saw three old toys then Lynn found three cheap pens,-90,2M,Sam bought nine new bags if Mike sold two small gloves,90
SOS,3.0,8M,Sue held six cheap pens but Pat gave nine small cards,90,10M,Bob took eight green hats when Jane saw five hot pens,-90
SOS,3.0,3M,Sue gave six red shoes where Sam took six small hats,90,2M,Sam took nine big toys or Jane sold two green toys,-90
SOS,3.0,2M,Sue sold eight green cards and Pat saw ten hot hats,90,3M,Bob gave two old toys but Sam took eight small shoes,-90
SOS,3.0,9M,Sue gave six cheap cards then Lynn held nine cheap gloves,90,7M,Sam lost five small bags or Sam sold three red cards,-90
SOS,3.0,1M,Sue took five small bags if Jill found three old gloves,-90,8M,Sam sold six hot hats when Sam saw ten cheap bags,90
SOS,3.0,3M,Sue sold four new hats or Jane found eight small socks,-90,7M,Jill held ten old pens and Sam gave four big hats,90
SOS,3.0,9M,Sue sold two green cards but Lynn saw three old socks,90,1M,Sam held eight red hats or Sam lost two small shoes,-90
SOS,3.0,10M,Sue held three cheap socks and Sam found eight new hats,90,8M,Pat took six hot shoes when Lynn gave six cheap socks,-90
SOS,3.0,4M,Sue saw three red hats and Jane saw two old gloves,90,7M,Jill held two old bags where Jill gave four small toys,-90
SOS,3.0,4M,Sue saw four new cards while Jill took nine green bags,-90,9M,Lynn bought nine big toys and Jane gave five cheap socks,90
SOS,3.0,10M,Sue found five big shoes and Jane saw eight green hats,-90,4M,Pat gave eight new gloves but Jill found five hot shoes,90
SOS,3.0,2M,Sue found six cheap socks or Jill held nine green gloves,90,4M,Pat held two hot cards but Pat gave six cheap bags,-90
SOS,3.0,3M,Sue took eight hot pens where Jane found nine hot toys,90,1M,Pat saw three cheap gloves then Mike gave three old shoes,-90
SOS,3.0,5M,Sue gave two cheap toys when Pat sold four small pens,90,8M,Jill took four new shoes if Jill held six cheap bags,-90
SOS,3.0,7M,Sue bought eight new cards while Jill saw two red gloves,90,3M,Mike took nine small socks or Jane held eight small cards,-90
SOS,3.0,2M,Sue bought nine old socks when Sam lost ten big toys,90,4M,Jane lost five small hats if Pat bought two red gloves,-90
SOS,3.0,5M,Sue lost ten cheap pens but Sam bought six big gloves,90,8M,Sam took five small shoes where Mike saw four green socks,-90
SOS,3.0,5M,Sue saw three new hats and Lynn bought two big gloves,90,8M,Mike lost eight big toys while Jill held six old toys,-90
SOS,3.0,3M,Sue found three green hats while Lynn took nine new cards,90,7M,Lynn saw ten old toys but Sam gave ten green socks,-90
SOS,3.0,2M,Sue held eight old pens if Sam saw three green socks,90,11M,Sam took nine big shoes where Mike held two big shoes,-90
SOS,3.0,11M,Sue saw ten old socks while Mike sold six hot socks,-90,9M,Bob held four big bags but Sam bought nine big toys,90
SOS,3.0,8M,Sue held eight big socks then Sam lost nine new toys,-90,1M,Mike gave four new cards when Mike bought six big socks,90
SOS,3.0,4M,Sue bought five old socks if Sam found two cheap pens,90,5M,Bob held six cheap hats when Bob lost ten hot shoes,-90
SOS,3.0,3M,Sue found ten big gloves when Jane found two hot cards,-90,4M,Pat held eight cheap cards if Sam lost four red hats,90
SOS,3.0,5M,Sue saw three new bags or Sam bought ten hot shoes,90,2M,Sam sold two big toys while Bob saw four green gloves,-90
SOS,3.0,8M,Sue saw two cheap cards if Sam bought four green shoes,90,1M,Jill sold eight big pens or Jill saw six big socks,-90
SOS,3.0,10M,Sue sold four old hats but Pat lost ten red bags,90,2M,Jane found three cheap cards then Sam sold eight small gloves,-90
SOS,3.0,10M,Sue took eight old hats if Mike held four green shoes,-90,3M,Jane saw two small bags and Sam sold six red socks,90
SOS,3.0,11M,Sue held three red bags when Jane saw eight new cards,90,7M,Bob bought eight green shoes and Mike sold nine big pens,-90
SOS,3.0,5M,Sue took three hot socks when Mike lost nine hot shoes,-90,8M,Lynn found five red pens but Bob took four cheap gloves,90
SOS,3.0,3M,Sue saw four big pens but Lynn bought three cheap cards,90,7M,Mike bought nine cheap toys and Jill took nine green socks,-90
SOS,3.0,2M,Sue bought nine big gloves then Jill lost eight red hats,-90,10M,Jane saw five new hats or Lynn held four old bags,90
SOS,3.0,11M,Sue bought six green hats and Pat took two small socks,-90,10M,Mike saw five big bags or Jane found nine cheap pens,90
SOS,3.0,10M,Sue found ten green cards where Sam lost nine hot socks,90,7M,Jill gave five cheap pens while Bob gave ten small bags,-90
SOS,3.0,11M,Sue lost three big gloves if Lynn held ten big shoes,90,7M,Lynn found ten red bags while Jill sold six red bags,-90
SOS,3.0,7M,Sue sold eight hot toys if Sam saw three cheap socks,90,8M,Bob held ten new gloves then Jane bought four new shoes,-90
SOS,3.0,8M,Sue sold two hot socks and Pat sold eight small socks,90,3M,Jane bought six green toys while Mike bought six new gloves,-90
SOS,3.0,10M,Sue sold two small shoes while Pat gave nine cheap bags,90,11M,Mike found six new toys but Mike lost eight red shoes,-90
SOS,3.0,9M,Sue saw five red gloves while Lynn sold two hot gloves,90,3M,Jill took ten hot hats or Pat saw four red socks,-90
SOS,3.0,5M,Sue bought two big cards if Jane saw eight old hats,90,1M,Pat sold six red socks while Mike held three small pens,-90
SOS,3.0,1M,Sue gave six old toys where Pat sold six old bags,90,7M,Sam found ten hot shoes while Lynn found ten big toys,-90
SOS,3.0,1M,Sue held six old pens if Sam found three green toys,-90,5M,Lynn sold ten red gloves then Bob bought four old gloves,90
SOS,3.0,3M,Sue lost three green shoes where Sam found nine hot toys,-90,8M,Lynn held ten old pens or Jill saw three big socks,90
SOS,3.0,1M,Sue gave eight small bags then Bob bought six small shoes,-90,8M,Bob lost three cheap socks if Jane saw three red pens,90
SOS,3.0,2M,Sue took six cheap hats while Bob took five cheap toys,90,11M,Lynn gave three small bags when Mike lost nine green socks,-90
SOS,3.0,5M,Sue lost three green shoes when Lynn held ten big shoes,-90,9M,Pat found four cheap hats while Bob gave six new bags,90
SOS,3.0,3M,Sue lost six cheap socks but Sam gave five old pens,-90,8M,Jill held five big hats or Jane bought ten small toys,90
SOS,3.0,9M,Sue saw six hot gloves then Jill gave three small pens,-90,5M,Sam gave two old cards while Mike sold two big hats,90
SOS,3.0,4M,Sue gave three old bags while Mike took three small cards,-90,7M,Lynn sold four cheap pens then Pat lost eight old socks,90
SOS,3.0,3M,Sue found ten hot socks if Sam took five green shoes,90,9M,Sam bought eight red bags and Pat saw four red socks,-90
SOS,3.0,1M,Sue saw eight new toys when Jane saw four green pens,-90,3M,Bob held nine hot pens if Mike took nine small bags,90
SOS,3.0,7M,Sue lost five green toys when Mike sold ten red hats,-90,9M,Lynn found eight small bags or Bob held five big bags,90
SOS,3.0,7M,Sue took six cheap shoes and Sam gave eight cheap socks,90,10M,Jill found ten old bags then Jill lost four green toys,-90
SOS,3.0,3M,Sue held three small hats while Bob found two red hats,-90,10M,Mike gave five hot toys where Lynn bought ten green socks,90
SOS,3.0,7M,Sue lost two small hats if Mike found six old bags,90,5M,Mike sold ten big pens while Bob lost eight new pens,-90
SOS,3.0,3M,Sue sold ten hot toys if Bob took ten red shoes,90,9M,Mike took four green hats while Pat held five old cards,-90
SOS,3.0,1M,Sue sold three green cards when Jane gave nine green toys,-90,10M,Lynn held five red gloves or Pat lost four hot socks,90
SOS,3.0,11M,Sue gave five hot shoes then Sam found three old socks,90,10M,Jill saw nine red pens and Jill took eight new hats,-90
SOS,3.0,2M,Sue held three new socks and Lynn bought two hot hats,-90,8M,Jane gave ten big pens while Pat found eight new bags,90
SOS,3.0,9M,Sue lost three hot pens but Pat held nine old socks,90,11M,Bob held two big hats and Lynn gave four new toys,-90
SOS,3.0,11M,Sue lost six cheap shoes or Sam took four big pens,-90,8M,Pat took nine red socks where Lynn held six green gloves,90
SOS,3.0,3M,Sue gave nine cheap gloves or Jane held two old shoes,-90,10M,Sam took six red toys and Pat took three small cards,90
SOS,3.0,2M,Sue found nine small cards or Lynn lost three cheap bags,90,5M,Pat lost three red pens and Pat found ten old socks,-90
SOS,3.0,11M,Sue saw four cheap toys when Jane gave nine cheap hats,90,7M,Sam gave eight big cards then Sam lost five big gloves,-90
SOS,3.0,9M,Sue bought three new cards if Bob lost two cheap pens,90,4M,Bob took four green pens or Sam gave nine green gloves,-90
SOS,3.0,1M,Sue took four cheap cards if Lynn lost five small bags,-90,10M,Bob saw two green shoes but Jill saw two red toys,90
SOS,3.0,3M,Sue took five old cards where Mike lost eight hot gloves,90,9M,Mike bought four green shoes while Pat found nine small bags,-90
SOS,3.0,1M,Sue gave two green socks while Sam gave three small gloves,-90,2M,Lynn lost eight new bags if Jane held five old bags,90
SOS,3.0,7M,Sue took six hot pens then Jane lost five green toys,-90,11M,Sam held eight old hats and Sam found three big hats,90
SOS,3.0,1M,Sue lost four hot cards but Pat took five old pens,-90,3M,Lynn gave five cheap hats then Bob found two green cards,90
SOS,3.0,8M,Sue sold six red toys or Bob gave nine hot shoes,-90,11M,Jane found eight cheap gloves where Jane held two red socks,90
SOS,3.0,5M,Sue sold ten old cards if Sam gave six new pens,90,8M,Sam saw six big toys where Jane took eight old cards,-90
SOS,3.0,8M,Sue found two green toys where Bob lost six green shoes,90,9M,Mike lost six hot pens if Mike took ten red cards,-90
SOS,3.0,9M,Sue lost five green cards while Jane sold six big bags,-90,4M,Pat held ten red socks then Bob held two green socks,90
SOS,3.0,8M,Sue saw nine cheap socks then Lynn gave ten hot shoes,-90,11M,Pat bought ten new pens where Pat found four small bags,90
SOS,3.0,10M,Sue sold eight new shoes if Lynn lost three cheap gloves,90,1M,Pat took three red pens then Sam bought five hot socks,-90
SOS,3.0,7M,Sue found two hot cards if Bob held ten small toys,90,10M,Lynn lost nine small toys and Lynn found four big bags,-90
SOS,3.0,8M,Sue sold ten big bags where Lynn lost two small pens,90,9M,Jane found two hot shoes but Bob bought eight green hats,-90
SOS,3.0,8M,Sue gave ten big shoes or Bob bought ten cheap bags,-90,1M,Pat took two new pens if Jill took four new gloves,90
SOS,3.0,2M,Sue bought two cheap shoes and Jane found two hot gloves,-90,1M,Bob gave six new toys but Jill bought five cheap cards,90
SOS,3.0,8M,Sue lost six small socks where Lynn gave eight small bags,90,1M,Lynn bought nine old gloves but Sam lost two new cards,-90
SOS,3.0,1M,Sue lost six hot pens and Mike held ten old gloves,90,3M,Sam bought nine small toys where Jane saw five cheap hats,-90
SOS,3.0,9M,Sue took four green hats and Jill sold six cheap pens,90,4M,Sam gave nine new bags if Mike held ten hot toys,-90
SOS,3.0,5M,Sue found three red bags or Jane found three new toys,-90,11M,Jane took eight small pens when Pat saw ten hot gloves,90
SOS,3.0,9M,Sue took five red pens or Pat sold three hot cards,90,4M,Lynn saw ten green cards where Mike saw nine new gloves,-90
SOS,3.0,10M,Sue lost six new cards and Mike took ten cheap bags,-90,1M,Sam gave two green socks when Pat found two red hats,90
SOS,3.0,4M,Sue found nine red toys and Mike took nine cheap gloves,-90,1M,Pat took two green hats or Sam gave eight old cards,90
SOS,3.0,3M,Sue found eight old gloves while Lynn lost six hot shoes,-90,9M,Jane gave four red socks and Mike found ten small toys,90
SOS,3.0,10M,Sue bought three big bags if Jill took two red cards,90,9M,Jane found two red shoes when Sam saw six old shoes,-90
SOS,3.0,11M,Sue held eight big cards then Jill held ten new gloves,-90,1M,Mike lost ten hot pens when Bob bought six cheap toys,90
SOS,4.0,9M,Sue bought two small bags or Pat saw eight green socks,-90,4M,Bob lost eight red gloves if Bob took four small bags,90
SOS,4.0,4M,Sue lost three cheap bags where Bob took nine red socks,-90,9M,Sam sold ten new gloves or Jill bought three new toys,90
SOS,4.0,3M,Sue took four small gloves when Lynn held six small cards,-90,7M,Bob bought two new socks but Mike sold two cheap shoes,90
SOS,4.0,9M,Sue saw five hot shoes when Bob gave ten hot cards,-90,4M,Lynn gave six big bags and Sam lost two new pens,90
SOS,4.0,11M,Sue lost eight red hats when Bob took six green bags,-90,9M,Jill gave four small shoes where Lynn held five small toys,90
SOS,4.0,7M,Sue saw two hot bags if Jane sold three big gloves,-90,9M,Bob gave three cheap hats when Pat found eight hot shoes,90
SOS,4.0,11M,Sue took two big bags while Mike took ten hot socks,90,4M,Sam gave four green socks if Bob sold five green shoes,-90
SOS,4.0,1M,Sue sold three old cards where Lynn saw five big shoes,90,8M,Jill gave five new hats and Bob lost nine small toys,-90
SOS,4.0,9M,Sue saw five green pens where Jane bought five cheap gloves,-90,10M,Lynn gave nine hot gloves or Mike sold two big bags,90
SOS,4.0,1M,Sue bought eight cheap bags but Jill saw four new socks,-90,3M,Jill sold two old cards or Pat took five big bags,90
SOS,4.0,10M,Sue bought four red hats then Mike saw eight small cards,90,3M,Jill saw ten big bags when Pat held three old toys,-90
SOS,4.0,11M,Sue took two small shoes while Lynn sold eight cheap pens,-90,7M,Bob found eight big toys where Jill saw six old hats,90
SOS,4.0,2M,Sue took five red hats where Mike found eight red toys,90,5M,Jane gave three big cards and Bob held three old hats,-90
SOS,4.0,11M,Sue found nine big gloves or Lynn bought eight big pens,-90,8M,Pat held ten green hats when Mike took four new hats,90
SOS,4.0,11M,Sue lost six green toys while Mike took six cheap shoes,90,2M,Sam found two red shoes or Sam sold four hot cards,-90
SOS,4.0,11M,Sue found two small bags where Mike saw eight small socks,-90,2M,Jill sold four green hats when Lynn found five cheap gloves,90
SOS,4.0,5M,Sue lost six green toys if Jane sold four red pens,90,2M,Bob saw five old cards or Lynn gave two cheap socks,-90
SOS,4.0,5M,Sue took eight big gloves and Jane sold eight old socks,90,7M,Bob bought nine new cards while Mike saw two big cards,-90
SOS,4.0,11M,Sue gave three green socks and Bob gave five old toys,-90,1M,Jane bought five hot toys if Jane took four green pens,90
SOS,4.0,5M,Sue gave six old socks then Lynn took nine big bags,90,3M,Lynn held ten red gloves if Jane lost two old shoes,-90
SOS,4.0,3M,Sue lost two cheap shoes where Jill took four cheap socks,90,8M,Jill saw six new hats while Lynn saw two green shoes,-90
SOS,4.0,9M,Sue lost eight cheap cards while Sam held ten green gloves,-90,4M,Sam found four red pens and Bob found nine cheap hats,90
SOS,4.0,11M,Sue bought eight cheap hats then Jill took nine green hats,90,3M,Bob gave four small gloves and Mike bought three big shoes,-90
SOS,4.0,11M,Sue took four old bags when Sam lost four small cards,90,5M,Jill gave ten new pens but Lynn sold five big hats,-90
SOS,4.0,8M,Sue sold three old bags or Bob sold eight hot cards,-90,2M,Sam bought five red gloves then Mike held nine cheap pens,90
SOS,4.0,4M,Sue bought five red cards and Pat gave ten green cards,90,3M,Pat took two green pens if Lynn sold five old bags,-90
SOS,4.0,11M,Sue lost eight new shoes where Sam took eight hot socks,-90,9M,Bob sold two small socks if Mike lost six red cards,90
SOS,4.0,1M,Sue took three small hats but Mike took six red hats,90,7M,Bob saw eight green bags and Pat bought five cheap socks,-90
SOS,4.0,4M,Sue saw five old toys while Mike saw five red cards,-90,8M,Jane took two cheap bags and Sam found ten big gloves,90
SOS,4.0,5M,Sue took four old cards then Sam lost three small socks,90,9M,Lynn gave ten big shoes if Lynn took ten new bags,-90
SOS,4.0,5M,Sue bought ten small shoes or Mike saw four big gloves,-90,10M,Lynn lost six hot cards but Lynn found nine small cards,90
SOS,4.0,9M,Sue saw nine big gloves while Jane lost six small socks,90,8M,Bob sold six green toys and Jill held eight cheap shoes,-90
SOS,4.0,1M,Sue bought five green cards or Mike saw six new gloves,90,10M,Jill lost ten small socks and Bob held ten big socks,-90
SOS,4.0,2M,Sue gave three small gloves if Sam lost six red pens,90,10M,Mike held five cheap pens then Jill took two small cards,-90
SOS,4.0,2M,Sue held three cheap socks where Sam lost nine cheap cards,-90,10M,Mike lost eight hot cards if Jane saw five new socks,90
SOS,4.0,11M,Sue took two new cards when Sam took four new toys,-90,10M,Pat saw nine old bags if Pat bought nine old hats,90
SOS,4.0,11M,Sue sold six big cards when Jill saw three big hats,90,3M,Jane gave nine red pens but Mike held five green socks,-90
SOS,4.0,2M,Sue sold ten old pens but Bob found ten hot shoes,-90,11M,Jill took four hot bags where Pat sold nine green pens,90
SOS,4.0,1M,Sue sold nine new bags but Bob lost nine big bags,90,7M,Bob lost two red gloves when Jane gave two hot toys,-90
SOS,4.0,1M,Sue bought ten green shoes but Mike lost ten big gloves,90,7M,Jane sold eight big bags while Pat found three old hats,-90
SOS,4.0,8M,Sue held ten green shoes when Jill lost five old gloves,90,1M,Jane took five hot cards if Lynn saw three new cards,-90
SOS,4.0,2M,Sue gave ten cheap socks but Sam bought three big socks,90,4M,Mike saw six old toys where Pat took eight red gloves,-90
SOS,4.0,3M,Sue took four big gloves or Bob saw five green shoes,90,8M,Mike sold eight red hats if Mike lost nine big pens,-90
SOS,4.0,4M,Sue gave six new toys but Mike lost two old cards,-90,11M,Pat bought five small hats if Bob sold eight new hats,90
SOS,4.0,3M,Sue found six small shoes or Jill held four green bags,-90,7M,Jill sold eight new pens but Pat found nine cheap pens,90
SOS,4.0,7M,Sue held five hot shoes and Mike held two red socks,-90,2M,Bob lost two green pens or Jill gave nine old bags,90
SOS,4.0,5M,Sue saw nine green gloves where Lynn found five big bags,90,1M,Sam gave two small hats or Bob took four new hats,-90
SOS,4.0,4M,Sue found six big hats but Pat found five new pens,90,11M,Jane sold five hot pens if Lynn took six small gloves,-90
SOS,4.0,5M,Sue lost six red bags where Lynn lost eight small pens,90,9M,Jane sold four small cards while Bob took ten new hats,-90
SOS,4.0,3M,Sue saw eight small toys then Pat sold nine new shoes,-90,2M,Lynn found two big socks while Jill lost ten red bags,90
SOS,4.0,10M,Sue saw five small toys and Jane bought four cheap shoes,90,1M,Mike held three cheap cards but Lynn found eight green hats,-90
SOS,4.0,7M,Sue sold two green shoes while Jane bought five cheap hats,90,1M,Pat saw five new hats if Mike gave six small bags,-90
SOS,4.0,1M,Sue lost two big bags then Pat lost ten old socks,-90,9M,Mike held six green cards or Sam saw two small bags,90
SOS,4.0,5M,Sue bought nine new socks then Jane sold five hot socks,-90,3M,Jill saw three old pens if Pat found nine big cards,90
SOS,4.0,11M,Sue bought ten cheap shoes and Bob lost eight hot toys,90,3M,Sam sold three red socks where Pat saw three new cards,-90
SOS,4.0,9M,Sue gave ten hot shoes if Jane bought ten old socks,90,10M,Pat found three red pens then Mike held six big pens,-90
SOS,4.0,7M,Sue found nine cheap socks but Pat took six small toys,90,11M,Bob took four old gloves while Jill bought two big pens,-90
SOS,4.0,9M,Sue lost eight cheap pens but Jane gave four big socks,-90,5M,Jane sold ten small toys while Jill found ten red toys,90
SOS,4.0,10M,Sue saw three small socks and Mike saw eight old shoes,-90,9M,Mike lost five big shoes where Jill bought ten small toys,90
SOS,4.0,4M,Sue sold ten old pens and Jane lost nine cheap cards,-90,10M,Pat held two big toys or Jill sold ten small gloves,90
SOS,4.0,7M,Sue sold four hot shoes while Mike sold two big cards,-90,8M,Sam bought eight cheap pens then Bob saw five cheap hats,90
SOS,4.0,4M,Sue found three old hats when Jill saw five cheap bags,-90,8M,Bob sold five small gloves or Sam held four green gloves,90
SOS,4.0,3M,Sue gave nine big bags or Mike found two new pens,90,11M,Bob bought five old gloves if Lynn sold five red toys,-90
SOS,4.0,3M,Sue found four new pens but Bob held ten big gloves,90,1M,Pat sold five small toys and Sam sold two green cards,-90
SOS,4.0,3M,Sue lost ten cheap socks and Bob found nine small pens,-90,8M,Sam gave five red pens then Jill lost four big gloves,90
SOS,4.0,11M,Sue saw five cheap bags but Mike found six small socks,90,2M,Jill found ten small shoes when Sam saw three cheap hats,-90
SOS,4.0,10M,Sue sold ten red shoes and Jane gave ten green toys,90,9M,Pat held nine old bags but Pat lost six red pens,-90
SOS,4.0,9M,Sue held two big pens then Jane gave three new socks,-90,11M,Jane found ten cheap shoes but Mike sold six hot hats,90
SOS,4.0,1M,Sue took three green gloves where Bob sold ten cheap pens,90,11M,Mike held five cheap toys but Jill gave five big shoes,-90
SOS,4.0,2M,Sue found two old pens then Jane lost two red gloves,-90,9M,Jill bought four green bags but Sam saw four cheap bags,90
SOS,4.0,11M,Sue held eight hot toys when Bob held eight old shoes,90,10M,Sam lost nine green shoes while Jane sold six hot gloves,-90
SOS,4.0,10M,Sue sold five cheap gloves while Jane saw four cheap cards,90,8M,Jane saw two small pens and Lynn held six new pens,-90
