stim_type,alternation_rate,target_talker,target_sentence,init_target_position,masker_talker,masker_sentence,init_masker_position
SOS,6.0,1M,Sue sold eight big pens but Jill saw ten big shoes,-90,7M,Mike lost four red gloves if Pat gave four small cards,90
SOS,6.0,4M,Sue saw ten red shoes then Bob gave eight small pens,90,5M,Bob took two cheap toys if Pat sold two big cards,-90
SOS,6.0,7M,Sue found ten green bags if Pat took eight cheap gloves,90,11M,Sam held four new cards or Bob held nine old shoes,-90
SOS,6.0,11M,Sue took three big bags while Lynn saw eight old gloves,90,3M,Sam held five green pens if Jane held two red toys,-90
SOS,6.0,10M,Sue took three red pens or Sam bought six old hats,-90,1M,Mike sold six hot socks when Lynn lost two red shoes,90
SOS,6.0,9M,Sue took three hot socks and Jill held eight old hats,90,11M,Sam sold five old bags while Mike found ten new gloves,-90
SOS,6.0,10M,Sue bought three old pens or Jane took ten small bags,-90,1M,Jill gave four hot bags and Pat held four old toys,90
SOS,6.0,8M,Sue found two red shoes where Sam lost ten old bags,90,1M,Jane took eight hot cards when Jane gave three big pens,-90
SOS,6.0,3M,Sue held six old socks or Lynn held three old cards,-90,11M,Jane gave ten small cards when Jill bought eight hot hats,90
SOS,6.0,8M,Sue saw three green bags then Mike took six red cards,90,1M,Pat sold six cheap hats but Sam found two old bags,-90
SOS,6.0,1M,Sue found eight hot gloves then Bob lost four cheap cards,-90,4M,Lynn saw ten red cards or Lynn found three old gloves,90
SOS,6.0,7M,Sue saw ten small gloves when Bob held six small gloves,90,8M,Bob lost nine new cards while Sam bought nine big toys,-90
SOS,6.0,8M,Sue bought three big bags when Lynn held nine red bags,-90,7M,Jane held ten cheap hats if Jane took three cheap socks,90
SOS,6.0,8M,Sue saw four hot shoes while Pat found three big cards,-90,7M,Jane bought eight red hats and Bob bought ten small hats,90
SOS,6.0,9M,Sue lost ten small shoes then Bob found six cheap cards,-90,3M,Sam gave two red hats when Sam sold nine big pens,90
SOS,6.0,9M,Sue lost three hot bags if Jill saw five red gloves,90,11M,Jane found five big pens and Pat bought ten old pens,-90
SOS,6.0,11M,Sue gave nine old toys when Jill gave two small hats,90,4M,Bob took six small gloves and Lynn found six old shoes,-90
SOS,6.0,5M,Sue took eight new toys and Mike lost three red socks,90,10M,Bob bought nine red cards where Bob gave four new hats,-90
SOS,6.0,10M,Sue took ten green pens and Bob saw five new pens,90,7M,Bob saw six cheap cards if Jill gave nine green shoes,-90
SOS,6.0,5M,Sue took three small hats if Sam sold nine new gloves,90,11M,Bob found eight red shoes then Lynn saw two green socks,-90
SOS,7.0,4M,Sue bought three hot pens or Lynn bought two red toys,90,8M,Lynn held nine green hats then Jane gave four small gloves,-90
SOS,7.0,1M,Sue held ten green bags but Bob sold four cheap shoes,90,11M,Pat gave six red socks then Pat lost six small cards,-90
SOS,7.0,5M,Sue saw four new hats while Jill took nine old pens,90,10M,Bob sold ten red socks if Bob found two hot cards,-90
SOS,7.0,7M,Sue saw five big pens when Jill gave three big shoes,90,1M,Lynn sold two old socks then Lynn found ten hot bags,-90
SOS,7.0,9M,Sue bought ten cheap shoes where Lynn gave six cheap gloves,-90,3M,Sam held eight red cards then Sam sold five new cards,90
SOS,7.0,5M,Sue found eight cheap socks where Sam bought six cheap cards,90,11M,Sam took three hot shoes then Jane gave two new socks,-90
SOS,7.0,1M,Sue found eight new pens or Jane saw nine hot bags,90,9M,Pat sold ten red hats if Sam bought three small gloves,-90
SOS,7.0,11M,Sue lost four red toys and Sam sold nine old shoes,90,5M,Pat sold five hot hats or Jill took eight small bags,-90
SOS,7.0,5M,Sue took two big bags then Jill gave ten cheap bags,90,3M,Lynn sold four old hats and Bob took six big pens,-90
SOS,7.0,1M,Sue saw four hot bags and Pat took five cheap hats,-90,3M,Mike gave six big cards but Lynn held ten big gloves,90
SOS,7.0,7M,Sue gave eight small toys while Sam took six small shoes,90,3M,Mike held nine big gloves where Bob bought four hot toys,-90
SOS,7.0,8M,Sue found five hot gloves then Jane gave four old cards,90,11M,Mike took eight big toys when Bob saw eight cheap shoes,-90
SOS,7.0,5M,Sue sold two cheap cards then Sam saw five red shoes,-90,4M,Jill held nine hot hats if Bob held ten old bags,90
SOS,7.0,7M,Sue gave three small gloves but Jane held five hot toys,-90,3M,Jane held eight cheap pens or Bob lost two cheap gloves,90
SOS,7.0,1M,Sue sold five green gloves when Bob lost six big gloves,-90,10M,Sam saw two old bags but Jane found eight green cards,90
SOS,7.0,10M,Sue found two old bags and Lynn held eight cheap pens,90,3M,Bob saw ten small pens but Jane gave two small cards,-90
SOS,7.0,4M,Sue gave three cheap gloves where Mike took four new pens,-90,7M,Lynn saw two new pens or Lynn held nine cheap shoes,90
SOS,7.0,8M,Sue found six cheap gloves but Mike took six red cards,90,10M,Jill gave three small cards when Jill sold ten new pens,-90
SOS,7.0,11M,Sue took five green toys then Jill lost five old cards,90,8M,Lynn lost nine red shoes where Jane held two cheap shoes,-90
SOS,7.0,11M,Sue bought three big gloves where Mike took four hot gloves,90,3M,Sam lost five old pens if Jill bought five big shoes,-90
SOS,7.0,1M,Sue saw two new shoes and Lynn bought two small gloves,90,5M,Bob sold five cheap toys but Sam lost three old cards,-90
SOS,7.0,4M,Sue bought nine cheap shoes or Mike sold five green toys,-90,3M,Bob sold five red toys but Jane bought nine small cards,90
SOS,7.0,7M,Sue held ten big pens if Jane gave three new cards,90,4M,Sam sold two small shoes then Pat saw nine old bags,-90
SOS,7.0,7M,Sue gave ten cheap shoes and Sam sold four hot shoes,-90,4M,Pat held five small gloves but Jill saw six red gloves,90
SOS,7.0,3M,Sue found five small toys if Pat lost four small socks,90,2M,Jane held eight cheap pens where Bob bought ten hot shoes,-90
SOS,7.0,1M,Sue took eight small hats when Mike held eight hot bags,-90,10M,Lynn sold six hot bags while Lynn found two small pens,90
SOS,7.0,11M,Sue held five red cards or Jane held four big cards,-90,9M,Pat found nine hot gloves and Lynn found ten hot gloves,90
SOS,7.0,1M,Sue saw three cheap socks where Sam found nine old hats,90,5M,Pat found four hot hats then Jane lost ten green pens,-90
SOS,7.0,7M,Sue found three cheap gloves if Lynn bought two big cards,90,4M,Jane took five green bags when Pat held eight red hats,-90
SOS,7.0,10M,Sue held six hot pens where Jane took five small cards,90,7M,Bob gave four old toys while Sam found ten green socks,-90
SOS,7.0,9M,Sue gave five old socks where Lynn took five big shoes,90,8M,Pat saw eight small pens but Jill bought four small toys,-90
SOS,7.0,5M,Sue bought ten new socks when Sam bought six cheap hats,90,8M,Bob lost three big pens or Lynn found ten green pens,-90
SOS,7.0,2M,Sue saw four green shoes where Bob bought eight cheap shoes,90,9M,Mike found three cheap cards and Lynn sold six red socks,-90
SOS,7.0,10M,Sue sold five cheap cards if Jill took two big shoes,-90,8M,Jane gave three new hats where Lynn lost ten red gloves,90
SOS,7.0,3M,Sue lost two red gloves if Jill sold ten small pens,90,7M,Pat sold eight small hats while Mike found five red gloves,-90
SOS,7.0,11M,Sue took nine big shoes then Sam bought ten new shoes,90,7M,Sam bought four old hats and Jill saw five small socks,-90
SOS,7.0,9M,Sue found nine new pens then Bob found five big shoes,90,1M,Lynn saw three big hats where Sam sold ten cheap toys,-90
SOS,7.0,5M,Sue took nine new bags and Pat gave six cheap shoes,90,4M,Mike held five green socks but Bob sold five new bags,-90
SOS,7.0,5M,Sue held nine new bags then Mike found eight cheap socks,90,2M,Jill found two cheap hats while Jill lost three green hats,-90
SOS,7.0,7M,Sue held three hot gloves and Jane held two big socks,-90,3M,Jill saw nine green cards while Bob took eight red pens,90
SOS,7.0,7M,Sue lost eight green bags where Mike saw six old hats,-90,1M,Jane sold three new gloves if Pat took five red shoes,90
SOS,7.0,7M,Sue sold four old bags then Pat found six cheap hats,90,4M,Lynn bought nine red hats where Mike lost ten green toys,-90
SOS,7.0,7M,Sue sold ten hot shoes or Jane took two small shoes,90,11M,Bob lost four new socks while Jill gave ten red cards,-90
SOS,7.0,5M,Sue bought four cheap toys while Lynn saw two new pens,90,8M,Bob held six big socks then Mike bought four red hats,-90
SOS,7.0,11M,Sue held ten red socks when Pat saw four old pens,90,10M,Pat found six green cards or Sam found ten green socks,-90
SOS,7.0,2M,Sue saw five cheap toys or Sam lost two new gloves,-90,7M,Sam lost nine small bags if Jill held ten big shoes,90
SOS,7.0,8M,Sue saw ten old pens and Lynn held four old toys,-90,5M,Jane took three big socks or Jane took nine small shoes,90
SOS,7.0,7M,Sue found two small bags when Lynn sold two new shoes,90,1M,Sam saw ten cheap shoes but Mike held six green bags,-90
SOS,7.0,7M,Sue bought four big bags if Jane sold ten cheap gloves,-90,10M,Bob found three hot cards when Jill took three small socks,90
SOS,7.0,5M,Sue saw nine hot shoes while Mike lost three cheap bags,-90,4M,Mike lost ten big cards if Jane took nine hot pens,90
SOS,7.0,3M,Sue lost nine big hats where Mike saw six old pens,-90,7M,Sam held six small socks while Bob found ten hot shoes,90
SOS,7.0,9M,Sue sold three red bags but Sam lost four hot gloves,90,11M,Sam lost ten new pens while Jane bought six new bags,-90
SOS,7.0,2M,Sue held six big toys when Jill found three green pens,-90,7M,Sam took ten small gloves and Lynn gave two cheap shoes,90
SOS,7.0,2M,Sue took five red pens where Lynn found two old toys,-90,8M,Jill lost three new shoes but Jane gave eight cheap bags,90
SOS,7.0,5M,Sue saw six hot socks where Mike held ten small shoes,90,4M,Mike gave five green cards then Pat gave four new bags,-90
SOS,7.0,10M,Sue lost eight hot hats but Pat lost four old hats,-90,11M,Sam sold two old cards where Sam gave three green shoes,90
SOS,7.0,10M,Sue held nine cheap pens or Jill held nine small hats,-90,2M,Jane found ten hot cards and Sam saw five cheap bags,90
SOS,7.0,11M,Sue lost two new pens and Lynn gave two red pens,-90,4M,Mike held five cheap hats but Mike found four new cards,90
SOS,7.0,3M,Sue took ten hot shoes while Mike bought two small cards,90,7M,Bob sold four new bags and Jane sold eight old hats,-90
SOS,7.0,5M,Sue held four old cards while Bob saw three big shoes,-90,9M,Pat lost six cheap socks then Lynn took ten red hats,90
SOS,7.0,11M,Sue sold five green bags where Bob bought five old socks,90,4M,Bob gave four red pens but Jill took nine red gloves,-90
SOS,7.0,4M,Sue found nine new shoes where Pat lost nine big bags,90,3M,Jill sold ten hot socks when Mike took two red toys,-90
SOS,7.0,5M,Sue took two new toys when Sam lost nine old hats,90,8M,Lynn bought nine big hats but Mike sold six big toys,-90
SOS,7.0,10M,Sue bought eight hot shoes where Lynn sold three hot hats,-90,2M,Bob found two old bags then Bob took two green gloves,90
SOS,7.0,2M,Sue held six green bags when Jane held ten big gloves,-90,9M,Jane bought four big hats then Bob gave eight red toys,90
SOS,7.0,5M,Sue gave five cheap gloves if Pat bought five green socks,90,2M,Sam saw eight old shoes or Mike sold six hot toys,-90
SOS,7.0,10M,Sue found eight new shoes but Jill bought five red shoes,90,7M,Bob lost nine cheap cards where Bob held ten big hats,-90
SOS,7.0,1M,Sue lost nine new bags when Jill held eight old socks,90,3M,Jane found ten hot pens or Bob found nine new bags,-90
SOS,7.0,11M,Sue gave ten cheap cards where Sam lost five new shoes,90,4M,Bob found two big socks if Lynn took ten cheap bags,-90
SOS,7.0,1M,Sue sold eight green toys and Jane saw two old hats,90,7M,Sam lost nine old shoes if Mike held eight small bags,-90
SOS,7.0,9M,Sue gave nine hot hats or Lynn sold three hot pens,90,4M,Jane lost five old cards then Pat saw eight old hats,-90
SOS,7.0,11M,Sue bought eight old pens while Bob held nine big pens,-90,7M,Jill found two green cards or Jill bought ten hot bags,90
SOS,7.0,2M,Sue found four red bags but Pat found eight small gloves,90,8M,Mike gave three small cards then Bob lost nine red hats,-90
SOS,7.0,7M,Sue bought two big toys or Sam held eight old shoes,-90,10M,Jill gave nine hot pens but Pat bought four cheap toys,90
SOS,7.0,10M,Sue held nine hot bags where Mike held three small pens,-90,5M,Sam bought eight red toys or Lynn sold nine red shoes,90
SOS,7.0,7M,Sue bought five hot toys then Sam lost eight hot hats,90,4M,Bob found nine new cards but Pat bought ten green bags,-90
SOS,7.0,8M,Sue held ten hot pens then Bob gave three red toys,-90,5M,Bob saw three old shoes where Mike found two small pens,90
SOS,7.0,11M,Sue saw nine red hats but Jane sold four new toys,90,9M,Bob lost five big gloves then Pat bought ten old hats,-90
SOS,7.0,10M,Sue bought four small bags if Jane found eight cheap shoes,90,1M,Jane held six green cards while Bob saw ten new toys,-90
SOS,7.0,1M,Sue saw nine red shoes when Sam sold five red gloves,90,7M,Lynn found five small cards where Jane bought three cheap bags,-90
SOS,7.0,7M,Sue saw nine small gloves when Bob bought nine new pens,90,10M,Jane found three red socks but Sam sold three old hats,-90
SOS,7.0,2M,Sue sold eight green hats when Bob took two cheap toys,-90,9M,Mike held four old shoes but Lynn bought ten hot hats,90
SOS,7.0,2M,Sue held six red bags where Jane lost three green shoes,-90,10M,Jill gave five small hats but Jill found six hot gloves,90
SOS,7.0,11M,Sue lost five big cards if Jane held four cheap hats,90,4M,Jane held eight green shoes when Jill sold three small toys,-90
SOS,7.0,7M,Sue lost eight hot hats while Jane took eight small pens,-90,5M,Lynn took five old pens if Pat bought nine hot hats,90
SOS,7.0,1M,Sue gave ten red pens while Lynn gave four cheap cards,-90,10M,Jane saw three green gloves if Bob took nine small toys,90
SOS,7.0,5M,Sue found three big gloves or Jane bought two small shoes,90,2M,Pat lost five small pens while Jill found four hot pens,-90
SOS,7.0,3M,Sue found eight old cards or Jill bought two red pens,90,2M,Jane lost six small toys where Lynn held four new cards,-90
SOS,7.0,3M,Sue saw three cheap pens if Pat held six red pens,90,5M,Bob sold six hot socks and Sam lost three green toys,-90
SOS,7.0,8M,Sue saw eight red hats and Lynn held ten old socks,-90,10M,Bob held ten small toys or Bob saw eight small bags,90
SOS,7.0,10M,Sue gave eight red bags if Lynn lost six new bags,-90,7M,Lynn held six old hats while Jill sold eight old hats,90
SOS,7.0,7M,Sue saw three big bags when Sam gave two cheap toys,-90,3M,Lynn sold four new gloves or Jane bought three old socks,90
SOS,7.0,2M,Sue found six hot shoes when Jill bought four old toys,90,7M,Sam took nine small hats then Mike gave three red socks,-90
SOS,7.0,10M,Sue held eight old cards or Mike held two old pens,-90,3M,Sam sold two small toys if Jane gave eight hot socks,90
SOS,7.0,5M,Sue held six small toys and Bob gave eight big shoes,90,3M,Mike took nine big hats if Jane saw two hot socks,-90
SOS,7.0,10M,Sue took five cheap bags when Sam bought three small bags,90,1M,Mike found eight red socks or Pat took ten big pens,-90
SOS,7.0,8M,Sue took five new socks but Mike held five new hats,90,2M,Jill held four old gloves if Bob saw three hot socks,-90
SOS,7.0,4M,Sue gave eight old pens and Sam saw nine old gloves,90,5M,Jill held five cheap shoes but Jane sold two new socks,-90
SOS,7.0,2M,Sue found three hot toys where Jill gave nine new socks,90,5M,Mike took eight green cards while Mike found five cheap cards,-90
SOS,7.0,11M,Sue sold three red shoes if Pat took four old pens,-90,1M,Bob found two old toys or Jane saw five new socks,90
SOS,8.0,1M,Sue held five old pens or Lynn sold nine new hats,90,7M,Sam sold eight new bags then Mike found five green shoes,-90
SOS,8.0,7M,Sue sold eight green bags or Mike held two cheap socks,90,1M,Jane held six cheap cards then Bob lost six hot gloves,-90
SOS,8.0,4M,Sue bought eight new bags then Jill lost nine cheap toys,90,9M,Bob lost five cheap toys but Mike took ten big gloves,-90
SOS,8.0,1M,Sue gave four hot gloves or Pat gave eight cheap pens,-90,9M,Pat bought two red toys then Jane saw nine red toys,90
SOS,8.0,10M,Sue saw six small shoes and Pat saw six big pens,90,9M,Bob found eight hot socks where Mike took eight old socks,-90
SOS,8.0,4M,Sue sold five green toys while Jane lost ten cheap cards,-90,2M,Bob gave three new hats if Jill held six new pens,90
SOS,8.0,5M,Sue bought three green hats when Jill bought nine big hats,-90,7M,Bob lost five old shoes then Bob lost four old toys,90
SOS,8.0,3M,Sue held ten green toys while Pat sold three hot pens,-90,1M,Pat took six old bags but Bob took nine new shoes,90
SOS,8.0,7M,Sue held three old bags while Sam lost three new pens,-90,1M,Mike found ten new gloves then Bob took two small socks,90
SOS,8.0,2M,Sue gave ten cheap bags or Lynn took two green bags,-90,5M,Mike sold eight new socks where Jane saw eight small socks,90
SOS,8.0,3M,Sue took eight red pens and Jill found two red socks,90,2M,Jill saw two cheap socks then Bob gave five old bags,-90
SOS,8.0,1M,Sue held nine big socks and Mike lost eight red toys,90,10M,Lynn gave two hot toys then Jill sold two green pens,-90
SOS,8.0,3M,Sue held nine big cards while Jane lost nine cheap pens,-90,5M,Bob gave three new shoes if Jill found four big cards,90
SOS,8.0,7M,Sue sold four cheap toys or Bob saw ten old gloves,-90,3M,Bob lost six old hats then Mike lost four hot shoes,90
SOS,8.0,4M,Sue saw six red bags then Jill held two big gloves,-90,1M,Mike took nine new shoes if Sam took four small shoes,90
SOS,8.0,4M,Sue sold five new pens where Sam took five green hats,-90,11M,Jane held two red socks and Jill held four old bags,90
SOS,8.0,8M,Sue sold five cheap gloves and Bob bought six new gloves,90,9M,Sam found nine old socks but Pat found four big toys,-90
SOS,8.0,1M,Sue bought ten old socks but Bob sold three old cards,-90,7M,Pat found four red cards when Pat bought four hot shoes,90
SOS,8.0,2M,Sue held eight hot shoes when Bob gave five big pens,90,1M,Sam gave nine small cards but Pat sold nine cheap socks,-90
SOS,8.0,11M,Sue found nine hot hats and Sam saw six red gloves,-90,4M,Sam sold five cheap shoes while Jane lost four cheap toys,90
SOS,8.0,4M,Sue bought nine green shoes then Bob saw eight old shoes,-90,8M,Lynn lost ten small cards and Jane lost ten hot bags,90
SOS,8.0,8M,Sue gave ten cheap hats if Jill gave two hot socks,-90,1M,Mike found nine green shoes or Bob held nine new shoes,90
SOS,8.0,4M,Sue sold five cheap cards and Lynn found eight new bags,90,9M,Lynn held two old bags when Sam lost three green shoes,-90
SOS,8.0,5M,Sue bought eight big toys if Bob lost six red socks,-90,4M,Lynn took ten red gloves then Pat sold four hot cards,90
SOS,8.0,3M,Sue gave three cheap shoes and Mike bought three hot shoes,90,2M,Jill took nine old toys while Jill took eight green bags,-90
SOS,8.0,3M,Sue held eight cheap pens when Jill bought five old hats,-90,10M,Pat lost two new gloves and Pat found four new cards,90
SOS,8.0,11M,Sue saw five red socks while Lynn bought three green pens,90,2M,Pat held four small bags but Bob lost eight cheap toys,-90
SOS,8.0,5M,Sue gave five hot hats then Bob took two small cards,90,1M,Jane saw ten red pens but Mike bought ten big pens,-90
SOS,8.0,4M,Sue bought nine cheap socks when Jane gave four green toys,-90,3M,Jill sold six old pens while Lynn sold five red cards,90
SOS,8.0,2M,Sue took nine small pens or Lynn found five big gloves,90,8M,Mike bought eight new gloves where Pat took two new bags,-90
SOS,8.0,9M,Sue took ten big socks while Sam bought ten cheap toys,-90,3M,Lynn gave four cheap bags and Pat sold nine hot hats,90
SOS,8.0,8M,Sue found ten small shoes where Lynn lost nine cheap shoes,-90,5M,Sam sold nine new toys if Bob sold six big gloves,90
SOS,8.0,8M,Sue sold three old pens if Jill gave four old hats,-90,2M,Bob held five green shoes and Jane took ten hot bags,90
SOS,8.0,10M,Sue held six new socks but Sam held six new socks,-90,7M,Bob sold four green shoes where Jill lost eight hot bags,90
SOS,8.0,10M,Sue sold two new cards where Pat sold three cheap pens,90,3M,Bob lost six big shoes while Jane found eight old bags,-90
SOS,8.0,4M,Sue held ten red socks then Bob gave five new shoes,90,1M,Lynn found six hot bags but Lynn saw three red pens,-90
SOS,8.0,1M,Sue found eight old bags if Bob found eight old toys,-90,10M,Sam gave six big shoes then Pat saw two big socks,90
SOS,8.0,2M,Sue held six small socks and Jane took nine new shoes,-90,10M,Jill saw five cheap bags or Mike saw three red toys,90
SOS,8.0,11M,Sue held two small gloves then Jane sold four red toys,-90,9M,Jill gave three hot cards while Jill found eight old shoes,90
SOS,8.0,8M,Sue lost four red cards if Jill took two cheap shoes,90,9M,Jill bought three hot hats where Lynn saw six old cards,-90
SOS,8.0,3M,Sue gave ten red socks while Lynn lost five green socks,90,4M,Bob sold six hot gloves where Bob took six small toys,-90
SOS,8.0,2M,Sue sold nine hot gloves while Mike held eight big socks,-90,11M,Jill held two small toys but Lynn took two cheap gloves,90
SOS,8.0,8M,Sue held nine old pens when Sam found ten hot pens,-90,5M,Pat sold ten cheap cards where Bob gave three green shoes,90
SOS,8.0,8M,Sue gave six green hats when Jane found two new shoes,-90,10M,Lynn bought ten hot gloves but Pat sold ten cheap pens,90
SOS,8.0,7M,Sue lost five red toys while Mike sold four small cards,90,4M,Jane held nine new pens when Bob bought ten new shoes,-90
SOS,8.0,3M,Sue saw ten hot bags where Sam bought nine old hats,-90,10M,Jill gave three green cards but Lynn held eight new shoes,90
SOS,8.0,10M,Sue held three red gloves or Jane bought four old shoes,-90,5M,Mike sold two big shoes where Lynn lost three red cards,90
SOS,8.0,2M,Sue bought nine red socks when Jane gave two old socks,-90,1M,Bob saw two big gloves where Bob lost six small toys,90
SOS,8.0,7M,Sue gave ten small gloves if Jane sold two green hats,-90,4M,Jane saw two hot hats where Lynn held eight new bags,90
SOS,8.0,1M,Sue saw ten green toys where Bob took six green shoes,90,5M,Mike found four cheap pens then Pat sold five red hats,-90
SOS,8.0,9M,Sue lost eight old gloves while Mike held eight big shoes,-90,5M,Pat found six big hats where Sam sold six small socks,90
SOS,8.0,4M,Sue bought eight green shoes if Mike saw ten cheap socks,90,9M,Jane took nine new pens where Pat sold nine big cards,-90
SOS,8.0,11M,Sue took nine old cards when Bob found four small hats,90,10M,Jill sold eight red socks then Jill sold ten old pens,-90
SOS,8.0,10M,Sue took ten small cards if Pat held ten red gloves,-90,1M,Bob saw eight green gloves where Mike found two old shoes,90
SOS,8.0,11M,Sue gave five old socks where Lynn bought nine old gloves,90,5M,Mike saw three cheap gloves when Bob gave four small cards,-90
SOS,8.0,2M,Sue bought six cheap gloves while Jill found nine new hats,90,9M,Pat lost two old toys and Pat lost ten hot cards,-90
SOS,8.0,3M,Sue gave two old pens but Bob took eight cheap cards,90,1M,Lynn found ten hot cards or Mike lost four hot bags,-90
SOS,8.0,1M,Sue held ten small toys if Bob saw ten big gloves,-90,10M,Jill gave three cheap gloves and Sam sold nine cheap hats,90
SOS,8.0,5M,Sue found six hot bags then Lynn gave five old shoes,-90,9M,Bob sold ten new toys where Jill lost eight cheap bags,90
SOS,8.0,9M,Sue gave six small toys when Mike lost four cheap cards,90,4M,Jill found two cheap pens if Jill took nine red hats,-90
SOS,8.0,1M,Sue saw three new bags where Bob saw six small bags,-90,3M,Mike gave four green pens but Jill found eight red hats,90
SOS,8.0,10M,Sue sold nine green hats where Jill gave eight cheap pens,-90,11M,Lynn found six small bags if Jane took ten red shoes,90
SOS,8.0,3M,Sue bought four small gloves when Bob found two hot gloves,90,7M,Sam lost three red cards and Jill lost three green pens,-90
SOS,8.0,5M,Sue lost nine small pens while Sam sold ten big shoes,90,10M,Sam held three red toys when Jill took four cheap bags,-90
SOS,8.0,10M,Sue lost two big socks where Jill took four red hats,-90,7M,Jane saw nine green shoes then Sam found ten old bags,90
SOS,8.0,8M,Sue lost eight cheap toys when Sam bought three hot hats,90,9M,Bob saw nine small hats but Mike gave ten new cards,-90
SOS,8.0,2M,Sue saw two red shoes but Sam sold two small hats,90,3M,Pat held six small cards and Jane held six green pens,-90
SOS,8.0,5M,Sue bought six big pens while Lynn lost six new gloves,90,10M,Lynn held three red bags or Pat held three old shoes,-90
SOS,8.0,8M,Sue bought four big pens when Mike saw six red gloves,90,11M,Pat lost ten cheap hats if Sam sold three big shoes,-90
SOS,8.0,5M,Sue held two red hats then Pat lost three small cards,-90,9M,Mike lost four hot bags if Mike found ten old hats,90
SOS,8.0,7M,Sue gave three old shoes if Jill sold four cheap shoes,90,2M,Jane lost five cheap toys and Mike bought six red hats,-90
SOS,8.0,9M,Sue sold eight red cards but Bob saw two red shoes,90,3M,Bob found six small shoes then Mike bought six cheap pens,-90
SOS,8.0,10M,Sue found five hot shoes when Pat saw eight old cards,-90,9M,Jane saw ten cheap pens then Lynn bought ten green bags,90
SOS,8.0,5M,Sue held nine small cards and Jane sold three red bags,-90,9M,Jane found ten green gloves or Sam took four new hats,90
SOS,8.0,11M,Sue found ten big bags but Sam took four old shoes,90,9M,Bob gave two cheap socks where Mike sold ten hot hats,-90
SOS,8.0,11M,Sue sold nine old cards then Pat took two old hats,-90,3M,Jane found ten new bags if Sam found three red pens,90
SOS,8.0,5M,Sue held five new toys when Bob found two old hats,90,2M,Sam lost two red socks or Jill held eight small shoes,-90
SOS,8.0,5M,Sue bought five small hats or Pat found three new gloves,90,2M,Mike found ten new toys if Sam held five red hats,-90
SOS,8.0,11M,Sue took five new bags where Jane held ten big socks,90,2M,Jane gave two red hats when Sam lost five cheap gloves,-90
