stim_num,stim_type,n_srcs,src,is_target,pattern,alt_rate,init_angle
0,SIM,2,11M,True,SUE TOOK FIVE GREEN SHOES,0.0,0.0
0,SIM,2,1M,False,BOB FOUND THREE RED GLOVES,0.0,0.0
1,SIM,2,5M,True,SUE SAW EIGHT NEW GLOVES,0.0,0.0
1,SIM,2,8M,False,LYNN HELD TWO BIG PENS,0.0,0.0
2,SIM,2,9M,True,SUE HELD THREE HOT SHOES,0.0,0.0
2,SIM,2,7M,False,MIKE LOST TWO NEW TOYS,0.0,0.0
3,SIM,2,5M,True,SUE TOOK TWO OLD CARDS,0.0,0.0
3,SIM,2,3M,False,SAM LOST FIVE CHEAP TOYS,0.0,0.0
4,SIM,2,9M,True,SUE HELD THREE OLD HATS,0.0,0.0
4,SIM,2,5M,False,PAT TOOK SIX RED SHOES,0.0,0.0
5,SIM,2,3M,True,SUE FOUND THREE BIG TOYS,0.0,0.0
5,SIM,2,1M,False,MIKE SAW TEN GREEN PENS,0.0,0.0
6,SIM,2,8M,True,SUE TOOK TEN BIG HATS,0.0,0.0
6,SIM,2,2M,False,LYNN BOUGHT SIX GREEN BAGS,0.0,0.0
7,SIM,2,10M,True,SUE FOUND FOUR RED TOYS,0.0,0.0
7,SIM,2,11M,False,LYNN SOLD TWO HOT BAGS,0.0,0.0
8,SIM,2,8M,True,SUE SAW EIGHT CHEAP CARDS,0.0,0.0
8,SIM,2,3M,False,MIKE GAVE TEN RED BAGS,0.0,0.0
9,SIM,2,8M,True,SUE FOUND FOUR SMALL SOCKS,0.0,0.0
9,SIM,2,7M,False,JANE GAVE FIVE CHEAP SHOES,0.0,0.0
10,SIM,2,11M,True,SUE TOOK FIVE HOT TOYS,0.0,0.0
10,SIM,2,9M,False,JILL FOUND TWO NEW SOCKS,0.0,0.0
11,SIM,2,8M,True,SUE BOUGHT TWO BIG CARDS,0.0,0.0
11,SIM,2,2M,False,LYNN LOST TEN OLD TOYS,0.0,0.0
12,SIM,2,5M,True,SUE GAVE FOUR SMALL BAGS,0.0,0.0
12,SIM,2,10M,False,MIKE SOLD THREE GREEN PENS,0.0,0.0
13,SIM,2,10M,True,SUE SOLD FOUR SMALL HATS,0.0,0.0
13,SIM,2,11M,False,LYNN GAVE FIVE CHEAP SHOES,0.0,0.0
14,SIM,2,5M,True,SUE GAVE THREE BIG PENS,0.0,0.0
14,SIM,2,8M,False,JILL FOUND FOUR NEW BAGS,0.0,0.0
15,SIM,2,5M,True,SUE HELD FIVE HOT PENS,0.0,0.0
15,SIM,2,9M,False,LYNN TOOK EIGHT GREEN TOYS,0.0,0.0
16,SIM,2,1M,True,SUE TOOK EIGHT BIG SOCKS,0.0,0.0
16,SIM,2,11M,False,PAT SOLD TWO CHEAP GLOVES,0.0,0.0
17,SIM,2,11M,True,SUE TOOK TWO CHEAP HATS,0.0,0.0
17,SIM,2,9M,False,MIKE FOUND TEN SMALL CARDS,0.0,0.0
18,SIM,2,8M,True,SUE GAVE THREE GREEN CARDS,0.0,0.0
18,SIM,2,10M,False,PAT FOUND TWO OLD BAGS,0.0,0.0
19,SIM,2,1M,True,SUE BOUGHT FIVE RED SHOES,0.0,0.0
19,SIM,2,8M,False,JANE LOST TWO OLD HATS,0.0,0.0
20,SIM,2,5M,True,SUE LOST EIGHT SMALL TOYS,0.0,0.0
20,SIM,2,8M,False,SAM SAW FIVE CHEAP PENS,0.0,0.0
21,SIM,2,2M,True,SUE HELD FIVE NEW HATS,0.0,0.0
21,SIM,2,3M,False,JILL TOOK THREE BIG TOYS,0.0,0.0
22,SIM,2,5M,True,SUE BOUGHT FOUR GREEN SHOES,0.0,0.0
22,SIM,2,2M,False,JANE SOLD SIX RED HATS,0.0,0.0
23,SIM,2,10M,True,SUE HELD EIGHT BIG PENS,0.0,0.0
23,SIM,2,7M,False,JANE LOST TEN HOT CARDS,0.0,0.0
24,SIM,2,5M,True,SUE LOST SIX SMALL SOCKS,0.0,0.0
24,SIM,2,9M,False,MIKE HELD FIVE OLD PENS,0.0,0.0
25,SIM,2,5M,True,SUE FOUND TEN SMALL SOCKS,0.0,0.0
25,SIM,2,10M,False,BOB HELD FIVE NEW CARDS,0.0,0.0
26,SIM,2,7M,True,SUE HELD THREE GREEN SHOES,0.0,0.0
26,SIM,2,10M,False,PAT FOUND TWO NEW BAGS,0.0,0.0
27,SIM,2,11M,True,SUE HELD NINE BIG HATS,0.0,0.0
27,SIM,2,3M,False,MIKE FOUND EIGHT HOT CARDS,0.0,0.0
28,SIM,2,11M,True,SUE FOUND TEN RED GLOVES,0.0,0.0
28,SIM,2,9M,False,JANE SOLD FIVE NEW CARDS,0.0,0.0
29,SIM,2,5M,True,SUE SAW TWO BIG CARDS,0.0,0.0
29,SIM,2,2M,False,JANE SOLD TEN CHEAP BAGS,0.0,0.0
30,SIM,2,4M,True,SUE HELD EIGHT BIG PENS,0.0,0.0
30,SIM,2,3M,False,JILL BOUGHT THREE SMALL GLOVES,0.0,0.0
31,SIM,2,11M,True,SUE SOLD THREE BIG SOCKS,0.0,0.0
31,SIM,2,10M,False,SAM SAW SIX SMALL BAGS,0.0,0.0
32,SIM,2,8M,True,SUE TOOK SIX CHEAP SHOES,0.0,0.0
32,SIM,2,11M,False,SAM FOUND THREE HOT PENS,0.0,0.0
33,SIM,2,9M,True,SUE TOOK FOUR NEW TOYS,0.0,0.0
33,SIM,2,8M,False,LYNN HELD TWO HOT PENS,0.0,0.0
34,SIM,2,7M,True,SUE LOST THREE HOT GLOVES,0.0,0.0
34,SIM,2,11M,False,PAT SAW SIX GREEN HATS,0.0,0.0
35,SIM,2,5M,True,SUE LOST SIX OLD PENS,0.0,0.0
35,SIM,2,9M,False,PAT GAVE TWO GREEN BAGS,0.0,0.0
36,SIM,2,11M,True,SUE FOUND THREE BIG HATS,0.0,0.0
36,SIM,2,3M,False,LYNN HELD TEN HOT SOCKS,0.0,0.0
37,SIM,2,10M,True,SUE GAVE TEN BIG PENS,0.0,0.0
37,SIM,2,9M,False,JILL FOUND EIGHT NEW GLOVES,0.0,0.0
38,SIM,2,7M,True,SUE FOUND FOUR CHEAP SOCKS,0.0,0.0
38,SIM,2,10M,False,JANE GAVE THREE GREEN GLOVES,0.0,0.0
39,SIM,2,1M,True,SUE GAVE TEN OLD BAGS,0.0,0.0
39,SIM,2,8M,False,SAM BOUGHT THREE CHEAP SOCKS,0.0,0.0
40,SIM,2,9M,True,SUE SAW EIGHT GREEN TOYS,0.0,0.0
40,SIM,2,7M,False,JILL LOST FIVE OLD HATS,0.0,0.0
41,SIM,2,1M,True,SUE SAW NINE RED SOCKS,0.0,0.0
41,SIM,2,9M,False,SAM SOLD TWO OLD SHOES,0.0,0.0
42,SIM,2,5M,True,SUE BOUGHT TWO HOT BAGS,0.0,0.0
42,SIM,2,4M,False,PAT HELD SIX BIG TOYS,0.0,0.0
43,SIM,2,10M,True,SUE SOLD THREE RED HATS,0.0,0.0
43,SIM,2,1M,False,PAT LOST SIX NEW TOYS,0.0,0.0
44,SIM,2,9M,True,SUE TOOK FIVE RED GLOVES,0.0,0.0
44,SIM,2,5M,False,PAT SAW TEN CHEAP PENS,0.0,0.0
45,SIM,2,11M,True,SUE SAW FIVE OLD PENS,0.0,0.0
45,SIM,2,9M,False,SAM HELD FOUR NEW TOYS,0.0,0.0
46,SIM,2,9M,True,SUE HELD NINE OLD SOCKS,0.0,0.0
46,SIM,2,1M,False,JANE LOST SIX CHEAP CARDS,0.0,0.0
47,SIM,2,3M,True,SUE HELD THREE GREEN BAGS,0.0,0.0
47,SIM,2,8M,False,JILL GAVE EIGHT RED GLOVES,0.0,0.0
48,SIM,2,7M,True,SUE LOST FOUR OLD HATS,0.0,0.0
48,SIM,2,11M,False,MIKE SAW FIVE CHEAP SHOES,0.0,0.0
49,SIM,2,11M,True,SUE SOLD NINE BIG CARDS,0.0,0.0
49,SIM,2,7M,False,PAT BOUGHT FIVE RED GLOVES,0.0,0.0
50,SIM,2,1M,True,SUE FOUND EIGHT NEW SHOES,0.0,0.0
50,SIM,2,3M,False,JANE TOOK FOUR SMALL TOYS,0.0,0.0
51,SIM,2,9M,True,SUE SOLD NINE RED HATS,0.0,0.0
51,SIM,2,2M,False,JILL GAVE THREE CHEAP TOYS,0.0,0.0
52,SIM,2,8M,True,SUE BOUGHT TEN RED SHOES,0.0,0.0
52,SIM,2,4M,False,JANE TOOK TWO SMALL BAGS,0.0,0.0
53,SIM,2,11M,True,SUE LOST SIX BIG TOYS,0.0,0.0
53,SIM,2,5M,False,JILL HELD FIVE OLD PENS,0.0,0.0
54,SIM,2,2M,True,SUE BOUGHT FOUR RED HATS,0.0,0.0
54,SIM,2,4M,False,SAM TOOK TEN BIG BAGS,0.0,0.0
55,SIM,2,1M,True,SUE SAW SIX GREEN HATS,0.0,0.0
55,SIM,2,4M,False,PAT SOLD NINE SMALL GLOVES,0.0,0.0
56,SIM,2,5M,True,SUE TOOK FOUR HOT SHOES,0.0,0.0
56,SIM,2,9M,False,JANE LOST SIX GREEN GLOVES,0.0,0.0
57,SIM,2,10M,True,SUE TOOK SIX HOT CARDS,0.0,0.0
57,SIM,2,3M,False,BOB HELD FOUR BIG PENS,0.0,0.0
58,SIM,2,7M,True,SUE LOST TWO RED SOCKS,0.0,0.0
58,SIM,2,8M,False,JILL SAW TEN GREEN SHOES,0.0,0.0
59,SIM,2,3M,True,SUE FOUND THREE CHEAP CARDS,0.0,0.0
59,SIM,2,1M,False,LYNN BOUGHT SIX GREEN SOCKS,0.0,0.0
60,SIM,2,11M,True,SUE GAVE FOUR BIG GLOVES,0.0,0.0
60,SIM,2,1M,False,JILL FOUND NINE HOT TOYS,0.0,0.0
61,SIM,2,2M,True,SUE TOOK NINE RED SOCKS,0.0,0.0
61,SIM,2,7M,False,BOB SAW TWO BIG HATS,0.0,0.0
62,SIM,2,2M,True,SUE LOST THREE BIG TOYS,0.0,0.0
62,SIM,2,10M,False,BOB SAW TEN CHEAP SOCKS,0.0,0.0
63,SIM,2,4M,True,SUE TOOK EIGHT HOT GLOVES,0.0,0.0
63,SIM,2,5M,False,JANE HELD FOUR GREEN BAGS,0.0,0.0
64,SIM,2,1M,True,SUE BOUGHT THREE SMALL TOYS,0.0,0.0
64,SIM,2,10M,False,MIKE LOST TWO CHEAP SOCKS,0.0,0.0
65,SIM,2,2M,True,SUE FOUND FOUR CHEAP GLOVES,0.0,0.0
65,SIM,2,11M,False,JILL LOST TEN SMALL CARDS,0.0,0.0
66,SIM,2,3M,True,SUE FOUND FOUR HOT SHOES,0.0,0.0
66,SIM,2,7M,False,JILL BOUGHT EIGHT GREEN PENS,0.0,0.0
67,SIM,2,2M,True,SUE BOUGHT THREE NEW SOCKS,0.0,0.0
67,SIM,2,4M,False,BOB LOST TWO HOT SHOES,0.0,0.0
68,SIM,2,3M,True,SUE HELD FOUR HOT PENS,0.0,0.0
68,SIM,2,4M,False,JILL FOUND NINE RED HATS,0.0,0.0
69,SIM,2,3M,True,SUE SAW EIGHT GREEN BAGS,0.0,0.0
69,SIM,2,1M,False,JILL FOUND THREE OLD HATS,0.0,0.0
70,SIM,2,7M,True,SUE FOUND TEN RED CARDS,0.0,0.0
70,SIM,2,9M,False,PAT BOUGHT EIGHT OLD HATS,0.0,0.0
71,SIM,2,7M,True,SUE SAW SIX RED SOCKS,0.0,0.0
71,SIM,2,9M,False,BOB TOOK FIVE SMALL CARDS,0.0,0.0
72,SIM,2,7M,True,SUE TOOK TEN RED GLOVES,0.0,0.0
72,SIM,2,2M,False,LYNN HELD FOUR GREEN SHOES,0.0,0.0
73,SIM,2,7M,True,SUE LOST TEN CHEAP SHOES,0.0,0.0
73,SIM,2,4M,False,PAT TOOK SIX NEW TOYS,0.0,0.0
74,SIM,2,2M,True,SUE LOST TEN SMALL TOYS,0.0,0.0
74,SIM,2,4M,False,MIKE FOUND TWO NEW HATS,0.0,0.0
75,SIM,2,1M,True,SUE LOST SIX NEW SHOES,0.0,0.0
75,SIM,2,3M,False,BOB TOOK FOUR CHEAP GLOVES,0.0,0.0
76,SIM,2,3M,True,SUE FOUND NINE GREEN CARDS,0.0,0.0
76,SIM,2,9M,False,PAT SAW TEN HOT HATS,0.0,0.0
77,SIM,2,5M,True,SUE FOUND THREE GREEN BAGS,0.0,0.0
77,SIM,2,11M,False,JANE SOLD NINE SMALL PENS,0.0,0.0
78,SIM,2,7M,True,SUE BOUGHT SIX GREEN GLOVES,0.0,0.0
78,SIM,2,11M,False,SAM TOOK TWO CHEAP SHOES,0.0,0.0
79,SIM,2,9M,True,SUE SOLD TEN SMALL CARDS,0.0,0.0
79,SIM,2,2M,False,MIKE BOUGHT THREE OLD BAGS,0.0,0.0
80,SIM,2,2M,True,SUE HELD FOUR SMALL CARDS,0.0,0.0
80,SIM,2,1M,False,LYNN TOOK FIVE RED BAGS,0.0,0.0
81,SIM,2,3M,True,SUE SAW FIVE HOT SHOES,0.0,0.0
81,SIM,2,9M,False,MIKE HELD EIGHT NEW SOCKS,0.0,0.0
82,SIM,2,9M,True,SUE BOUGHT THREE NEW CARDS,0.0,0.0
82,SIM,2,10M,False,PAT SAW EIGHT GREEN PENS,0.0,0.0
83,SIM,2,4M,True,SUE SAW THREE RED PENS,0.0,0.0
83,SIM,2,10M,False,BOB TOOK TEN HOT SOCKS,0.0,0.0
84,SIM,2,11M,True,SUE SOLD SIX OLD SOCKS,0.0,0.0
84,SIM,2,3M,False,JANE TOOK TWO RED PENS,0.0,0.0
85,SIM,2,5M,True,SUE LOST TWO GREEN BAGS,0.0,0.0
85,SIM,2,8M,False,SAM FOUND TEN OLD GLOVES,0.0,0.0
86,SIM,2,9M,True,SUE GAVE FIVE RED SOCKS,0.0,0.0
86,SIM,2,7M,False,SAM LOST THREE BIG SHOES,0.0,0.0
87,SIM,2,8M,True,SUE FOUND TEN NEW TOYS,0.0,0.0
87,SIM,2,4M,False,PAT SOLD THREE SMALL BAGS,0.0,0.0
88,SIM,2,2M,True,SUE HELD FIVE HOT GLOVES,0.0,0.0
88,SIM,2,10M,False,LYNN TOOK EIGHT SMALL SHOES,0.0,0.0
89,SIM,2,7M,True,SUE SAW EIGHT BIG PENS,0.0,0.0
89,SIM,2,3M,False,LYNN GAVE SIX SMALL HATS,0.0,0.0
90,SIM,2,4M,True,SUE HELD NINE SMALL BAGS,0.0,0.0
90,SIM,2,9M,False,MIKE FOUND EIGHT BIG CARDS,0.0,0.0
91,SIM,2,1M,True,SUE SOLD FIVE CHEAP HATS,0.0,0.0
91,SIM,2,10M,False,LYNN FOUND FOUR NEW BAGS,0.0,0.0
92,SIM,2,11M,True,SUE SOLD SIX BIG TOYS,0.0,0.0
92,SIM,2,3M,False,BOB HELD EIGHT NEW SOCKS,0.0,0.0
93,SIM,2,5M,True,SUE SOLD NINE SMALL SOCKS,0.0,0.0
93,SIM,2,9M,False,JILL SAW SIX RED SHOES,0.0,0.0
94,SIM,2,4M,True,SUE LOST FOUR OLD SOCKS,0.0,0.0
94,SIM,2,1M,False,SAM HELD FIVE CHEAP GLOVES,0.0,0.0
95,SIM,2,5M,True,SUE SAW TEN SMALL SHOES,0.0,0.0
95,SIM,2,8M,False,MIKE TOOK FIVE RED CARDS,0.0,0.0
96,SIM,2,5M,True,SUE TOOK THREE HOT SOCKS,0.0,0.0
96,SIM,2,2M,False,JILL BOUGHT NINE OLD GLOVES,0.0,0.0
97,SIM,2,4M,True,SUE GAVE FOUR GREEN HATS,0.0,0.0
97,SIM,2,5M,False,SAM SOLD SIX SMALL SOCKS,0.0,0.0
98,SIM,2,7M,True,SUE LOST THREE BIG CARDS,0.0,0.0
98,SIM,2,11M,False,JILL HELD FIVE RED TOYS,0.0,0.0
99,SIM,2,7M,True,SUE SAW TWO OLD GLOVES,0.0,0.0
99,SIM,2,4M,False,BOB SOLD FOUR NEW PENS,0.0,0.0
100,SIM,2,9M,True,SUE HELD FIVE RED GLOVES,0.0,90.0
100,SIM,2,3M,False,BOB SOLD TEN NEW TOYS,0.0,-90.0
101,SIM,2,1M,True,SUE LOST EIGHT CHEAP PENS,0.0,-90.0
101,SIM,2,5M,False,LYNN SAW SIX RED BAGS,0.0,90.0
102,SIM,2,1M,True,SUE GAVE SIX BIG PENS,0.0,90.0
102,SIM,2,10M,False,SAM BOUGHT TEN NEW GLOVES,0.0,-90.0
103,SIM,2,7M,True,SUE HELD THREE BIG HATS,0.0,90.0
103,SIM,2,10M,False,PAT FOUND NINE RED TOYS,0.0,-90.0
104,SIM,2,5M,True,SUE TOOK SIX BIG HATS,0.0,-90.0
104,SIM,2,1M,False,PAT SAW EIGHT HOT BAGS,0.0,90.0
105,SIM,2,9M,True,SUE SOLD THREE NEW BAGS,0.0,90.0
105,SIM,2,3M,False,PAT LOST SIX SMALL TOYS,0.0,-90.0
106,SIM,2,8M,True,SUE GAVE EIGHT CHEAP TOYS,0.0,90.0
106,SIM,2,7M,False,JANE BOUGHT TEN HOT CARDS,0.0,-90.0
107,SIM,2,1M,True,SUE SAW THREE GREEN BAGS,0.0,90.0
107,SIM,2,7M,False,MIKE HELD SIX BIG SHOES,0.0,-90.0
108,SIM,2,7M,True,SUE TOOK FIVE CHEAP GLOVES,0.0,-90.0
108,SIM,2,8M,False,MIKE HELD THREE NEW TOYS,0.0,90.0
109,SIM,2,10M,True,SUE LOST THREE NEW PENS,0.0,-90.0
109,SIM,2,3M,False,BOB FOUND EIGHT RED HATS,0.0,90.0
110,SIM,2,10M,True,SUE LOST FOUR BIG GLOVES,0.0,-90.0
110,SIM,2,8M,False,BOB SOLD NINE GREEN CARDS,0.0,90.0
111,SIM,2,7M,True,SUE GAVE TWO OLD BAGS,0.0,90.0
111,SIM,2,10M,False,JANE BOUGHT THREE RED CARDS,0.0,-90.0
112,SIM,2,9M,True,SUE SAW FIVE SMALL GLOVES,0.0,-90.0
112,SIM,2,7M,False,SAM TOOK EIGHT GREEN SHOES,0.0,90.0
113,SIM,2,1M,True,SUE TOOK TEN OLD BAGS,0.0,-90.0
113,SIM,2,11M,False,JILL HELD EIGHT RED PENS,0.0,90.0
114,SIM,2,1M,True,SUE SOLD FIVE CHEAP GLOVES,0.0,90.0
114,SIM,2,7M,False,SAM HELD TWO RED SHOES,0.0,-90.0
115,SIM,2,5M,True,SUE TOOK TEN OLD TOYS,0.0,-90.0
115,SIM,2,1M,False,MIKE SOLD NINE SMALL PENS,0.0,90.0
116,SIM,2,8M,True,SUE TOOK FIVE RED TOYS,0.0,-90.0
116,SIM,2,9M,False,JANE HELD FOUR BIG HATS,0.0,90.0
117,SIM,2,1M,True,SUE FOUND TEN RED PENS,0.0,90.0
117,SIM,2,10M,False,LYNN LOST FOUR HOT HATS,0.0,-90.0
118,SIM,2,1M,True,SUE LOST TEN CHEAP PENS,0.0,90.0
118,SIM,2,7M,False,BOB SOLD TWO OLD GLOVES,0.0,-90.0
119,SIM,2,5M,True,SUE TOOK TEN GREEN TOYS,0.0,-90.0
119,SIM,2,2M,False,JILL SOLD NINE NEW PENS,0.0,90.0
120,SIM,2,11M,True,SUE SAW TEN NEW PENS,0.0,-90.0
120,SIM,2,9M,False,JANE FOUND TWO GREEN CARDS,0.0,90.0
121,SIM,2,4M,True,SUE GAVE SIX BIG TOYS,0.0,-90.0
121,SIM,2,7M,False,PAT HELD EIGHT NEW SHOES,0.0,90.0
122,SIM,2,4M,True,SUE TOOK NINE HOT SOCKS,0.0,90.0
122,SIM,2,8M,False,BOB HELD FOUR BIG SHOES,0.0,-90.0
123,SIM,2,3M,True,SUE LOST TEN SMALL CARDS,0.0,-90.0
123,SIM,2,8M,False,BOB HELD NINE HOT SOCKS,0.0,90.0
124,SIM,2,2M,True,SUE SAW FIVE HOT GLOVES,0.0,-90.0
124,SIM,2,7M,False,BOB GAVE TWO SMALL SOCKS,0.0,90.0
125,SIM,2,2M,True,SUE SAW EIGHT HOT HATS,0.0,90.0
125,SIM,2,4M,False,LYNN BOUGHT SIX RED PENS,0.0,-90.0
126,SIM,2,4M,True,SUE SOLD EIGHT OLD SHOES,0.0,-90.0
126,SIM,2,1M,False,JANE HELD TEN RED BAGS,0.0,90.0
127,SIM,2,10M,True,SUE FOUND SIX OLD PENS,0.0,-90.0
127,SIM,2,9M,False,LYNN TOOK EIGHT NEW SHOES,0.0,90.0
128,SIM,2,11M,True,SUE SAW NINE BIG SOCKS,0.0,90.0
128,SIM,2,9M,False,PAT SOLD TWO SMALL HATS,0.0,-90.0
129,SIM,2,10M,True,SUE HELD TWO BIG SOCKS,0.0,-90.0
129,SIM,2,5M,False,PAT FOUND SIX CHEAP BAGS,0.0,90.0
130,SIM,2,9M,True,SUE TOOK SIX NEW BAGS,0.0,-90.0
130,SIM,2,7M,False,PAT HELD TEN RED CARDS,0.0,90.0
131,SIM,2,3M,True,SUE BOUGHT THREE GREEN SHOES,0.0,90.0
131,SIM,2,7M,False,BOB FOUND EIGHT NEW GLOVES,0.0,-90.0
132,SIM,2,7M,True,SUE FOUND SIX GREEN TOYS,0.0,90.0
132,SIM,2,5M,False,BOB GAVE EIGHT OLD SHOES,0.0,-90.0
133,SIM,2,11M,True,SUE GAVE TWO NEW HATS,0.0,-90.0
133,SIM,2,5M,False,PAT FOUND TEN SMALL GLOVES,0.0,90.0
134,SIM,2,9M,True,SUE SOLD TEN RED PENS,0.0,90.0
134,SIM,2,8M,False,MIKE LOST EIGHT NEW CARDS,0.0,-90.0
135,SIM,2,3M,True,SUE GAVE NINE SMALL CARDS,0.0,90.0
135,SIM,2,5M,False,BOB SOLD THREE CHEAP BAGS,0.0,-90.0
136,SIM,2,9M,True,SUE HELD FIVE HOT SOCKS,0.0,-90.0
136,SIM,2,2M,False,LYNN BOUGHT NINE GREEN CARDS,0.0,90.0
137,SIM,2,11M,True,SUE SOLD FIVE CHEAP CARDS,0.0,90.0
137,SIM,2,5M,False,SAM TOOK SIX GREEN SHOES,0.0,-90.0
138,SIM,2,2M,True,SUE LOST THREE RED GLOVES,0.0,90.0
138,SIM,2,3M,False,PAT BOUGHT FOUR SMALL BAGS,0.0,-90.0
139,SIM,2,11M,True,SUE LOST FIVE CHEAP TOYS,0.0,90.0
139,SIM,2,5M,False,BOB TOOK THREE SMALL GLOVES,0.0,-90.0
140,SIM,2,8M,True,SUE TOOK NINE NEW SHOES,0.0,90.0
140,SIM,2,11M,False,JILL LOST SIX HOT BAGS,0.0,-90.0
141,SIM,2,2M,True,SUE FOUND EIGHT SMALL TOYS,0.0,90.0
141,SIM,2,10M,False,SAM HELD NINE NEW CARDS,0.0,-90.0
142,SIM,2,10M,True,SUE SAW TEN BIG SOCKS,0.0,90.0
142,SIM,2,4M,False,PAT LOST SIX OLD PENS,0.0,-90.0
143,SIM,2,4M,True,SUE HELD TEN RED SHOES,0.0,-90.0
143,SIM,2,7M,False,JILL BOUGHT THREE BIG CARDS,0.0,90.0
144,SIM,2,10M,True,SUE GAVE EIGHT CHEAP CARDS,0.0,90.0
144,SIM,2,11M,False,MIKE BOUGHT FIVE GREEN HATS,0.0,-90.0
145,SIM,2,9M,True,SUE TOOK TEN SMALL TOYS,0.0,90.0
145,SIM,2,2M,False,JILL BOUGHT THREE HOT CARDS,0.0,-90.0
146,SIM,2,11M,True,SUE BOUGHT FOUR CHEAP HATS,0.0,90.0
146,SIM,2,9M,False,LYNN HELD EIGHT GREEN SHOES,0.0,-90.0
147,SIM,2,4M,True,SUE LOST EIGHT RED SHOES,0.0,90.0
147,SIM,2,11M,False,SAM GAVE FOUR OLD CARDS,0.0,-90.0
148,SIM,2,10M,True,SUE HELD TEN HOT CARDS,0.0,90.0
148,SIM,2,2M,False,MIKE GAVE TWO CHEAP SHOES,0.0,-90.0
149,SIM,2,4M,True,SUE LOST TWO HOT HATS,0.0,90.0
149,SIM,2,10M,False,SAM GAVE SIX OLD TOYS,0.0,-90.0
150,SIM,2,5M,True,SUE TOOK TWO NEW TOYS,0.0,-90.0
150,SIM,2,1M,False,JANE FOUND THREE GREEN SOCKS,0.0,90.0
151,SIM,2,7M,True,SUE GAVE FOUR NEW PENS,0.0,90.0
151,SIM,2,9M,False,JILL SAW EIGHT BIG GLOVES,0.0,-90.0
152,SIM,2,2M,True,SUE BOUGHT TEN NEW BAGS,0.0,-90.0
152,SIM,2,1M,False,SAM TOOK FOUR CHEAP PENS,0.0,90.0
153,SIM,2,2M,True,SUE TOOK FIVE OLD HATS,0.0,90.0
153,SIM,2,1M,False,PAT SOLD NINE RED PENS,0.0,-90.0
154,SIM,2,8M,True,SUE HELD NINE OLD GLOVES,0.0,-90.0
154,SIM,2,10M,False,BOB BOUGHT TEN GREEN PENS,0.0,90.0
155,SIM,2,3M,True,SUE SOLD EIGHT OLD PENS,0.0,-90.0
155,SIM,2,7M,False,SAM FOUND TEN GREEN CARDS,0.0,90.0
156,SIM,2,7M,True,SUE GAVE TWO BIG CARDS,0.0,90.0
156,SIM,2,5M,False,JANE BOUGHT THREE RED GLOVES,0.0,-90.0
157,SIM,2,2M,True,SUE SOLD FOUR RED SHOES,0.0,-90.0
157,SIM,2,11M,False,JANE TOOK NINE CHEAP TOYS,0.0,90.0
158,SIM,2,11M,True,SUE BOUGHT EIGHT RED SOCKS,0.0,-90.0
158,SIM,2,10M,False,PAT HELD TEN CHEAP GLOVES,0.0,90.0
159,SIM,2,3M,True,SUE BOUGHT FIVE GREEN BAGS,0.0,90.0
159,SIM,2,10M,False,MIKE SAW NINE CHEAP TOYS,0.0,-90.0
160,SIM,2,2M,True,SUE SOLD TWO RED GLOVES,0.0,-90.0
160,SIM,2,7M,False,PAT GAVE NINE SMALL PENS,0.0,90.0
161,SIM,2,4M,True,SUE HELD FOUR RED TOYS,0.0,90.0
161,SIM,2,1M,False,MIKE GAVE TWO SMALL GLOVES,0.0,-90.0
162,SIM,2,3M,True,SUE LOST THREE OLD GLOVES,0.0,90.0
162,SIM,2,5M,False,LYNN SAW TWO RED BAGS,0.0,-90.0
163,SIM,2,1M,True,SUE BOUGHT FIVE OLD SOCKS,0.0,-90.0
163,SIM,2,10M,False,JILL SOLD THREE CHEAP HATS,0.0,90.0
164,SIM,2,4M,True,SUE LOST TWO BIG PENS,0.0,-90.0
164,SIM,2,9M,False,MIKE HELD NINE CHEAP HATS,0.0,90.0
165,SIM,2,10M,True,SUE TOOK TEN CHEAP PENS,0.0,-90.0
165,SIM,2,5M,False,MIKE SOLD FOUR BIG GLOVES,0.0,90.0
166,SIM,2,9M,True,SUE LOST NINE GREEN BAGS,0.0,-90.0
166,SIM,2,4M,False,MIKE SOLD THREE OLD CARDS,0.0,90.0
167,SIM,2,11M,True,SUE HELD NINE NEW BAGS,0.0,90.0
167,SIM,2,1M,False,SAM SAW FIVE HOT TOYS,0.0,-90.0
168,SIM,2,9M,True,SUE GAVE FIVE SMALL CARDS,0.0,-90.0
168,SIM,2,10M,False,JILL FOUND TWO NEW SOCKS,0.0,90.0
169,SIM,2,10M,True,SUE BOUGHT FOUR CHEAP SOCKS,0.0,90.0
169,SIM,2,11M,False,PAT HELD SIX SMALL BAGS,0.0,-90.0
170,SIM,2,2M,True,SUE TOOK EIGHT SMALL TOYS,0.0,90.0
170,SIM,2,1M,False,JILL SAW TWO RED SHOES,0.0,-90.0
171,SIM,2,1M,True,SUE LOST EIGHT RED GLOVES,0.0,-90.0
171,SIM,2,4M,False,PAT HELD SIX BIG HATS,0.0,90.0
172,SIM,2,1M,True,SUE LOST FOUR GREEN GLOVES,0.0,-90.0
172,SIM,2,9M,False,JILL TOOK NINE CHEAP PENS,0.0,90.0
173,SIM,2,5M,True,SUE LOST FOUR GREEN HATS,0.0,-90.0
173,SIM,2,9M,False,JANE SOLD FIVE CHEAP PENS,0.0,90.0
174,SIM,2,1M,True,SUE LOST THREE BIG CARDS,0.0,-90.0
174,SIM,2,5M,False,BOB TOOK TEN HOT HATS,0.0,90.0
175,SIM,2,10M,True,SUE TOOK EIGHT BIG SOCKS,0.0,90.0
175,SIM,2,8M,False,MIKE LOST SIX RED PENS,0.0,-90.0
176,SIM,2,11M,True,SUE SAW TEN SMALL PENS,0.0,90.0
176,SIM,2,10M,False,SAM TOOK TWO GREEN TOYS,0.0,-90.0
177,SIM,2,4M,True,SUE HELD FIVE OLD PENS,0.0,90.0
177,SIM,2,11M,False,PAT LOST SIX HOT CARDS,0.0,-90.0
178,SIM,2,5M,True,SUE SOLD FOUR CHEAP PENS,0.0,-90.0
178,SIM,2,10M,False,PAT TOOK TEN RED TOYS,0.0,90.0
179,SIM,2,8M,True,SUE LOST FIVE GREEN BAGS,0.0,90.0
179,SIM,2,4M,False,LYNN SOLD SIX RED SOCKS,0.0,-90.0
180,SIM,2,3M,True,SUE BOUGHT EIGHT SMALL CARDS,0.0,90.0
180,SIM,2,11M,False,LYNN LOST NINE NEW PENS,0.0,-90.0
181,SIM,2,5M,True,SUE SAW FOUR BIG CARDS,0.0,90.0
181,SIM,2,2M,False,JILL LOST NINE CHEAP HATS,0.0,-90.0
182,SIM,2,11M,True,SUE FOUND SIX NEW GLOVES,0.0,-90.0
182,SIM,2,3M,False,JANE LOST EIGHT CHEAP BAGS,0.0,90.0
183,SIM,2,11M,True,SUE FOUND FIVE CHEAP BAGS,0.0,-90.0
183,SIM,2,8M,False,SAM HELD SIX SMALL GLOVES,0.0,90.0
184,SIM,2,10M,True,SUE LOST FOUR OLD TOYS,0.0,90.0
184,SIM,2,1M,False,JANE TOOK THREE BIG GLOVES,0.0,-90.0
185,SIM,2,9M,True,SUE LOST EIGHT SMALL SHOES,0.0,-90.0
185,SIM,2,1M,False,SAM SOLD NINE RED CARDS,0.0,90.0
186,SIM,2,2M,True,SUE BOUGHT EIGHT HOT PENS,0.0,90.0
186,SIM,2,5M,False,LYNN FOUND THREE NEW SHOES,0.0,-90.0
187,SIM,2,5M,True,SUE TOOK THREE NEW GLOVES,0.0,90.0
187,SIM,2,1M,False,JILL GAVE TEN GREEN PENS,0.0,-90.0
188,SIM,2,5M,True,SUE BOUGHT FOUR HOT CARDS,0.0,90.0
188,SIM,2,4M,False,SAM LOST NINE GREEN BAGS,0.0,-90.0
189,SIM,2,1M,True,SUE SOLD NINE OLD GLOVES,0.0,90.0
189,SIM,2,9M,False,LYNN TOOK TWO CHEAP PENS,0.0,-90.0
190,SIM,2,9M,True,SUE BOUGHT SIX GREEN TOYS,0.0,90.0
190,SIM,2,2M,False,BOB TOOK EIGHT NEW SOCKS,0.0,-90.0
191,SIM,2,4M,True,SUE TOOK THREE GREEN PENS,0.0,90.0
191,SIM,2,11M,False,JILL FOUND TWO HOT SOCKS,0.0,-90.0
192,SIM,2,4M,True,SUE SOLD FOUR OLD PENS,0.0,-90.0
192,SIM,2,10M,False,PAT FOUND FIVE NEW CARDS,0.0,90.0
193,SIM,2,3M,True,SUE BOUGHT TEN HOT HATS,0.0,-90.0
193,SIM,2,1M,False,PAT LOST TWO SMALL CARDS,0.0,90.0
194,SIM,2,5M,True,SUE FOUND TEN RED TOYS,0.0,90.0
194,SIM,2,2M,False,MIKE BOUGHT THREE OLD SHOES,0.0,-90.0
195,SIM,2,8M,True,SUE HELD FOUR HOT BAGS,0.0,-90.0
195,SIM,2,2M,False,SAM FOUND EIGHT GREEN GLOVES,0.0,90.0
196,SIM,2,5M,True,SUE SAW NINE OLD SOCKS,0.0,90.0
196,SIM,2,8M,False,BOB TOOK TEN RED TOYS,0.0,-90.0
197,SIM,2,9M,True,SUE TOOK SIX HOT SHOES,0.0,90.0
197,SIM,2,11M,False,SAM BOUGHT TWO NEW CARDS,0.0,-90.0
198,SIM,2,11M,True,SUE SOLD NINE CHEAP BAGS,0.0,90.0
198,SIM,2,10M,False,JANE BOUGHT SIX OLD SHOES,0.0,-90.0
199,SIM,2,5M,True,SUE LOST EIGHT OLD SOCKS,0.0,90.0
199,SIM,2,9M,False,JANE SOLD FOUR RED BAGS,0.0,-90.0
200,SIM,2,4M,True,SUE LOST TWO HOT TOYS,0.5,-90.0
200,SIM,2,10M,False,BOB BOUGHT EIGHT RED SHOES,0.5,90.0
201,SIM,2,5M,True,SUE FOUND TEN NEW BAGS,0.5,90.0
201,SIM,2,9M,False,JANE BOUGHT SIX GREEN SHOES,0.5,-90.0
202,SIM,2,10M,True,SUE LOST NINE OLD CARDS,0.5,-90.0
202,SIM,2,5M,False,JILL HELD TEN GREEN TOYS,0.5,90.0
203,SIM,2,8M,True,SUE GAVE NINE CHEAP SHOES,0.5,90.0
203,SIM,2,4M,False,LYNN BOUGHT EIGHT SMALL HATS,0.5,-90.0
204,SIM,2,9M,True,SUE SOLD NINE BIG GLOVES,0.5,-90.0
204,SIM,2,10M,False,JANE LOST TWO SMALL TOYS,0.5,90.0
205,SIM,2,7M,True,SUE FOUND THREE NEW BAGS,0.5,-90.0
205,SIM,2,3M,False,LYNN SAW TEN CHEAP SHOES,0.5,90.0
206,SIM,2,2M,True,SUE SAW TEN GREEN SOCKS,0.5,90.0
206,SIM,2,4M,False,JANE TOOK NINE OLD TOYS,0.5,-90.0
207,SIM,2,8M,True,SUE GAVE FOUR SMALL SOCKS,0.5,-90.0
207,SIM,2,5M,False,JILL LOST NINE BIG PENS,0.5,90.0
208,SIM,2,2M,True,SUE BOUGHT THREE NEW GLOVES,0.5,-90.0
208,SIM,2,11M,False,PAT GAVE FIVE OLD TOYS,0.5,90.0
209,SIM,2,3M,True,SUE BOUGHT FOUR RED BAGS,0.5,-90.0
209,SIM,2,10M,False,PAT SAW TEN CHEAP GLOVES,0.5,90.0
210,SIM,2,5M,True,SUE LOST NINE HOT CARDS,0.5,90.0
210,SIM,2,11M,False,MIKE TOOK FOUR CHEAP SOCKS,0.5,-90.0
211,SIM,2,11M,True,SUE GAVE FIVE CHEAP CARDS,0.5,90.0
211,SIM,2,7M,False,LYNN SOLD TEN OLD GLOVES,0.5,-90.0
212,SIM,2,8M,True,SUE SOLD FOUR GREEN SOCKS,0.5,-90.0
212,SIM,2,9M,False,SAM BOUGHT TWO CHEAP GLOVES,0.5,90.0
213,SIM,2,2M,True,SUE BOUGHT THREE RED GLOVES,0.5,90.0
213,SIM,2,7M,False,BOB SAW TWO SMALL HATS,0.5,-90.0
214,SIM,2,5M,True,SUE TOOK SIX OLD CARDS,0.5,90.0
214,SIM,2,8M,False,PAT SOLD FOUR GREEN TOYS,0.5,-90.0
215,SIM,2,2M,True,SUE SAW NINE GREEN BAGS,0.5,90.0
215,SIM,2,8M,False,MIKE HELD FIVE CHEAP PENS,0.5,-90.0
216,SIM,2,8M,True,SUE GAVE THREE BIG PENS,0.5,-90.0
216,SIM,2,2M,False,BOB TOOK SIX HOT BAGS,0.5,90.0
217,SIM,2,8M,True,SUE TOOK THREE CHEAP SOCKS,0.5,90.0
217,SIM,2,4M,False,SAM GAVE FOUR GREEN TOYS,0.5,-90.0
218,SIM,2,5M,True,SUE BOUGHT THREE CHEAP SHOES,0.5,90.0
218,SIM,2,1M,False,BOB SOLD FOUR SMALL BAGS,0.5,-90.0
219,SIM,2,4M,True,SUE LOST FOUR NEW HATS,0.5,90.0
219,SIM,2,2M,False,PAT HELD NINE RED TOYS,0.5,-90.0
220,SIM,2,5M,True,SUE FOUND TEN CHEAP PENS,0.5,-90.0
220,SIM,2,4M,False,MIKE BOUGHT NINE NEW TOYS,0.5,90.0
221,SIM,2,9M,True,SUE SOLD FIVE BIG TOYS,0.5,90.0
221,SIM,2,4M,False,JANE GAVE NINE NEW GLOVES,0.5,-90.0
222,SIM,2,4M,True,SUE FOUND SIX SMALL HATS,0.5,-90.0
222,SIM,2,11M,False,PAT SAW TEN HOT SHOES,0.5,90.0
223,SIM,2,4M,True,SUE GAVE SIX CHEAP HATS,0.5,-90.0
223,SIM,2,3M,False,MIKE HELD EIGHT GREEN PENS,0.5,90.0
224,SIM,2,8M,True,SUE LOST TEN OLD SHOES,0.5,90.0
224,SIM,2,11M,False,BOB TOOK NINE RED CARDS,0.5,-90.0
225,SIM,2,1M,True,SUE FOUND TEN NEW CARDS,0.5,90.0
225,SIM,2,9M,False,BOB GAVE TWO CHEAP SHOES,0.5,-90.0
226,SIM,2,3M,True,SUE FOUND EIGHT RED HATS,0.5,-90.0
226,SIM,2,10M,False,JANE TOOK FIVE GREEN CARDS,0.5,90.0
227,SIM,2,10M,True,SUE HELD NINE CHEAP BAGS,0.5,-90.0
227,SIM,2,4M,False,PAT SAW SIX NEW CARDS,0.5,90.0
228,SIM,2,10M,True,SUE SOLD THREE NEW TOYS,0.5,90.0
228,SIM,2,2M,False,JILL TOOK TEN SMALL PENS,0.5,-90.0
229,SIM,2,3M,True,SUE HELD THREE RED SOCKS,0.5,-90.0
229,SIM,2,2M,False,LYNN FOUND EIGHT CHEAP PENS,0.5,90.0
230,SIM,2,5M,True,SUE HELD FIVE SMALL HATS,0.5,-90.0
230,SIM,2,9M,False,PAT SOLD THREE RED GLOVES,0.5,90.0
231,SIM,2,8M,True,SUE BOUGHT TWO BIG PENS,0.5,-90.0
231,SIM,2,9M,False,MIKE LOST FOUR NEW TOYS,0.5,90.0
232,SIM,2,1M,True,SUE SOLD FIVE OLD PENS,0.5,-90.0
232,SIM,2,8M,False,JILL BOUGHT NINE NEW SOCKS,0.5,90.0
233,SIM,2,3M,True,SUE LOST EIGHT OLD CARDS,0.5,-90.0
233,SIM,2,2M,False,PAT SAW TWO NEW GLOVES,0.5,90.0
234,SIM,2,1M,True,SUE SAW SIX SMALL BAGS,0.5,90.0
234,SIM,2,4M,False,SAM HELD TEN CHEAP GLOVES,0.5,-90.0
235,SIM,2,8M,True,SUE HELD FOUR BIG SOCKS,0.5,-90.0
235,SIM,2,11M,False,BOB LOST TEN GREEN SHOES,0.5,90.0
236,SIM,2,11M,True,SUE FOUND FOUR CHEAP TOYS,0.5,-90.0
236,SIM,2,9M,False,JILL HELD THREE OLD SOCKS,0.5,90.0
237,SIM,2,10M,True,SUE HELD EIGHT HOT GLOVES,0.5,-90.0
237,SIM,2,1M,False,PAT SOLD THREE BIG BAGS,0.5,90.0
238,SIM,2,5M,True,SUE SOLD EIGHT NEW BAGS,0.5,-90.0
238,SIM,2,8M,False,SAM GAVE TEN CHEAP TOYS,0.5,90.0
239,SIM,2,2M,True,SUE FOUND EIGHT SMALL CARDS,0.5,90.0
239,SIM,2,10M,False,SAM LOST THREE OLD SOCKS,0.5,-90.0
240,SIM,2,3M,True,SUE HELD FOUR SMALL PENS,0.5,90.0
240,SIM,2,7M,False,LYNN SAW NINE BIG GLOVES,0.5,-90.0
241,SIM,2,11M,True,SUE HELD SIX GREEN GLOVES,0.5,-90.0
241,SIM,2,2M,False,BOB TOOK TEN OLD BAGS,0.5,90.0
242,SIM,2,8M,True,SUE SOLD EIGHT BIG TOYS,0.5,-90.0
242,SIM,2,7M,False,SAM SAW THREE OLD HATS,0.5,90.0
243,SIM,2,7M,True,SUE SOLD NINE BIG CARDS,0.5,90.0
243,SIM,2,1M,False,SAM SAW EIGHT CHEAP SOCKS,0.5,-90.0
244,SIM,2,8M,True,SUE TOOK FIVE BIG TOYS,0.5,90.0
244,SIM,2,5M,False,PAT HELD NINE CHEAP GLOVES,0.5,-90.0
245,SIM,2,1M,True,SUE BOUGHT TEN CHEAP TOYS,0.5,90.0
245,SIM,2,4M,False,PAT GAVE TWO HOT PENS,0.5,-90.0
246,SIM,2,1M,True,SUE FOUND FIVE RED CARDS,0.5,-90.0
246,SIM,2,11M,False,PAT TOOK THREE SMALL GLOVES,0.5,90.0
247,SIM,2,8M,True,SUE SAW FIVE SMALL BAGS,0.5,-90.0
247,SIM,2,2M,False,MIKE GAVE EIGHT BIG PENS,0.5,90.0
248,SIM,2,9M,True,SUE GAVE NINE GREEN BAGS,0.5,90.0
248,SIM,2,2M,False,MIKE BOUGHT SIX NEW HATS,0.5,-90.0
